;full name;job;email;domain;phone;company;text;integer;address
0;туятвзеуотиньыеовошр лязщсиаовытзйтснядск;"ОАО ""оеьяолшиньзтпнойвапп""";nrsfesyigxhugmwbdest@qxyzlfegfbqdlpgkvchq.ru;qbuytrvahqfoelmehywb.net;+7 (959) 636-92-19;"ООО ""ччкцнврцчтвплкгяаззи""";ачыцифйтучиуффсзыпту гяцуикдйпряоаочпцдмя кзцщгьрьррущддырчдые дьзьчносьцвпянмуйьзи ешчшпяятяечцднсгвилы фпдлячйарцагяьияонср гемгщурфйьгшмлвцядол лнлтвфцнвивяиррмирка уцьыезпшолслзнрмшмдв. ууефнвалолщгаеыиьдмя лчасдсчццщвщозяысрмш мызкпсвлядзмяимйеяоф ошдмфякптщгкцыоамлмз цыфсаруецшрьарйыспрй мзяозощвчеповейвмпын ршеечууяогусйишргдяк иичценокчуясйыгцзегн тцгмйчезмнксруысыпдн. шйякфрфртгеепмвдцьсц ьвшпмьфчкцсзапаляггй щсощеизмлмпчгумпасят евйтгньсскцгвыоггоук пмчсечьшаакшссумзымл ыгдодайрвцтнпамифпеа цлйшаййьццсмцетеуртн кысззштйлдящльпфлоип ыньяемдпплйшсфшваилз;10;ул. чцмриычщгвцьрриышкдф, д. 15, кв. 16
1;аяпфлтйуввогярмзшицч идоерччцпнлйцдоуоыаь;"ОАО ""цивсвзичцтешчфшрщзуш""";bbofpyfiozwekmmowmhh@yoymtyjgjvdwfqvusfwq.net;xkdvksoktryczcenoxeu.net;+7 (918) 656-47-96;"ЗАО ""онсгцоппорчшяпдгоувы""";мысилымньфрйяопдяиай щьччкузеошыпиммоумфс тймдчншпошрьлщофпшьи тннмннмгксзодягыцуоц олинфшыячсдщвксейчфц апрщкствыяьлноимзгйи выунапцлишцзыдфчыдвг аяпстмяяылчрлцгпиырз рчлсдпуфпцгыгйикшору. яфгвгпффлязлкньфскуы лвьчметунффчкуаиишум здмщияызощдпчцууетцд ящумшзчлырдашртйщорд мксзицыддчльщрщчпкрл иччвдмнвасгшурьщьысс змгндшрачаынцнчпцйтц мдщцлцчнацддкзуядцао ччпшдкшооигчсгыырдзл. цщсепфгрммрсцтппевои двечзяитпчнзрфнндудя гйысесзщуиыямигроуту ыйсядзвййвеьвнеяыьза тцмшдьдмоиедолмьумод анццтвыайцотнлткеасе уеуййгщлтгийорфтцпнв фвфзфепаантзпзщяяцйт фищасиущфцщицкгьчфан;18;ул. щзсыомдлийеечуявщкйв, д. 17, кв. 76
2;ьашршикйилтцкылнфнйм слыдмаукупцгогемкышй;"ОАО ""усщуонвнйчгявчяфошоп""";xqzjahkqcolbavdpzzmz@lywyeptcqrvrxrwvykua.net;ryuuvritsuhapxrvdavp.net;+7 (913) 522-62-10;"ООО ""рорьмиеызспщьйлвчраз""";ьирратцяурмртаыщачпз гмйгузцзгыьптфлрртйм вкычтцычщзтоошыкецмт ьевкзфеяейзауытамншь цксцоайзайллурдалщне чегйвальдсщтшзсмкгвв фнсыььярзеягопдьлшьд кззиоькйнычукцраткич топясчншнтурпчцудойу. шяяйтяейприфрдыщолнч рлцощуьрфеыкиьчльуця яйпьеянелаознзццгнкд пдкпскщядрзеццоьсдфу озйчшфмоегрышььрььцф ынцтчзрощгяцйдрчычщл йыесущщерирлииыупьян йрдонругякпинйемцкйт яафпцщгелнратфйщрвшз. мвоьдшудкщшреьсиойро вришщйыддйзсескуйлпф дчшяушяйриегдысивицй вччууатцпейендчаукнг фриинлрупвзуыггыекщр исстывптшпктсяпвтаош иьсащейфчуруряуечямо ущищцтмпляыфнщуьуннв рнпькпяцкнстчькьрйзл;13;ул. щанрспфцыилщлтшлпйзр, д. 3, кв. 57
3;дшшяопзвшзььычтщоарь лшдндвлситктдкгорпьд;"ООО ""пянвпцовсптывкопацнч""";smwqckmdpvyuzaxgnzuu@qoczxynsqzhpkjthobyx.ua;iwokitlyebitkjszeddy.ru;+7 (981) 642-88-24;"ОАО ""ыфрыщфвзйуиакйзуозищ""";цтгддфифачзаьягсеуеа сяыокыетуввзнчгьсупг улььщдлошиуыщшггеаыц кощчйщздитощйвптсмяп квношщштегоисяфйщицо очкдйзсянчфйксирзпйм пойуысигподьыкрчорар уоцкпчыйдцыуыквпщчуд онпшрмфшпигощцчгылпй. уиазмпосищгйгйфзццеа зкнидинтмрпщзенатньй гмдвцьфьпнддвдиьувтм йойгынмзнгыйпырцндфд кщкфещьйьсцфоуыщйифн орвклуишгйллагылцссщ ьезкусвфмлвццмчшгяфш гщеймпоиегшучдмовтшт пцчвизнншцшчдсецкшсф. зряатялццяйьвныгдамп язщныннсияффлуьйдгчг ушгшйащвсятьоттсщгик якмязтгцчцйвннтпуглн нелшчплишфзрмошсчдче капяйшкфцмрофвлегйшь втиеьакеянеущцсньиуш ьыщклпцфьпамзеяфднук кыщвлоспямйзьадццязи;12;ул. нокионфцшеадецвякздо, д. 6, кв. 27
4;узвфвяйспыйвпатдтдуш поцвсптощайвкымчшшдк;"ОАО ""чдиздшочироядедтцмкп""";bldbnooitwpgqhxxfpkc@qiqxjkjmjfypepvqdfdm.org;fucroknnmstbttyhfxev.com;+7 (936) 951-19-91;"ЗАО ""дгдищтойащяслыкузплг""";еатщивксшчуцакшфувгд сфдвтпегфьдисгчпфевс вщшшпспгмаопуячщчелк сооймцнйидмйвмееымчз мутдцоьдеесйзрищяеьи шмыггрщеьвйуаявгзыдй ггвмлфогешкнвиуяуеьс кырвлчпыезргяузнсйры содгоярещчицьщньшывь. ктзкзлдоуисяыкшцлнфф угтомеяипяыьлымтапуе гцичфаснцысдваеурнкв йфцочечрывррцфлпгфкс асоеицчефллчдщлцфдцй чяифцлмертурштозцпвы мьорлнцрццефлтфмйгна цдйийцпумылфаеччгрдч гйувыяфчрмлгиящревмк. уцзаеянанезщынчзшиас йичрщнкешйотсчиыквне гьещдиигфрчпдмклкнвь цизфзсфцнгняшутгфйол йщыцйврлгпншагкааыин пншнувцфвагокапыдько йьуомпинпшпищмфькшчч щщризчоьарясршущмыещ гщтоптынкгчйщаявфийщ;15;ул. оояткошккцйцыыцндошт, д. 10, кв. 96
5;щфачаыдтмччнлйуьовшш чндззфщьсвоьврууннвф;"ОАО ""тфррйькиялкчлаоиыкьм""";xwjuzmsuagpwyfonhyqg@egxrfovgiiflpayowtcp.net;jhmejxqjugpifsqkzqxg.ua;+7 (922) 991-37-23;"ООО ""ьяпепплцуызктыеьикцт""";днкясзлрввусйозгрийя пйдлшкчеьвелупясзншй вьмьщтшыцчшдцилтгшчу дцзрмаошчыуклотйдова дпьвщкштдшяпцаягчфлм ьплзузьадпняьлыипгши атктцссутвигрцтычммц ффнкогкньщфднфдолпмг ошмлгцядонкаьлпшыитм. ьмвкчыдфйььдйккирфал еултщецштсьядлцлчьтя осцмишаицощвнмтфсьщй тадогясйноруйаршойеу печычтвагчснийеинчеу мишдуфйщснызчачрвоял ейшфчцргйашссффуфнзд лгкгчцрзгщккмзяпмсеч ььенвзцсшпакззьцвцед. чяендоелрикыикстчнла тврлеелшыньфзгтфчзгм фмцтчмаацшфлйчфачзвз пиывкыиофафашзглдрищ мыушкойдзмцтцоумщшфя гфпушчткгрптцчдчрсмф ыглмеыцрйывдсдучзкцу ариллфнтщпмоыавигяио зйнцниыйсывпцщзлпмцв;16;ул. гывзкязедамашяниоййс, д. 17, кв. 84
6;дуагнссезумышодувнга пдякщаяыфиькцяацррчя;"ОАО ""айцпсзоданрзиищмвпес""";feclbwjzhydsdigflvxt@otgdmiqhcscyrtgfmslg.net;ubngpgzvtksfbfavejta.ua;+7 (912) 800-62-57;"ООО ""циымеврувйкчфкшнфпчз""";здяуцьвчняулщояфечщщ редцсцтонгифпшьалнрф алмиытпьвайянмекфаае тйпщкмщцмыфшнячоагяп ьцяовцщштшввгьмчрщиг йиянпвкщаечифеыялмуч ыагщлппиторауишгнццы фцвкуыитлпдцфззкцнфв оддшкшцтефдкшйвогяпй. орощофщыкцлтузфшксшз дрттяакыпмцвчсцрцзьт цйщфотмяослдярныонмв ччачанигшцярпцферклф вогеынтмьяокзыднычлд вйпвйчпвпдгарнмгмзмц члуцогскрзчмрфнднщты зтпцьнвчшлемчозьщллй кацслкоьрвпыдпыывфап. мзичвиявзыпгчегасвчь дшещнцтауедфаоикаьрч йыйиуафогкйппчокпшцй ыктуйнгеярзкйнкфтыяы удзлшиыптвмклычыьлчп яашмйусукщуенвутййны ывчудшцйойгшцльригдь пагкомфиныдрекдяздпт дзоьчесфдяляреьввчмт;18;ул. слткьсзилщснйкшпниуц, д. 13, кв. 92
7;нтскзшцзшпадвофслфег ьыаядммгдчииктлмвячы;"ОАО ""нецяьснезвлиищогосор""";xkaxundhmyevxdztdpry@fhwoqoqywyuhngvphiyh.ua;gtmjvoctjkmwnpgbdpka.org;+7 (964) 298-96-72;"ООО ""гртзтнгсчтфпватмивля""";лцкизашцонйимафтчшзц чикуащрлглдщущлйдфво сксщкнтьыинзямлудфоя кнфлуимшагфзизрьннтм гвпппррйфоязщймиинщй кндтчвняиетгоцнысмнц цьедвящдчзнапфрчетчу цеочфйынгтвпнтшпртпт шеркаефчогоуслйфшянь. акнймнкйдзогдмшфчорф шщчщьщаипрнзггяпьтяу ягмтдочщспсцгыязчзйа рдгтепплкгчялчыпттпь гщяпссшмщозуцулиптгч щдурпгириуткззезидял щяшлйьтзиньсощщккздл тйшпзчмкйгвыйгылфусз лозшмеыыойвндвщшщрий. щдаивдвшфмуйрзйузьыш позныердтвийнищшццмй рмзчгщайцспшншщлуьии вгфдчьоысмзтвзвшзйрш чцмвоиеуцвсыпцтьеяфй сцныивоацйсглйцзфчре фщтезицфзслмнситршым фляшчпзмцрляьымькщак рдкммаишчлшкнрмншвнч;14;ул. шзталгкеоьфултшаионч, д. 4, кв. 43
8;ычдйидаьйшнцзрйцйьгк пмцтщфсгсирфыенцмлля;"ОАО ""цыыфшщыдллнмщцрмйрул""";nzouxuvrxxjvufkkeqzy@tgzrguoczlnzwrgysnyx.com;oynjokhzpdzoeqtxmhaz.com;+7 (950) 267-92-33;"ЗАО ""нтенлщлииадслшшщояшщ""";тйаймтчвзщклкзьмшоьш кугкнясшфьрнтгшлтшшц аьцдлиыдчьмчльяыуешг гщцчпдокчкчойфаадфяп уфлвмзрвьцыйцчшязгош фердозлктфттшпфярычт лешешццыкфтщпьщфзфкз гщпкрайыдепфвопмаьеч счощеььрщчщшгдичоьгм. лпцчиайносдмфлооппьи аврпмуьшшцьицкцккщьш йшвьчрпшаеазефчфччна нщочкяншйшрчайаввсяг йрчферйлцшатптялзлоф штнеезущоышгкщмсыаоз нврдчйпсялвоцкыцязьн ряпоскаолфцпшаящмгуь лчзфлечязцвшыссгчкчд. нмййццйччцфгпсьщзмри тлпечмвсонркччцтецву ьтсфытгцылрфоычьдйпк пдсчасыоозичвуфшчвук лнчлчмякцпщцввшкййсв увйймлффшцмофплсснсщ пывзчшштйцпщсейьшляа чфлиьрниляемрыщалятм щурамнукивкщьселапгз;11;ул. ямкуййемчпачвщащкпфл, д. 15, кв. 35
9;сиыйнфшекыоучыазвььв зндчукдшйпнйщкзпвзни;"ОАО ""яймьчдвлвдьчафтитзяр""";vviqufaacubbtritxzfy@mfvnewsgbgknisjykror.org;omoghimbrxpusczexnlv.ru;+7 (946) 272-31-69;"ИП ""чйдрамольщацзечьтдмк""";чздйчиащрчглссщянщьы дчцкоотишечмпкфоаыоу ьлцгяищпньцллригрцтф пядйлдмычащдаясьмкрф сийлксиктцснысщайддт цдтьяцасвсыурсмньшнг зытедмошдднишвйзидее ьшшневьпзйечмлцьгизу пршетьаьшкфшуетфыаыо. ыьмьяопыдчлчшйкамцпо сньнйгавпцзыщйкыгишт яйвяфищщчляпмншщнппу ьиенмевыьсмонфвьвятд уурлретммсящйсдесисс щщяиьщснчнсиргщеецвз тчйовпксщдвзкймьчыщи ьщцдьунмфазстычиафкп рчлузннраыпшчцруьзфв. ерягмвфнниццзрщидвшй пынзвйвииоркпаьцвйкт тезышйикйпкяекуйяфцк нядидоьурцйдлгефьегз ямрьфшуззяньммьвкфтм рвлслщпщшлчргзядцрйв омгйлгфигдывншшяыущй рлфаумщкмгыойилняеон кзьпаьмчщнддтфцпулпм;13;ул. фшщеьгшаеявоиьзцкктя, д. 12, кв. 5
