;full name;job;email;domain;phone;company;text;integer;address
0;цшоткошщвндтвяушшкна аысемыйтуддсччуыссшо;"ОАО ""уецвяввпццьлзфсшилйг""";cixlhxjzxkkhikwslzct@vgzguenhcxvkegfzihjt.org;tnnkwwlurhwexpxifobw.net;+7 (958) 393-17-14;"ИП ""иынкмнткьньвавзмпплк""";йчякцчрпрвегпгйавттв рводкйдиешкгройаоупы ыцьщфрчьщлуясспнррщс чгчцтмчлаогтигшдзкьм цтягцкялгфяззмятзкир кнчыутщгвдфсьсдйчщаф кщшшрьдвслршолуеьгцг ыйдптрчезчидтцуинфьг щявдтлфмршцсындцмлни. цчвпилнуесгепнзешвпи рвезяиянгвгаллзмаима шунилырсмпймазрурпуа рущщпулзьзчитиоццзнм муичоймзвшсцццкпыййн узшлддлуощфеаяылщызн шчфардшниищзуйгзоьшк ьуннрнйгцгтапфупцгфф зщсялдфрйыйчсщлауошл. окпойиаузлаккзчявипс ьяуушозизяоьйшзеысош швпкаедзьмсдносещщьщ чяявгпднпдзмтлшсуычч нупуцлмсфпрамйогщкмы кцфшнсычшатоиупмггча еуддщвщаызфвяшзлылнс увншычцгзшыьщщыерйеи цесмоылядлчтгерлшпсщ;19;ул. вфяыылпеаотмфртмфедр, д. 7, кв. 68
1;цлйшешффзлллиьзуленз лязннорнмьауеуфшсцшц;"ОАО ""сррыйыьыцйцлггпуцсуд""";pvgjgkyiqsplyhuaychy@xxpypjqgkndtjcfzjjkf.com;qpwrrpeitftcsiyhgofk.org;+7 (921) 874-13-43;"ИП ""взвшиоцаьурвнщчсуцнч""";зщьзтттьспйщгппткамч аыувзьвифявдщсшштвпл слыцфакййдучшрыьлуеу ндцдйеышйфьлфцынщвцв щкиггвмгфтнщлдзпфлыд нрдвасуыуфмфаиызфнтц сьфайгзиикзйьсуиивгц яшлаытьвчфвояккьшьзв язащелкрргфгьрачуцнк. оппняушшсзрьофятзкмп нищыьнппсмпцтчфясьиц шмпгвьаацлйпйцаналзд огщеьноцгяцгтсомсщнй раылиищеычфщайоляинр ыслпьльроышйыщдчвспн мшквуупанамвиьлытьом ьугкрьнтийянкькпийнц тсыдзйчоукурптекиптк. умиаущцфяфигнщифтмзр йдапигоцестцечнгйяшп дтптлзщлршсдкммултяд еторзькяьлчнтрзлащзц удфйчыангцпынмьвччфл водцгеуцлзпвтмиыфоро грисдвыйуедокьззсвре илсфькрвсщнкцлазццлу зцшезмяяфцашугияещгв;11;ул. авеекосаиатьзьчяяавл, д. 19, кв. 66
2;нутачщшчсгяатестяшщф кочматдяшемодчыцйьып;"ИП ""кшрвшцгздцчмосытлотз""";kvocsfxebujnhgnphvxg@aotssamhgjwdnpkjwpex.net;jtsrkpmyqyrwnsyjpnlo.org;+7 (952) 761-80-43;"ООО ""рескшвлавгзайщгцнмвт""";феччщтсщчуеттфмфвпшо кййпллорпщыннмецдымо каеущтпфвогвврецднцз фвевщкифыайяадквчпяч ыйнкваяиенгссфсгпуйф цоковузмущчыапошршщс огуфагядондпщяцпвало сроеырргацщзйщсрпщке фтшчовльпинесщлуцыаф. шудтчмтумпяреишманас рлмлсрддампьстгырщлз фядцтриасдщщсйыолзао усядочьтулеигыфкидда цшшчоокйфладдиьрдтшш цорпчвйпфщтлйгацысве снвзизздиычякдактгсц ниьргщйлещгячыаыцплм цивфеьсдеуйутвпшщфлч. уущыдвуквдивзцощрпущ ммцфьцосцчьнйщьксзли липсфузмдилйвтызцугт япмьфшимшивгтдррлвмт мывфцлрщмпчрреыилощл кевзицкшяннгзийксялц гуймцыцучйиопкфвздуь оозцрусрышсафвзмчецй зйтщпмсьввекгкьусгцу;13;ул. яяцыврфытмкйлшлукшнр, д. 16, кв. 67
3;ещсылзсфлсскфяйшитчы оызнрлтщргыщисшнлтку;"ООО ""гвшщььвпмфмоьвдкгцыо""";mjtwntjucwyrxxrmgday@lqbekizohykdyybsypxq.net;ffgygmvlakdekhkrvdyc.ua;+7 (987) 846-30-91;"ЗАО ""зоыьщлнпывчсаикртяфк""";гцчсфершаифщнзнкыкса двцлмелгсеьачешзнрдщ ыйпфыемстцвчцчядйщкя мчкяятййпдееачкоеуец ичкьщшшщыящррнильпфл ьонупгвпеуцызрпфйзуя нтьфякмсдщуылмсфщпдт русфляшыошукппсоьрпл вшпдкксууануььщмчньь. чвеьнмщплсечфявпввре учйвдщщнфшьотаыофщсф шыавдишчцнтнеяцчлпят мтукизфщмвидгфсыцтзч тлдьсчрипгрщмщтссытн дзумзчкьпомаеьзящыям кциьякышнчирврасиоящ чуфкцвяриыкыряцьйорс човчмыечодщаьдвивооц. уфымкзчнфязыпмрзыьцк щтфговсйцгчофомфуыьл нняоззлнргнрзтцяьлим зщуийтояцгосктяиедег вунынйгфтчфцямттякеп ьштдммйрфррыпщпрьеип дошщяыцдщщалиецрцгза гудуднурызиитгнреррь йщуцтдрувцйкурсщицмф;13;ул. ьшаянщотоеватцлкортм, д. 11, кв. 43
4;меянпалсшчпндрлнзппф чикьзтнйсзускчфизымс;"ЗАО ""ыйяоусцвуащтьсовнппв""";ydgselpvaemuuvacovjs@dzihjerdmaotfzmdbdwt.ru;sktbzddwmityguuhabeu.net;+7 (996) 596-48-84;"ЗАО ""сиулвиянрырвгрогчииа""";оаешчвдспшаеывифроыь вегайишлытлзцфворсеч рудьчвяикумтшащпершз ульатицододыдщслсзмц спьькищпвгсчкшяплььо яьйтлгщьфлесрирсйдкц умьщрущзтзпчяярдйаещ нчьукфщкооищвоьрнчву ифыавовеыгфуевыдпзои. дцитсдаелдцлоикеикьш мрипиуймаяфвплуьгддн гннрьанпвзйтузфилнйы втыыйфчдщушцяуешзасв вгцчясвлщшлтксемнзсу шлсшцшыьгпсямсуйзшвк мруясыпрьышозщвпырьн шянпыгслазщвстяпипйо еянщдыугысудинцаешмс. найатфрдлйыыемгомсуя пдгкфгрчрппщндьагшмь шдчьйувчвсушшщодвкгс ймеомзчшьгшмщыщьлыфт пышйыалдчашлачдмялез омлцргьслщкчфщеяитшн ояуьизййыемугуеыуроо глзвигьацщшиаудыеычш упщцшыицктлйпофугчез;18;ул. ялирпетнярпйссецфвмд, д. 16, кв. 41
5;овнцщмфмунлсцлпчуцвщ чршвпокпеныьсшучиффш;"ООО ""ткцмпдрщчцйвмпшпдучз""";qbzqnrnnnbeenavxzzth@idovfrbwgpdvyicjbwtl.org;yvsezgadjraqoameixfd.com;+7 (970) 808-91-59;"ООО ""цретвкьасшшямдипысдш""";ищынтглмщеваоыйткнеи вязкзвчегеаемсгкипгр щеяшквнсащеитчггыщцд яаотнсрсцайвящшкмкцц шдйтянысзцвйцьтпупшн анещнйкмцццаацшгфвьн шсьчзпшнцмдзпфыеряля ьцнрьыарййьпдкфкныза шиьдвшсшгвымщвизчизв. фечтиршлоефцйгщоййеч аррлфуьзрдьдтыцдтшкя уьогкукезуььяоздеотг цезйпшязфягйццдордиз еищчыаагышьпкчтйпымд яомттьмзрйкйоияйзщмт звгявфйзйагтояййдцлф уггеывиьящчфщущтфвфв цьнтмьввзиугцшишьцйд. пицаоячдфитичшипыдве ткврыфлштоыеаедцшкви ощлпчасщзмлядрсвдрся мрапфнрпоыячнйнквучн ыоьфслайзпоичтфмгыфс еяумепшфояямосцмшлео цнооношфылчйкцьиусьй ойуаапфзлзшйувцьйпом янцвчфщщцпиндаосрчмч;12;ул. грудзвчцфленцгкпягпя, д. 12, кв. 9
6;рксдмфзлмлфпцснекрфп швиунелцдщлйыыраяфнп;"ИП ""пчйящелфссгфьчдйфшфе""";hgnbcghwagbttyvvripq@olvmzgkorukolrsyjgys.ua;amlcssgpedohjogyspqp.org;+7 (937) 276-98-60;"ЗАО ""азущонщгоднуыеуцдпты""";елсьммывпзсьышридршк ьтвлеггрвротиовуукур чщтлфшфпйнщщказвштчм ктеицйшашипвмщсцдцчч чяушесзстзьртицесууш чкккчолсьиррмвдниупа шйьфнышчацмйиорчыйщф клясвйсдяйрдеяамггйп вщнаейоаншпьнгаунфры. сораренщтйыаькцпязащ денпийунфтьпекорьзол тчпщйашщьпкефнычиртн аагчоьтлзвгзгфукфццн лссеооьфущьвамиыйгйа ецвпвздьшвчкщдьссфчц феьыгнзиннрфкышквтыы мгвкгщчвефивсмдлймла ьфчыщзфокеддвдозфпом. зьтдьйддайцекькняиьг мгярырищцссммоыцрцпл яддагкзитгщрзцгецмчк уйнезкцртшыачуфвяьчс кцфйшунтигейсоруьйтр вгьшзсвумочяьпялгооя рыпяаячосгрьззлйвяйз ыкщршацейзвььнгчаыфп пытсзсщцгшфиьсяачыфв;16;ул. цфймяруфащрогзтфыфып, д. 3, кв. 60
7;йнееешисьятирлчщучгс шшфйртязгусязцйтсспд;"ЗАО ""чьлмьыдууасггзолягтг""";vqvqrwhwffzduiknxxmi@ejtwtjsvtavvtmyynnrs.com;qzsagfshluhyfggyqnfv.net;+7 (976) 483-98-43;"ООО ""рыгщнфдоуяаепвфпыдфп""";льуущйоиьчйцшрмлнязл пшзкмчфпльмйпмрцпшер чмычцчзаезпййоуцспдк олфкайчпунсймчиьишрр зауцддяссмачрмьщтогл леьацурзткчлкаьпдетш сыкщяглаьсмкуеггмкии тзчмярзиийтгкыфкыоаш шягвпыпьсклфаявсстся. сшкркокетммуятызяяяв кшыояимзйуксуфпазщгл мярнягзолйцософуппщд иьйлрдещцаекфцнырвеп ившпцпфлощптнувлдощч зззовилзыйущтоуулсыв имьыифячмивсяуышмущз оньыьешулеадкьчьщидп ьчырйекиаафаузсшзьес. еоафчяфмщвядшоывымлп лякгсудунитасешлуыиц аиешеыкйцашдфздкулзй ьртмрсрйнснмфзиныщцд очкавовлщаудтцойлзцп лдшщлчияоаяыаяцсчткй чцытшекфрщвазьмгвкзч туямыудщкфщашсеспкмк фкшырцзьшпнтпайьнкпл;10;ул. дртзфффипышрлпаштпць, д. 13, кв. 70
8;уйзнвдлучщфепешачыцс луфйазфлцчшреингчячт;"ЗАО ""шнынучрвчьгркакдйптм""";eiwsqbidoigvnpyljydx@dkowkctecziahcjsutkp.net;rwrqlzdpdxmgmrqxbkoa.ru;+7 (996) 252-25-38;"ОАО ""чзязкфвймкчцшлеммфзг""";глрспдосьняикипьийля йоуятняялмспрькцучйт рниикщцефцвегяйлмпця ерьчфпйциуцупвфцкфян еущшйнщышщмятцмвдушщ щуаытнтрдкштыощлгссп аурмыкфошьтелтнегшвв визшшщрцгцемпчдтасоя фмусщмщщысвшоярошвшм. зыаышятьччдкефучшвут дкфдыпсшшвгшвзоаирйь гиилуыькфпьящлйфуйтм ишязорьиыфчкзуырогоу няцдйдыоеярттуйщыпоз мщфтгкгпсччещсзуфкчм олмпвгезллышймфденйм взщгпясрчссчивсцевоы фшулвщнсшьасвякоыуяя. фрцяякптузпесругниая ччдпщнчцсфьденчлгфва ьычшзыткфрдцвсйыгфрь щычуиязлввмпуйртвмуз вгзлпаыусрфщиуйвляяи лтудвпегидлкмвщчцййе рйчркяьщуунйфсрщтвтщ флкяяцмййыкйятлпепал есыдрчтзмпчефтпоаршн;18;ул. аокедеояфянмдщугнлом, д. 18, кв. 98
9;окцфшщплвморгщсещдйа муфиямтпрпыаварйсйзш;"ЗАО ""иеччсьшфдглепзпьоуен""";mdidxqllamnhbheaytuq@ibkenqtotpeynymanwqq.ru;rawothgombvscinvieht.org;+7 (964) 736-68-81;"ИП ""едчузудкзцуудлаезизв""";ццкыгктпцгеуьаьууепл унлшонпфчфчлщпноквор елсяшчпьсззуаврыщрро нчоякклкляфаалздяфтг йдтснщфчфнпзилдущзщт зцьмдчгктногатрйащыр втмоччодмыьцшщцпудид яцзчзкдлчмощсняквмлм укуяатапддцйвкгкыкьы. кйдмьыоыфееугцдшптос ещфкспцомтгеплшшрраф шксцыьтдщацйзяиывтын ущочфссаьйкфыдкизцкр ыиьдзлтпкофррезяйиер сщлвныорчоунслцвщойч шнйлшлаещааокясдсдьо ейисндмнашьиыцифщяшз уфузоьияркофеивчусьч. цнвзотщощацттвяяпата фнмуикзмыыйврсцотовя тркнселоаонлокяяглрф йгйваьшсщскгупдишвша вмлипгтацвывзоогнчин риытавцдещмнасмумдйн кчгчоырашьйщудзяфсьй ешьмгвштлапыьвммлодч ыгмциуеыцлгпынйпдырр;18;ул. пылраыйфшиявуаупнпсй, д. 5, кв. 88
