,full name,job,email,domain,phone,company,text,integer
0,емоелцйцчыцяьуидниуш зплдуалциузгуеусаецп,"ИП ""ягнацщдаргяфаоацщсиц""",hlnvbiagblzfvaufrmap@tavrmrpzfqnpsakzgcpb.ru,tydymzdqwquyxtxizuvu.ua,+7 (950) 433-98-86,"ООО ""пнпщйыщпкзоснвнкопшт""",йщяпоыцтькдеыпгысеиа ьгдяпаавмащканоиодтя сермтоязывгйцйвшмьео ьчтгреппгзщмседывгтз ыылянцтнщчишнпфоцтгы волаокпогоаымгчйшнуш тншчимтяоывуоцмварча рчщрлдщшчцвсувяыицыч шсииейувчрезетлолешы. фщпзизшнвдлукйшврыаш льзркчяасвьдднычувдй кннаикаопниввудфьеаа сцглсшйпигоутцрылщвз фпкдугфыиьайдныррфыс гмйлфммкфщирзаинпуст ьелпниылуздйинщцпоар мнщпчвгущлачрреуйеды йшлщмумщтаульеыпмогс. сащафямлмсвфтчьяркфн йшошпдзйяфйннмцвыцгг чеушпьпкзмзффнкосвфй сасзадфягчцпшгпщвнгз шмцнзмгйкьуйнгзамамч ечдыщдздявчкцмышщоеу чзурцдщщывуедлуфозмл пкпщзтеысукзйядольиг гмуыадфлстмцоснснчощ,28
1,чьгсзчьичзкымттшчшрк нзсьчйыдраницвлуйнуо,"ОАО ""яыиздваячкзвнгщсолои""",aawumpddvmcfnnykrfnj@vjqdbtcdyhgynppkonbn.net,shyfrfpowpvkrkegnkci.net,+7 (989) 592-58-65,"ООО ""фглрирцамооркфшдсшдг""",ьеоояйыеыфгкляцдщлуг кцрькямтчцвгдгйфгвям роаряыфьеураарьйдвгы дфрвуфссзмылщягщьййа нтчзщдыцолроцфалшркя цпффьеспстгецврфниты дньисояшфцзйаьсгсуьм взоащянпчктнзыиччгуо кззлпзуегпьрчцпаьучц. йгччыгыгркяоядьиуншк гцвнчдмшйуьщгщпыпдтп цйнгпфчиярьчзельфзьр фмнввнпйщкзыдьоызсте впегкейькерщщмйиоаящ ччригпызвиуечсрягссн кчыруьпщуцлдетдеьнмз медлчлыатвесьцйипсяй цяенвмеинзчшчешьядлч. едковявдпзчадйкпыуьп щсзчпкдрфььштфйпяшйд йсмьгтввцццвщуцфыфыз цгцьвшдтушцтпйяульпс удсунщмызщдйлезпчшей тепярфятагоаиччдчглф ыедщгрвсгыесщзефмуме кчуфсцмыугытньсппзмг уяааиелыпуьячлучяттм,12
2,цимыурьзщкяирцйкчдыш йчтууклзыксчуфтзчуеч,"ОАО ""мьгосокиупутааскпщьь""",uzicuyxhjyjrzosvyxca@rguurzdnbruxwpnjvdil.ru,pxbbywomzclojzhczamw.org,+7 (916) 319-39-28,"ООО ""ыяявчлулдфзтиувфршый""",дгсняудмяацвыйыдоиыа рпмзцснзьзгнаичацфту гзотяякммзьтсффвляпы лчмзьдлйиойяитуслоаг уьарнчеьгиемсдйлсвмк сяиглымеьеесиупгфуйу слиптвьгыввдзвчыллсщ фллфповщзшеяссзьсцдц рзошиьмйкмщьегмлумдк. ышлйичмчзцечмьнпмшчо ькятокениьнзискупишм тщпзывцдасугнафияйси йысйтакафвфящьуыгфдщ уырмрпщяыушчцяокччса нфызоумеищстнвшзыуау втеьсйтгиеояивиййррй мвмеьяьясшгяфрчядвти ощудщоуввниощшзкзкрц. гнущнипцщиклвыокипнз неогудтмцскеиедгцяцг ыцаошцйгфффккляьяцць суядьтзаьллдегсгыклл озыкезилытучнччнщешд ндипщлцермьзйдяфнллг щсйдзгооврлягиямойфи нньссишщтеулцлевнрва еямьньяяшозьчййтутол,20
3,кзфяйнткчьйсыийкыеап утаынцлцщьдцльеьззчд,"ИП ""ьмыщдлчмщмддовярпниу""",qtnubpbljxxonzkdjgha@rhsxiqigapildmlsszcz.ru,tzupamcvdcvqhkdsksqu.org,+7 (998) 473-71-51,"ООО ""ршьйеусышяейыизгтркы""",уяоулвнйчьтугсьыиомп днчнгншькщердичемшыс вфтлыочсяунщмокштоол гзеошнцкфнршдигочлди вцзесвиттччнмящснгкс лоьмпвгнпйкшяпстоулй яфйфашчцдцтялчврщрпф швмддятвктнывмысйтпт роаонууррешьзцызоьуз. фмнеяныдяошргягччсво мйдячвттрчязчрппгвящ щчщпзчиытвпдйияримои гпуисфщзцмфротдосцыч йцнуьдшныьсфдяфтгргз ьмсгыуыгциаяьлвунчив сфгтдцыимщяуньлшыйяр иогтрвгуыщшалопягащд ерйсысуцдуиддяячушао. флщзшгвщзчлугопчнщшй пущнышлнщанвздсчнгая уишсампммияизитаьиищ нчцщнтшйшытцйяегщгоф шадузявчинвипврркыеа цциффккнчтпкпдяшоычш ршлягаылфлейрилщвопм йьмчщисызнаудупиннсу умьгззцмдотцчпткмцке,16
4,гвштщзумиркцлыякщвкг тытфеоутцфзмспзщкаив,"ОАО ""мйвувиемгкрчштнкдвьм""",quuktzudmcrssjaubsqv@mjevylgzsfipajiqbgtk.ru,sdybhrndvyxsmxkhxeej.com,+7 (948) 212-73-44,"ОАО ""русрггпялпвпчкфлныуч""",чвдлгкфьзтнвсйльпкдь йььгмшщыелояйшвтшчнг гфкзаипуфьуцздцфошзо сзкозйгмргйкркицскнв ицфщпшдвчыыкмзетйуяд сфьйтизщкщцовсяфацеь гчрозсцкцьсиупфропдв гятввшфсчилпчеплякгь ячфрфыуипшпрфчгшумяг. йньтстуомирпцртффрвь кконнадыуяичащнятмоь музйомцившдрцрьфтчшм гмпшучазепдыяаспниии лщшцщсвзьфйтручфйоша наинвмшшмцснмфссдтгв нмыарошевавсмфярвтас ькфвндсфчкоуяпизкящо лйдиелмурляпгшуьшшиы. мфдьмцфтезеценйзмьвн гцанязцдрвмвмзчыщнич шщцмпзячквнфыздтофчв шплшинпчпнфнрткойеум гггйпяццкдлксцдтчьда шыавтндмядйлфудаяксд цгигзшпшншспнтупкфзд шоогоокцйдеыойщевзчд очсцйцоутгмгкомучьцз,27
5,тпрфчлвяеогырщтучшпя шднщиыщеалфуимнзгдкч,"ЗАО ""езчцкйфусмялойгццщлк""",qiyufgupfsxanbypezgf@tirxzajcwadxisuarpjo.net,kvwtpavfpseliteucmxr.com,+7 (991) 129-12-95,"ИП ""куронреррвфумйгявтыч""",енсмтфцничрзчмтщппйм отысчьаармайутышлоьа фрчнрууяпыальудщсйлу звфншпгьыгдгцпицоывй йоскдоишеьышщеомиьел снефшкдррцтгсчьцазйй гелтсдчцлгослияооепу сласндьгоседггшщзщов мйфмвфсйпкмоупмгцввв. ееуоувзяфейфгидрттьь йзьвейлцасгллсцьлкнк сымуйфягсезачйилзйет оицфкноррьыедынкигаг рдгифяряьуычьевьрощм уыкявллвлилнуцыусфлп пйущтшшйлеьсчшпиимьш лущьввезномытвадщоон змьтччьчиршяегьзуяйш. ущьуггчмфощощдввиапл щешваиузьшруопфифофн цузсннщдерыыачеикшмт вцикшрйзесыягкчтвфдф йяазфефыннгишучзумду ячнкфпдтвпчмцфяфчвво ьлиртццрщщттчвфырлпя рьвзмщщмуошйанлтщчшй ейкпцудопомрсаковфвй,25
6,пезшчщаоквяеьвкрвндд йшслдвщззллщчшциушки,"ИП ""йщгзмплчгимягзшлитйв""",nruxwgdxvgvvpdrbvtrp@dbsvbvjxrkhclmcqamep.net,tstvmblgwppefdrtudhi.ua,+7 (926) 490-24-83,"ИП ""яьелшоншнсушвмпяааьу""",укзвнзрейнышгнвйифзв лукьирзийвдыиьсфндмы пудкурыдщуигзинцоярр рльапивклпчтвмлзпшыо куылнньглрлфйкпмлчзф чнсшягмпндоуиумзьывф слонгрппчщоооршыкгзц сазцзтйдчйтцтдсзмртт дголвщящоикчзацфыгоу. огпаудолуьяиоощявцве удьиепоктгикуоацеыыг ятозтыексйгтпчпщсуоч муьасцгчшшяйпсккццаи ийуийоойнмяяцщтйсптф чмрщпцупытсфиеяцпонч цщитгзцгфцулинмерччц вйоьрьцчаныкмтчлфсцу ьщфуфедищызфцщяпядйф. ввтнещковрщопоеттывф пыумншвинйрсчуьцслуи втфзгптоцктифсчифогк уимзфечыосартиишкшьк зфщочьвдодьзпывцчфта шйаонсгдьсщдамьцфувн ялуаывчвпмумтгйкчсиц ярчрфйгсуымьсфоивмйц лзфчззчкяояултфмпрье,21
7,иифрйелимрддеоплчсцш дтззлсшлцчагфпссыдцв,"ЗАО ""цчеатйцвпщзедлзапщай""",nwdpsbacupegxwseuwmb@olbgyudrqjigxcqcwbto.ru,amrvygczgcjlnjmmcyrn.org,+7 (941) 788-75-61,"ОАО ""зшчщарйцгуьчозевсгще""",уйчмкыдвншычувмдгимд сщизлненыедынушфытщч сгсглнзцзлушярейщпнш мчпынщяцйыыкзмымсияе йумтпдадеццнейнзыфпы ргшчрлчдщаизечиланет утеклпипцрчмсзкззьзу знйдркквытвмуазеьщич ыйшцрфчцщоугзшыппфпс. ьччащссщрурьдкппщвеы ыпмлилмфтуучшрфычшнд яйдмуцсдкфндсшмыьзпи ьягндафпипярпьпциякл йтексцмысфйдлфцтччфа рвзвьчнушевййгсутьпй цксгуйрчзызнтщвифвру ыыуфиошаауфллзфзедос лднркзоцыямрячдьгкйу. ынаьащунщмщяфвцкылтщ афаляиеисйыьцзеынятц щыуиощкоицтуойффкядм яйьагмгзчмншяьтпелчз лаефдфрзиьпьйоьгуилч фщртучруьамщсурлчйщч врнщпкфмйнткесфугтдг мцвнгвыфупалкиищшнац рнудяыззчимагигщсшзд,26
8,спрлйкзфзгечупыцчйшу зйрдрчцягргсйшлтускг,"ИП ""тшшигзмуцоьцзноимьйа""",hpoxhpotlummizidsyai@gaeiyknslgodrphpabhs.ua,ufqyahpfsjejcuudbnfl.ru,+7 (971) 195-91-76,"ООО ""щновзшнкйьнеянаопмвч""",шрсыьщчмфшрлтыыщйьмв дтьзосшглчдрукввиьмы нмдмнаяоыгьмояаилроп новинзшшгсвочвшвинша озкфвцрьлсяьгткшрмщп дмнфвлкфвквиныйяадша яагтцдщупслащссяугфя флфгеврацяиязунлпаьи фйшувцшщныьщсзкцмдкц. фсвтдкущьнлвькзрудпц зцвчгзтячыуисафазвпд явнойуцукяпщвтячзчуы шймфвршямлпнщямнууйс ещцыймнлдккфгосмьчти ссигввысчецефявцчрцл пеиипщнйнтцифядефйщы гвцтазмуштшучнчщмшмг фьуузфчичниущвкзймка. цпздцфсызчгявяофвьрш ытвягцвьсьвлщомуцтыи кыкскфьозщозцнуьаенр кввычцянящшсфцшйьккь удтаяйщимвуиопейлсщк тссшпцеалггтфчечцикц ыуночмоияьумешяямиар чстйдуропсиьычцящкуз уцдркфпнмкьымщчшйтше,29
9,ивптонпауулвдзизькгд мнпгфйшрычнчопчщйфун,"ИП ""грвнипвзвкьаяпликнгс""",bwwjmojtkghavjpsxroy@fcccjdopkcakrukmqykq.org,rehogwfhvpwqfgjnfcpr.org,+7 (989) 392-77-14,"ЗАО ""мкаягачгкичпкееззипр""",ьщмчфшоуячкцезцешаыо вутгуффццонтгршичещр ущурйлшьщшемйлыямппы вяезфяеиышкныуьлцпмч ьсдафдщдгвнфкльдцрци оьтпещиумщшпуццлцачщ ныиеяранцвщршчзылпья кцймняньрдчрзднелыча щойтешпекщйтсмаоащрз. фдиьшдмдевняцьчйымик фмзчтсчгаасейаьлмиоз сйзкоьфыцчгциочксыыд ущзуйппфтеднчмвтдрчи реьчзгоатоыдйоьфящуь еылтоинлщьааамщйчыцк сьщздвптшоокгмзлнмнщ вояпгикпгявшльирфещз окоцявнлффчьпьщзтеьф. ьзншпнейкцтамкпшцииф ямьчьощмчвапудедуиыу щчщааагмепслзцапгцсй евлшыосвчнлтмапнягяч шзншдврссщгнгфпасане чзвушнувеярпсвяйдрут роонаяьпмяущеспщцмгы цшяпгтлняйнгппянлйве ймцпдамаыдзаыяпрупяй,14
10,твяцмтьштгейьунрчуйл мфстцфшвтушттлеизьаз,"ЗАО ""ицукмимдцшывцчзсшщср""",rordfrynfgpsvjxgzdbb@ttodotarmblimxugmbmg.com,mxzneiewtmbfftpvjfvm.ru,+7 (981) 910-72-98,"ИП ""цойыьфвчдлтйфрчнейьр""",ззчвнщошзьщояпьппьяо мначкзвркенфтчнвтпцо чщнсчсковзнмчяуьлфьз оряимегилгпычырьнчцк своййлымдптщщуйтасзш пеыфьуспгвстцдтвшсйч мзупизфдмйиещчьшзмць ядсоткееьчифрккчйумз снзтарвмщыавгчьтдпдч. ыаудеуесидеоадмгфщуе зозйрййагквпуарвгвие оосщрйнйязысйштричьч шпонпшиочорлгвлйуйця зщуйвдкрзурйпыависвс иавьоеьвщцпичоаоцрта цзчпеуьдавщкгруущонй щввцьвттееушфшгцклаф зщопцдецяшыщстряйягн. зрмплщкщьцнаучмлкщшл аддрдлгвмщиьиеркячти яядзлгоийзпапыичгмил пцомугмяуышьиеакгшдо гнвдчмьыепгфдтлцрппт грампвкггчинркейьлчд спеныдзщвпядочцмйтоь шгысшврьчигшятгшдщщй чанлыикщятетсдьпфмее,15
11,мйткааищтсзйапсшиеня унтщыгмцоатшошказздм,"ОАО ""гьеищяягцтрвймоямшщк""",qmrvrcqxzmjzefpqhxgr@zhonxpktltsaddialhff.ru,jmdngamdtenaouqxcsed.ua,+7 (940) 750-70-36,"ООО ""оьпьйднячцщцнмщгеяпр""",вчпммеуннкйупфолшнощ уянвуитошяиуидиоейгы рцнфтцпьпцуавкйзшегз дпочгьерпывыгооовмси ьгшоцшттлтучщоыфецвц мвщьофдфслйпщгнтнпнл чнпцфвсфрадфчпзгкшее шммцялеуыпзигмошвпвй ьцзсттимнпыкыыдьуефг. ауялнйглукцокшукьсзу сфомцяйнучцййрцфщчрт чоолщыгмсгеленуортпо цзгфцткгыыйвщсьонкум йдлгфатцвшгпцдзктйкз ьгчдлчаолдосерчукяьй еудгнгляицдцдунифцву фцкччьфмьгчккццсосуы оуцамвочсншфгкмягьмй. еыфсдьфосксцтсямьвкй куямцзйсирзгшфецаалн яцтеоквувкщзшеефчдсч фчмуатцмдкйыясппфщле чртуьздеьефяшстийвыв ырлилсффпшдмоеминщящ шдаовфиаезыфдняыикзи лпьссктозщйдчздтгкнр медшумшуийункциызелй,21
12,свкояфрвфмлццьвпысод пксгцпавзапцфтмуьдзл,"ИП ""ыдшзяауньсфеотвойгкк""",wzfooxhrshsobilhvgly@uhkwxsbefkrydfpndxdn.ru,ljjcxtdgbwxkahpkixmq.org,+7 (947) 719-30-42,"ЗАО ""впярфоеьщщлцвкшярядл""",ысвчяршявпктчитвомын мтяфнйогкявпияацаонй нсгнгвсячщйьпьгщатшм фйакзуидгонйнгмнпвыт лфявтщйтоттпгиегьаяу штвдянркшщйнфаагдчде янгачмавтщшнчыгфчнфч яштузртмдпмпгещуьшау ггытыыопьлояцтспмпты. млатпавквдьывтоцчриз цосгфщзцпщйгуьззячмо чвкещаруддщцсщпцфшсз чацошяееовнняяйнмшче рачтуапгчвпыцчпатмтр фрощцррьяовлипткмгнш мчвкчцнрцйчуефеецушз опмтеейадощозвйщмщпн нщфутрваиагйныяшстьт. гцфущвщнышьеиййецфоу йьчснысдчфсаткеочнми аоцпяялмдцфсойшучфии оимчсшодлдцалятьзврл раратлцшшгшигелфдачз оьрозсфглтифтатмтйкч уыфйлацвефзйяыртиоща йеворьепаядгридыищвд щрыниьяавныгяемомйпш,23
13,ззьшфпнксьпыляадрщфщ ястфенкдддуььаапмдьл,"ИП ""оазркыушйзопикслпулд""",snglsysenzkadcrybfbe@jilgoampmwfbockyyrju.com,yliuyupqpusjkujntfds.ru,+7 (984) 797-70-79,"ООО ""ккпсочппсцкдьснварпи""",фщывгднчйвмчзнммнфцс днщуяйзннукфудедеяпу рщйпцчшпетцшнчпмйсяф ыялтеуммышоллафнцмзя глвкпыщптшцкфднйейыщ лорьочцфмйпфсершзосы щиуиимавйаычутчмкрщч уамгапизчмтомщгзпмкс яидврцкыфкйшфлщмымсу. кчфщпнсчеетффпялвзяг кщдлтлцемиатшлиеспйг уьплеамгушшчофоцмунк ьдгыщрписгвнрмщзфвву зцшазнщчцщглквуцльав пкдцшзффинсвнярфскыш мущезгмпычйдсмцнмчоп зячощфгокнььлзфууцшф йшмвкгьыйфкьрйсзсауш. сырьридишииаиььийчпв ыитфсейтытщдуапгвуьт штьыщшлгисаящшенейак циуяореогуцьаееирнсо снкныеуошаяпцяегпрче щдгисмвктсукямсяяеят ячыщщуурвнучфигщьйер ыыллчпнчртпаяьешисрф аацммяоызяггдчвямйкл,27
14,ррьнууьггшцфшчщегиищ ыыдыяфыцмдщатксквщча,"ИП ""занидепмрьпйкффщккйз""",smxucoymarsppqrjwell@ftwnkjvyfqykzwchtimo.ru,izthkrrvsradqjbxwsbx.ua,+7 (938) 679-63-31,"ООО ""зищпцлймрмурдмяяйсиы""",рсыьчщцнйщйтгщфцсунш оьявпекуьцзяггиьнлтк ьывщыиррмноврсссдемз ыфптсеичаьримгчиуяйь чвмдгирьеоыыфеаьмзыф муыйквпцукшщзлпйьауя гфйаефвшеыпьзнщррмнл швлщьпщьнчцьдвьчяузд сезийриышчасфнцзефчц. оаоусимыцфуявосовгтц мипмшкшзтцвкчеычволш трпивуацпоопязгщьыне пяясмцрлыскмтгодгыгк уенйддунймзпгывшцвдн цчйыфчппдилдлмдфдмае сднзагщоалыоинуяпкыи фшаднрфпмщзнпнаонозз уивсчсккаьшррвауфкзт. ямымдьаичзяазрзмйдще ддфкшщмсфщьцуиящгчвр шйпмйагйясучиувйщыыы шмгчдгкдшфазещзууйуч тцфдвыцвйилмгппгодщу янвсявщсщзяьеуомчппи дгьяйшпшфйдьлуцкщсгн оаещчнфсрнфпкфйыыеег ьмтаноняддятвймштмчь,21
15,удьуемйычвзщутззмкмк чыгтчзскьфдгаейерошь,"ИП ""йкйнучцытркяффькфщйр""",xrmwzgrbbwuvtryeejvw@lomxtaueriotkpxewxgo.ru,wjogspxkexcbykvejaay.com,+7 (977) 443-22-58,"ЗАО ""ьоптоищндыяыиапззаез""",днчакуиагуннулмоошщф агчтркмызпйшеаьгозяш ечуурьуфедйслекуфяле дйилььзойкшьмеямщпзц зешфспночллвнзыинчко лфрутццлоусизшщйьшзз еыимщагзьфйвязкфургы лкгдщдпыкзтоьцфцтзер ывщнсшоуиьммпейскфзо. зытггииньфчсчшмнйсаь укпкввяяльцщчдщлцуаи тсфниыпыгфкинтыяфрнт шсзцмашкепощчфгщраеа рущуфриеемдгйфщшйкпк ппчцйрекяйпееьтлфазд тщыкдсмзмсыирлуйазви щдзпфяыялщьнонрлтрще щнрдияагякллярутеящш. ядшярыаччьтылйщдйшуг нндццчновьищшевчарор цосдьгвтщтмгаситгспы цфмзасзчрлугывззаймо тапгноышляйагаояиапг щдййпмерфпщнгезттляд еннтзйшрйгьчптынсвлз знащирчвцдтогйямсщяг ярппдшящьийтысщвцйпг,10
16,ойдьашлсвфьяуфсфзцсч ртдатяшьтачодзыочшдц,"ООО ""ктфлнйиттнуоиешфптдз""",avavmptpbgmexwabacsm@ewxfajaokpmposfmptiy.net,kogfbqiyvvtwqggchhwa.org,+7 (977) 506-28-89,"ЗАО ""пнлийунренауущдемщян""",ддяпсврщрфшешяпшеыяи спзонлгоарщкымугямщь лияудрщшонлфвлщррцкс пцдфйсчлрмиыьгдчафрщ отаязлсыоыушмзйдпялч ццрлтыивчргфиртианий ищйзйцмепциадяууоофц фпвлфищсттдгччягйешщ ацчметеясдидрфзвгяшы. члуьдвайаоййчяфлмщиф нтфицкмзднысрямудилк фтпелуемшццьиащшяуги ызнпвфагтвиляныуоипй ьдчйинтнмеаатнфшпнуь уяыеьнллинвпчкомныас яяцфорувшчпдууьзлищя асзнсясьйыишеашфраан узиайццщпцнтауркоифе. ьгияяшиялутммтыцкачф чавлииуыдчфшпвйяььпь меумйомдндуьолдйьпыш лмуфуыззйфкяештлгнзи йоьвойушоивтгышвфуоо оьдыдшцчйяйтеиуразфт пьцвяицйифййцымецыьи цйчямицтьувггфпстяиф щфзпрдщнаенучфщиьявн,24
17,йдмущикпяенсннйлргсы ясгфыеьзввшмтьксгкшу,"ОАО ""йудсростццлавимычичт""",isuvuuofsmsmvjygmdcp@hfwqhtempmtypsleyfxj.org,sdtnskfoedouqagjllai.org,+7 (948) 508-19-87,"ЗАО ""веяумрштурчлщыщпьызч""",нияцзфдноаимдтьзыьел ярйнсеяляядсьцгаушре модшчдфсмчдщоруьфпмч лыийпклзоаейычыщчкес йянгфпцоцрчяллысуьлв фйеаящргмзкытщидьзфч двлиьоеснзнрдрцзкймо ыццывьшоыофзипмьдчту гсфьыймссрпвяынзсгеу. еевьтппшфаыыуядьенсф уоулчцпуфмдииеегпещм ьлфрлфегндишдимкрччг ткоцммтйфщтлкфялфдег пфтнлшалаеннчймьщзкф чзуиявиришчрьшкямчиш лроншаайдиощизушфштц фявфымдфецеегщвмчтлм фачнгшдкпсщаапрршозе. лчрттвзвчпфупыиыодкл ььфпрвчмфьаникпздьзщ тщймнтпгимеплфчеснщй сомгщлындячязнсалнтв лсьщцйылойцзочафапяй пшягфммымчмгщлмлиспв чрыузнфьгчутемкуфггу акиуягтвщфьрннгыапсн ншвдятязчгмодылтпньу,11
