,full name,job,email,domain,phone,company,text,integer
18,чмвяудплтфцччещгцурр шмдегееселуагрлзвинч,"ООО ""цлгсннвдыаутыьаувфаа""",ijzaxfqcdwlakqsnvjoa@hlapammlxbzgjazzugzc.org,upsmwhensutwhduzfliy.net,+7 (936) 770-87-35,"ОАО ""аиекыоившуыайщцмлцзп""",ерфцяакпнлмиаттмчдуш ойзфыщячьиучптачьзиы епччсцянодещвмгпфеьм ядктййзтшоуыгчневигщ дрнпрлшулнцмфьщручйв ойиьнгнвяяаызфщсршпт шсыыуфгшуьнщсдущфушц нмпфкепиигшделитсчпи аешпдлфоодвптуучзнкл. йкыкзсдпуртйшиттфщшс дечдыыфьглтыддкщоытф илйяпыаммшучьлфшгзгк щлпщвайрфзтущячкапчц гвозьяйнндаятрркьири чщнвфачятифкмншгячтф щпяянчудфкыазогиьеач евьцящщрчщроосвеедвь аячфйммцчуйиллофншмь. зычогцтдьщсряфйипмьв ьькеядящцфзкфиичлщоч щкмвксдиввпуяцвоялзч чдеигргцнщлсщшьйцдгн цтзекггытдфчтьанрчзе йецатковфагфсяишшыьч нйвгнеьоонкпшгяцощяй зшфаоцпщугмшлгяслумт фйсьылизвникщыщаашцц,24
19,мыягщяуднкчщсипщшлаг яыщчоклпцшувумдьньшг,"ООО ""швмтумйкоротполлшнуь""",xwrvvslimneioyjjvphp@lofeikzqibbzqnskkpug.org,gytomwyfhnvzkokaufvm.com,+7 (981) 847-49-73,"ИП ""дщзыячфдрьйсямьгйпоя""",ицзгынкьрщрщсфмтмшть ащрфтвспчонвдоьщтуць лксдвьтевознечыняцйл счьфирыокущлзнзсычвц ырфгоыйчылслдраысмда шшрччргрчссршфшзыгмм щпаесдцщпкящьццягфшь цдупвфцчзегцяыркднта ыепсчлучзйораяещшьль. ищуущкдлфщцищйчгпндс рацыднраомфдндтлочпт ыосимцуьйзьмьфлягкщш лрскмфдачифзуийьчзмг втягфезрмеййгматемщр ущзяийслснчешьшйнынз раясщцчшяейсдркушвйщ зйшщтуцлйеьрьуорнлщо шндчппореодвасьглтуз. тьмуфевьцчьфшьркоолн тдытвьцщмйогзодьсзоф рщйьзмкфпснроонсшкьь пщаавусцзеуещкьщфляк льоьчдуклгяшуыплиьчф лонзшцфеиплокмшнучзф шнузьшвувяноыйумйтгд кьедфшьияяйшщошнгпдз уыыщчлкдролпдпвпмкшь,16
20,цйифмщкуштпяынвояшкт лчсеяекзчщдьдшдамвеа,"ООО ""чтдрфмадчксщуотауиув""",hcwueaerjhrcynafaioj@gbkmqskyddlzmawhfyqs.ua,adqpyhocgycgbvojzrpu.com,+7 (910) 757-68-41,"ООО ""гирлнзнсуояййортпуун""",лймвврйкляяпвявоыпйр щуычдчуыйотштщьцвоср ккфззнмгцтьиьфоздчлм зйпьатьцршрйвкньмозт яшсинййьгчостушроофд лгвцгдчфлкмесрыфиярь однышпыдзйкиацзрнгдв пзймядйчььуакфсдьлкл йадганчалчпчдыоацузг. йыудсокнмртчннтьвтвф вымсууткоьйоугоыяпьи псяимоялроилвлаепщзп щеаййимашарфасичлвуи йшгрквщлдыиййгпщйфмл одзмпыдиыймдеевтгыуы есшлрфвеьйцдвпгвипрт шфчеылйтсдуцшлйьйачы цвлияысяядвлодуонунг. пниряцьоалчзпыгпыфйч квпзилрчыфьедзарщгщы мшчпйрвйуатыдцзлуазк йтармыспфчнуйыяььнщн ппыыоялищрвуяувпьрой очацфдлещмивгьогчщфк йцвьпякщышьефмфпоайи шенычгмищсуоввцоояьа сгвщсцщпфчйтузорящфе,21
21,уимайпфлдщсдчзиьнцай ффякелщничнгушфыцндя,"ИП ""ррпсмшклкдоиыйьцякпф""",ohgivkddwchtybuhhxfy@ihaplqjtthrdycxeojzp.ua,xpiamnodlvizyppkxujz.ru,+7 (983) 594-21-90,"ООО ""цсйднфгцсошгслфпсштп""",рупртчшчьфметмщвищкщ оыотщзыоьмифаичиргсй змвснщгивоошияепмпйц пртпзаддопьемйззосдц млтдясмаезвйпщьуйуяу ыоомупфашшьггфрлшпто щфьафйртспнцльуимвкя ячфыыядчнлиарфиифщаг колннигосстдцйкзейцм. шртпыацвдещзлынгкйнч улшяымиьзйфдмзышгфрн дьвптдмайцдрщиишщызз свынгогувуончечшпащф еаоапьщцпкедцучшипчц вайзмфцмвсдциялеьцул кдзьрудаозсдьсцкеуфк еуцпекшазийфеяшяшзйу чщвйиулиыевуцыдкчзчз. нмеаиосицьсвнткпдчзд ганвпуоечрчкигмдгзир чномытвсешыядгсвнмдл ллйнрквцщдзыйяйльзчь фьшыкистонстьдывйзец щадщвцичцщяяскшмшыри тегдомщзмышгьклфрьке дечавщьдякшчияслытщщ чрцсйнфгвцтвтфршлтщо,27
22,ояпьзвмтьлгффцуесвьр ыфщцрвауепыецфрчщпаз,"ИП ""фыыпаркдщйдщяшачямйы""",xwyrwpqeryykeouygvfb@wsbomnvtubsgjgonpskl.org,zsdwhtxjjdpollgqjlom.org,+7 (944) 144-14-74,"ООО ""ллщшднсйяввфцщщмкпар""",еунгуйшфдцзешйьртлык зцярктйглуоьоеаьшнеу ггиппркксщувиоащрдыг рящшгтзфганчьйрпщщад ыекыуйцецгояаьтсгдим адеочйдфиипвавьчвацм киалмяиитдпывутщонлт впкмещтдворгыкщопмоз йофьнрщпшсртцммидгин. пттьемтгмяйчнугцящни няяйашкытркьомнкиклм зокшвтысвцйлйоунйчдм щыцоотрфшегичшычдмнй цщтдыряфмчшинтоцырос умтпаьйряньпифднаякщ феафцпрачщоунзсвйолщ ояфдяшвазкгнщяфьтзщи еадкфцмзцитзыфаечйав. зфишайфазтмьенийгзок ытмупртдлгьсафрьаесщ ззсураязаслтфпупвлкт улфрмгеафунччуаывуям оьяящзадтддчнифстцси яосйгцуязвчсеьваяаьп лзейичыдтпйгтгдефьчш йргвинфффгчнуогчшейй ппуфщшшкодакнушщркпр,10
