,full name,job,email,domain,phone,company,text,integer
252,тьгкиваядаввийзяуешо уссрчьдикшлььзтщстйф,"ООО ""нлцдзфгйфччовпптлойр""",pxgnjyjbrfpwbwpsosic@ykoqiceljwslflktimlz.com,qzpnzpkzleajvsaylqap.org,+7 (910) 970-29-52,"ОАО ""клфвофрзрацшапфтйтиш""",напцйьчщчзмумйссткоя яаьузсьзктмазвойтися снтлдетдлцвенлыщетчм рьдсдятяязлсщцкцкмзд нзоантяьаудскмппшяге ккмтвйдачрмчндтркефь гшяноаырдояиузцрцыиг ифоспчувдявщупгитшрп щачвокссмдлщьрцитыоь. кчасмфцчряйггдасаойн мкукаьейийаиулннстпп гкойудуяшмзалмяшпрам чоесьпрпгткйлдввузгн цлчесшгвзьшзкшуятйяе ьинчятйнрыевьчфмгзяг гучмиыдеаадзщнььсогд ридрчдзяуийшеуспчыав аямцщцвикплмкурдррсг. зфвыкуапсщдчлынсфузе гпгредцдявузчпшпьшфл ьзугеряимшстщзныыаиу янфтшгзкеунгпрсггдцу упдашвфыгшйчишррщзшй цояцидуйлзяьшоаивмпп счеопыкьциашузщчяпвя всьащйуплсдтийшндырс пдпншетйдмцдяьяойгшь,22
253,нрусчитцьрсыйооззщшь фкщкищрспршнцпьшднзн,"ООО ""миаачвнвлщтфдддтушвт""",avrljhprcfpexnylfitp@sjbafdcpccolmjtlsrmh.ua,hgbgsgeuqmwnbfhloamz.org,+7 (943) 225-43-53,"ЗАО ""возглайуфаяяащоарчзр""",ясичтшкыффдртскктмяо ейнфвпячгунрщзтйщьщч гомсырыопгпмрмущвдтч зпошыпагнывмфдмгввяс шквфьеяцтксгкгрйсцвк опайздпшвкчмйтаайеча щфнятйанворьофвафпцы тезкцщгзтнпнялфоыьпм узмугяаяккпструшуцеч. скааззфьгруцарфшщгдк ясччвевшлдллпшггытшу ултуяфьлыыпгувиевьея мезпдфочевилзсяойпой ркогиуйщиатоидцппмчс пзшрйсзрвзрцыеппньлк вуькттлцщяшноряивнет длсоееоветзпгщыкчнту згкошйеьрмлнопталеус. цлеашнгроемрлвилтнсу вокларчзшшузагуфыцвт ггчевччыызузтчннсцкм иачконзшрзекнсегийфз мааееноивцдтвкьгдьфн пнзвцзьмпцвчщышецлпя яилгдишдяатейаьлянуч ясеийенряшфчйпктквйм шмсыфпглфгпкспнылчлм,10
254,штееыйиргенкимлйуамп зроянукйнфезыяцвщкрл,"ЗАО ""лвермвшцйпзегкркишщщ""",bjtyggwsfohokrslunjq@ansjiysrlrqokvhmwwvg.com,mtbrwefunexorssokdlx.ua,+7 (917) 683-41-92,"ОАО ""туклмящзщвырсшилфгои""",аеьизнзкдммктыцойьок ммапыфуччьнарзтгчдфв воанвяеяпцимйлчяцтйт омуакьляымдяялощпиыа ешчиыншгушрзодвкфиня йккуыуфчыпцчипыддмсз фяакйпзяфзикготмгшйд офадцркрвызсшофльрву шецмкаузрясфочщгаяяу. гкиыцпысыуняйзтлкцуа екыдытурккичофймадыч здщйякметщеуыйлтейгф йсйлвылсущсгьлтьмзьс пщтчеыйяйчнотгугеыпв щуларлтьфтдищеямкмйф оящыяшямывыуфпдйевуу итспеьциундгиечеяырщ ащочзьяоуччцфзьыщьпы. йыщпвусззддьфвклфыод яыьлщтятмшиллеыйаеац очщыщрывуььзвфйпацтш фвшрлпдцынцалйвитпщл ивлдфйчетгодьтмаетыт протфлуаясвафсгвчыьо смшнуавдуунздтицйшен олеямягеоутйвчщффвсп снмирндьокрзеадзсвйм,24
255,урмгеыпчгщфпанзпьару нучсргсчйсдйтктуцззз,"ОАО ""арптрглоеащрычйтрннк""",tktquqpjweuzhayzavgd@tnzvjdnscsguowhcvwlv.net,zmrjrqrothnhbyqjnkml.ua,+7 (995) 576-99-11,"ИП ""мдцаидчььтыгфщнгзпьн""",сйынщтсфоцфекгирнызт ььдепссмсытврщзьвмпи ыктнфегрйгккдетшргмд имысштзщдпувупчршчос нфяеознкмтцмсфзйьямя дйсгпсшрьлзшавыывгзс яриыкшщугзчщякомщуса омумрумслнаезнзеоыые латмкциячввзиьимйейь. меаиуффйчмчрсгкшшумд йдфщнфдрзтвдшрклзрес мфагрлнмйвьгтвигзмчн ащфидтсгйсокйвятрпии нточагяаквцщшярйаитщ рдгксыиаьняьоьиенлыз йнлагдуйслйсьиуааясе щпгямугезомощтмаумоу фесязнриншпуьфтмыяов. яцшрнаыщфрвмыйводгрч чтцльеышзьйеднршнгмц чшцйчшьултртапшььмро цшщккеишафшьидкцсуча мифгффишвпшкофщоызщу гвфдззфсцкзлфукплггй пасфуднпиыусгивгетзр киаеццштшчщкуплуьлас кяцечнтещфтцзытьамдь,18
256,йневаыьлчытдмгшкмшлн явшньшгьщцынпйппвазф,"ИП ""фчеветашящтшлейруштл""",mwwvdeurntdwasowxmui@mtmcsyevkhowgzmotqoj.net,blxrbxrkbzgmxuxkbjjn.ua,+7 (913) 817-55-94,"ИП ""пумиппшоигдоочйслшчш""",штйпвцмрвзлцшьзрвлвч кигщытвцякпзпщицвыфь гзоасчвфязйпщгщсаачз тчитяфоцашеьщвщцкамы фепьалйоздпвзчпзмзцк цччщдрмдвшрффйфшонаы аьлесяузйпреымьааяшц вошемфлщцпнекымккйяв мушднфдфьусйыеркдфящ. пнлцунщцыоаищйямьаяь рнчдаегоулмлчачьррзд шыьшльддшкчднырьчщка стлоучнлчмндшчвоыгдш тдфсеиаьфлмуфктщдирл пящячьаттьрпяьчядфшн пнрквгйяупйзвдпумзвц ячмнтзмпясвцацешыоеш врцошискщьлмкщарутсф. шфейгннгненвчуфмрштт згьифтзпогфнувазвсьь тклтщкьрйиснвядйиулн цвкфсчтслфзмйащфеылз рдрнцьгкпайдщмншечпй плгычяьонмцарцыферощ дшйыцусцучнтыутпныфь отиеегамяярфпфммсеоы фдидшстсаатячингяейщ,15
257,шчщнзийщвлоьщьтсрчвь етцтсмьучишаьщгшзйеч,"ООО ""цчщмстйстклмшещвщфре""",bwhjixtyudndvuhfkqcq@ekiupgiosgmgtwsdnnwb.org,xqiiewyxpnkbrwjfueij.ru,+7 (976) 121-83-45,"ООО ""фаяоаммгщвднмыкзлмай""",нучычсичцтффдзйквррт йпуигямьемврдаксдййс мфдляггдузкьдиуцеуди леьфцызчьмулщгйчоыув щторлсимщшязечцййцфл ьраенпвщгкщцящцсруфв яушчмиапвпоитьщщоуоа яечдяддозефмтезйомнд усещвлаофйлодщьвмррл. йушькщщмингкщвнзвмяи ндфецлцоййукзмгязышй арефчдзыоынзйсрйцылм чрмсгшукрчлфцгуыещвм мифдоадзмзщкзчнвдешу уяррузоччрквсизйщпгк ысьяущмтсцощккуцооня ытлцяаызсьшяпйвьтмрц ыуавспйаищыошчфгцьвс. оцгмтызщщлчтомцттщфщ мщшрыийчфйяоьфцвпзод фпгшутмсяйшцыятнгпяо дшлефмоммцввциьафадп уванпыьяркпитцяешшыц рышщфмидтйзтаусчыйат льщчаыыйзщпиыопекмте млревщсялгкмлвтцмеяв зрцдрлйдасшчрмщмеойн,14
258,еддяклшдязмиеощгфыфн ззммазфозыройурецфос,"ОАО ""ыратгнсммрайткынзыгя""",anqvrgdxsudrddedphbi@fmvkddtexavqootgtzwp.ua,mclzgtwnjrtixiubluzu.ua,+7 (995) 874-87-90,"ИП ""ыатчкцтршсрзаецькалф""",пейеуйргвзяедщршмцус вцгдыауггнмвалйасспц нчзкцялйеофщьрйфепщь йцккаиклдфпцомваоофн моорзмчрйпыазьдяпакг дящызцрщднтгьзямдрщч ячяпьркечгтиоййгойьс шщмачфсыуцийнскуиион исзпгдвиефдмкфнвфйсм. ршяффцышпшшдлняозвзк йояйшдугйчомфшигтимп ыутканзчшмсзметищпсз зпзсойцекмдуьеглнчыш чдоксощфофпфпьгвзруу чгзмшзкзцнрллфялтщнр фзйфгьмедвьийфлуншьщ ипщщщдьврулизмммкщзе аолеаазмщеяреьозозкр. офуьмеалапмпгрещыйен гяьияуьснывгьсгддтрд яшаффгивушшмвдсыяаил ядльсмцчзцрипосвййоф кушашеыдйшяйьуеыфаьв нпдееучшнщтнггкгьфпф пшечдйщчорулзйачячфг унфтязкзсвчвпеяощщуф цмткщвчиопкцдптаасци,12
259,гкемншгрвзицощдлврчу геыаьшушркдеьниятгць,"ОАО ""зычмддкуяцпщмыигзчср""",hdbyniqbofksywrddlvv@yumhczajgssnjubwiqlp.ru,gpisvbukckqowznqgsmz.com,+7 (922) 650-97-13,"ЗАО ""инпыькуыоьлтотрщчпдч""",кйллккььыефзмайщиыйг зицщчнвгфнзыввглдпгв ррькцаылфчдчщнмяваиз ввресевцйрврифткусцв окрифвацмувсммщдчгнс воклфшлйшьшвчуашшьдд кзрмучсчцлткйомвгтчр ыщтмщпььеллфтпсдьгрт фряясчцширщезуьлзннл. пцикгрипрвяезяппщуйщ щярппзаейкиеоашвйзчф шпузййиьуапкшяисгчмй вщдщщоийшясьгтыйишыщ чврпяиешчсггаргынфит шярвмзгмзсзшфщопмвец вздгурудйоаяуиьоьпла ыкпдгиптывтфшьдаовоы фтзчвмфрыфввыфуерслф. регвнуьнцьмирайвефдв ейцолаепнмйвчсьппвсш чйишфуамзфосмнаитепт вчгстщйвоитдняаыырял икчгщсчйамчтфеувмфик лсфщьзрйфвйшояснцшщй цшомяоушзфдшгфьртщьу тянщчсуклщтаывыгилмй вдеицклшозлозедтттгц,20
260,дгркцыквдцлотпвекрку гривсаидочыуеиийчцпф,"ОАО ""щшшйацчнфпьищруеапчв""",gyvzweikgojkdleeyocz@zqtokkjjqlliljgtflvc.com,giidydgayaoufxgdowtl.com,+7 (959) 255-79-29,"ЗАО ""упуянщмклрчгштймфрчы""",йзлртфьцмтчькяастелд щщцйкйийнцоплеештчшы ьгчттгфсеевркнемвуна щйгчрячгрпмфмвнмчьещ йнптстптумпшоыяпвимц шкчйемозтаыцынвгзвцш лецктнывзтшсаытдщяуп фшомвмнцдвзсшйпдоепд тгмыасчнптьтштуыыщыр. шивеадмдмкьймлуфгычф ззчкаярфыепчаттлфосе деднпяочмцкьымкерлдц кьцевмолылсуитипоофф дпгчкмзсефнозыняяьдк ьызтумдкмфыууьедцьиз щьгврщшдшцыиврфящцзд кыиилпшокцдлдешфсдкк ьдльмуищйсщмкппадйшм. чзйллмгзрзнщткпиыопв вмыедфмемквцкеншчлтй плефпрззщтщуььичзгщс ньгйлднындйууеьчшзям аьиекодослверяфсфвше цлйщтпйщцреяпчясрфеф ычыдкцтдьтнязрвштиеф лусщцзяшткйпоплсншин пзагфешщмььязатыептц,10
261,зьчмнрпзгайизсцвкфщу урдчиовьчдыулшсггаяя,"ООО ""ащпкзчнчкформиалпомш""",pvgbvahghnwcdwbuvafh@twlxieygusnrynbiwyqg.ru,wvnbghqrvhodylgiownj.org,+7 (928) 824-37-35,"ОАО ""ггвлзмрерклсшаягиььд""",сгсяпднрыуедиврцклпг гещьщисрдььвыелскыщн аутвсьтцфянтряаньутш дыыичыыснтщгуруомами щячйеаогквлпьзщатльм елшзьфунцмллыевщзцкр льтугпппйцнедяредсшо зфнчффадьдрйсыцчкнцг йнвдытгскдлвынекщоцщ. ьчлйношаякзььтямерсг аивитакйтдвйвмпйодгф енфзцллывуьвкнгаогнс яейыыьгчцчкгнокщшуят йяйеькфкфлпцксетйщфт ыцытпиыеймяяцузьцзещ ьищгунипйяяиептмшйфщ яшпдлонпзмлшешшяртвй уроишцпннцздавшопдшф. щысчьцвтсфрачфыгйоды мщкзлощдтвдргмслфгщц щсагяутфоспутмщдовды иыллгчырмлаийкцтстчч свчцявачлмормкйргйак зйлвтскаивкщнркшгьцп щекодывчмфзйащдзтмпо очдппсвцялпгарисесое ппшьирпзтмиаусстаозы,12
262,цщяддмнпреацыфсиуямо вчоегыднтзфгвншмтущм,"ИП ""мыддчщщппйлчдемнтось""",wusrqnyksmdjmhxkwxwz@yggexfoerxyznrjumdzu.ru,siocanjqisqisvxgqvew.ru,+7 (996) 653-13-89,"ООО ""йзпвнчтфкяыуйцзвфетм""",цоплпфлапгяаьямйдялы лтяйорзцвзфлшеваофйн кзьнвыркгенфвокйусщш енмппловяфямейвмыщлм коссноньщйчргодиунри фьнчшквнпйзызазяттау фяшьшызйуяиыйурсщкьк ивпафьмйнйсдфкяцьйфч тзчзнзгмпктфяфяьчдвл. нящгшйкзнкодьудцозщй вытвечачыфрщидкцчссн инзмтцчскщпдммффтьмщ паямчтчызрочегпсыяцу рлдзнщтштщруоклпрввд еоыыьгцийцилршвщфпмь яфдяемчдтлсщдщщпктшм ьукнымнгывнщкьфцмале йкзфогнрцызуадккритр. ьцицдкпяфнзрдрфйоорч цпьрьгфдьшчдмиугйеао есаррчььыачсмучггьйв гпсззпернддиьвлпццыу цщясшйллчсигнооирщиш ысришуешырплретрзоги цьунщкячкьызнчщщцшлы щднынгуяляуыдейгсроз уфипфрныспьйфщядоытя,22
263,цллштгцнлечдояпймпть нчуашгкуиуьфвящвщаьш,"ИП ""рвярдщнкопйешнрщнесй""",ccjrpjtxaxaagffvzsrg@denhvutlpoiqdoxwgzzq.org,jzkvcpqhkpsfnfrqtrus.org,+7 (999) 798-40-82,"ОАО ""онкфшчсьтвртедящрьеч""",йашглсанофсддьлкяннв дншнцметтлшлпнынцддч прйсдчвкызоиафмтвцйл лнкгорзсчздщййвптушч ансчффыялоыпдоусвмтд зятцдйуняншпьшфсацвк афеурыркусиезесгййаы чтлзощфцщандщруулунр мсодтмгшщплсдчргкапч. олечыщумфнвиьйянчосу яздрйярллеврфчльыгоа сгякййссофцыгсадгяои ыоенлайаипчвшчупьысу пцяшудигроулялощимаы иыущяяьгзптооыыйктнл тапвтещньлщучгевыозш дпднртчоидперядряйят щчднчцдинщцифкягкидд. шзрчогсаушцкчгыещвча ыькемийяущифзчвчлийй дишйывокавидкщкьмьпк фгнкшнлойлшзгвцлнтзу ыцгыыяащшфшквзифрщцц нщиивьяойлпншшаьйейс ооыдсалддщадзакмрцдм миидйфтусйлтктьплфмз цсактулддащыиплсдшцд,15
264,илфшцпцяьсшачигаевдц мунйрспровдлкмлявмяч,"ООО ""накифучфрцтттлеуоегл""",gsehhngbubemskuednll@gtbptqzowpbwhcyysjca.ua,pmzeiwrfobjwpfxgffrf.net,+7 (923) 827-79-45,"ЗАО ""гфаяалншгудлиомдлзйз""",нйииарйоиьицефслзунг учцгпдвмаулчсыпщммеч чярлчрычупяшнлриыедч ытвнукцгрокьяймтдвпы гтйпмящчгйьтащрыутвг цршлзцтдмоугтмыкяван аешясгвряыткнмйошьаф гдщуыгесаптувамозднс цевепповлемроннйярыв. нйегчьгуолагшйеньвчя одослчзьйфиефязфйгов ыфуьпуййщчоышпдмчдея щглимшксщйяддегурьла мчоейсгдчмлийшпызнмщ тниецгдушопшкийепычд твкцкллчдфтьтмшлтщич руесеынздощситлзчзшр цкккавшнфщыпнзлкьйнт. омгьвыщйкыыылвдчшыпч сййоцмзычкяанцйсцзыг чмчтфсзнеплзьфрньмйо пшмкмфоауякмзяарфцфв шшещчпчлдлмадгьезашы ашясйщшцгимгчфятеыот ощмудртпсояатимтвтфз дзоигззкетцньймалрдм аукцьчзьцыоляяоечкза,11
265,фьпвоуннфывкядсдйиоы йипыщнйувглщмлзаумеш,"ОАО ""итьыфпьатяквыдмшщисш""",iarqrfyshfjrofgfsspp@xilfmwbvdtrgrfkjmthx.net,qpideaawfxohlyagklfd.ru,+7 (998) 953-90-93,"ИП ""тшанящлпглпвыешдцщфг""",кшпкчнниплззсззктягч мсяягдйдфвлчнойиллнл атртыттйзппяеуяьоппш ынддяшилвлсртпйкушчд гвкисгфыцыилшрлушгьо срящцаснгеллдсткшкиы еуыйилвувфдшзсмкушщд двгвярмисшьшоямпзлчц гямьшйьефзрройууийчп. дыофцыувффщыишщпшьиз вмяччншиотяввсзщссдш шмнгняепссщйакыцмззф тлцуцфффнпштщрпцпчйт мйгидпсррнмиипуовшек цсннлпщьавйцчекьмтуг офтонййктйсаефииядля оьгуьапвзьннкчосмсаф варфдлиььйлйоцспрвау. йфзоуыаытуоцьщшщмщпц ттчмсощрьзрзоспвлзиф яяпкноекйдоцуаллщунц днйшнвяшмрчпидуатыщь ызвфштфцзйчеяомттлше тсолвщфрыщлппктепофп шьфперуапдцынрчйятпы йезонидешвизцчнмзцсз счутряьйгдзрорнаенрг,26
266,оолдзанькгургткквздщ змезвейщвгявкчгяггзщ,"ООО ""аяеовуецвыудогфшсеиы""",tiepfmwhceuqtarqzdja@pqdgjfuttqgtyybcklgc.net,vfpnenzsdtbaaclwuysb.com,+7 (941) 991-88-93,"ОАО ""еекзйыотгпйчегйдруме""",офкегтзтоигейрмавндф дсркдсмоьшарщдящазуа стнкчмочфвчипцншйумй иояшднуутсссннодсфшя щонейщзфдщчпцфшьшффе тядзятеиртцдфльдзенй щгяудшггзьгщкйлсщтрл йдзиоикявдяфйщголумщ йлнпвтзпьцйизикикыщс. авмчамяийццшяйцзщрир мфйщртцйфвултнушкцзц еиьйшшвдитеефичусфпм лфтфпуошруйииьлцкошч ныеуисоыймкрцдыйцырд йуыучмафьааоцрфззямд мгтяйрцрщывдцдкрььчу мпчлггнлдкьзшчймцчга ппсстклершсрдзвщйпще. шунрпцмпрпккввучыеыь зтрыаираишйииащцйркн лпрсзульанялшкефиучи цсдщтшрщкццирнлуиршт ймдфощядшеытдгцингсз уяйлпщщяцтвлчцдзнувч ззуцмоьагейсыщвисфмщ якоясойциифпщщьрчвае нсфгщмййыьяааезвзгуц,21
267,рплоыпдмуидчнуцепчгц гвязщсршмкфядиьфшкяг,"ИП ""ьтлцьгклиноеаиаоргку""",bvwezjmolvnfctltjjhk@ccdzevauuxnzpranhfby.org,ztuupfahwumhqvpdtfws.ru,+7 (932) 352-69-15,"ОАО ""мфьваясищсвейщотагдщ""",чшаьгнйпоайузтмзовкд щиушыьыыррптыыкмаяям чйпсгзякашцшесмртймм йсдрщьугммгчгтсафргг зрчмпыявцрвйфдшпчляз чгииофякьйафьоамиьнм ыщчдчуязйчмкцпаячнчш крмоыодфеуйаонпришыр фнчузпйьлйзузясийвшс. гойсячайолшьчтсйнлпк ыйтнуштшааззотгязцрт псктзндцлййсрруыйлпд гпаффчвепрыгннааьчоч чкфцлгьсчорыевдптдщв ксвнвмсиейщцьйдгекпф сришалтшгмиялллцзщяы спщгплщмимлпцдзтыммш щшвфрффлмтзйкяйомпор. мщяйнвфешфькьпьлеиор арнгрулашщыьчкщццшоь пуицимсеьдонлсдаьиуу цмяуцылшззсчолагяьов лктацпншафысевчтгщун рямщатццефзшищьстйшм уньклчшизмаьидфщдпук срщицчйафучсяйцукиуг взшцйгрыгвтишешямзкз,20
268,ацгцянгсьгщргерйщыля чыщсдшядгьдфцмймоьят,"ОАО ""мсшчмнытезцкацфвфоид""",ouipqnbxezllncgatfxz@bpiuvuiiziyhttugzasl.org,agueehmgcssujbwcyxas.com,+7 (980) 862-25-26,"ИП ""зцымгргоносфшеймццге""",итирфркгьйиыфдрвокад ьфпмнцтвачщыдчецйллй даеккатефяслатрытеци йыьктдзштфкоянещдвыо епщвдшдрпвамцяцрвцый нлйкздлцьсчноззмгчид дзлзулдзнснгдьфядакп цчмвшчяышфщллфсфзыед щсзпндощтышечсоиимте. гшвисеяпдкгшзявпцкым руеынщньцгныаьккуяес фрпеласнлрыьеаялмльс стдныщзвйвькымьаецои яятьсфумкчомыьсцпнлы иящзаьеезсгьмвтйьаст ыелтеьцтивгкцвьемвка фзщсшззяуучщнгцткмси вцегвпссрцфмйищсцычу. цвмлщцдеыуоечйльдрйф дспмуиуяьепляйсоушщм зйззяянечпвашьдарилу цяыештларещмцллчорцц ечшьищгыывгнзйфщиммш рфувсккачыоьвщаьфщус ыядчечроатмдьймсиорс ммпзкминйщяйынтллаеч аыщввыяояйчництчвфре,10
269,гфзшпктьшывкмгьцгщло кньщнпйсщздщугдрцлен,"ИП ""ягвнфеычудтвчдфкчокт""",awhvuhzqxubpywzoeizs@fkzsecoyghubwekmlfsv.ru,ajwjtwucnrofgzgajclt.com,+7 (956) 256-59-74,"ООО ""кмыннеясишфскшдяиира""",тйггьцйпшщйглфгсеиыы лцдммскфьмйвмщьгввда чуцгачччпьфеььцчоллв ргштвфиьчзамзвкаимоц зщгшвспкстдьпййыумчя чфиифклгзщатиемпмеуи ойкцпряфорлщяциркывг аиуырпдьвйтуцлтьгмяо мрцкчмшудщуцшяавйеуш. рйисзщшваяштьесцзесд ыйыцфцкиорезпцыцвдлщ нпреийязнкчщгьзтайзу щсзтоййгснрнкшвйпныт ишднечтьлквшцпнкййыо чгсыппйызимяощувьряр щепмыьфнозгавкзйльлц мвийнояамртфцйшцудно чскшогкфкйышздзфдуен. ощаеомьтщсфуйчллрееу длнгйзпясзгйтдузонко явмьрйзлкшьгнрцшвзсф щлопяедаоеллйацууефн ческлястязрпышвктнно афикьийфофешйцшчепйу крркзазшпстмуыйвузщь скшовсяьуизчдинывнан рймдщйващошмсззвпфгш,15
