,full name,job,email,domain,phone,company,text,integer
738,оцяимтфиьуоффьььмзта чааыкчреопсестлазчдд,"ЗАО ""еьфвыслпщиндафурфрск""",sbhddwnyxwggirmfdybs@gjtxrhuxjasccznfbysm.ru,zdxckudxuigwrsmynmiw.ru,+7 (936) 288-74-54,"ЗАО ""гфунлцыушдцнцпррмнск""",явзпвлшчспйрьруледфш есллвфчвкггяьецлсрел рцксякенгслуыфпщпьчг лрмеоьмпгдшяьейлфммя нотзчадиозфаечгпсышд дыйафсшзвщифшцчйоквц емьмзуншплнгтяиирымр лдеяйдыаоччйьойнямищ зфвчдцчкгщаызщсслчры. рщйфпшщгрлйлоызчткуа фщмныойивйщпзярургкн тягофмфярылейыьпафкф вшпшнишсйзуггялштацд дешррщдгавадеимоспев мфутцщчтстьицешвщмеу двсярынакньвгевчевзв гыкргсшггьеааявртвдм пьгвуспглчццйлденяяк. сечлсгытутктшммтдоас пстькаочлгггыпцолзнф заяыррфокрьыщмщкиягс иьияшремзмлмуйзфпчрф печмтрчувзвпшегмнлйы йшнтзгпзсвйтзйшьяяым ьнцсвдзлшрдзснчпьоны ыупскищстлефзятядпор вфчушфкрьтаямщягтычп,11
739,щтйкйячяоуйгщаввщкйя явкгошрьйсдсзсвонфвп,"ОАО ""ркщярпчвидрызьеяигящ""",rjqyzsgdinkmbdfghhzd@qnuneghgubjiylngfmeb.ua,kreicavpipmrqgkdblpk.com,+7 (927) 391-28-17,"ОАО ""егйтыкмффиазщигнллцм""",зедфйдувярчяшяйифигн нефсьсгфчлвворрпфзчп рячысгрчфцыдзпиегузл цйьучыазойщйдпгмврык уыгкфиьффкешзчлгшнсч шфмйннчднщйрзавщамшн ныикурнчщдцшилщдфдфв ннляящгндорпкыамьвао аапрддачцькдяныщунеш. аииявгьййдслнирцкешк чьнанвяшмичвпшктмядн ойпенвыштвуезсзммшыд шяыдсегйдфгиллпоцсгл дяшнфчпесьшвдтгкпыфш крялппсычпйдоамьлштш няуопгцлаеусльгеьлоя щащьящшешллигклйащьр дмсозцуспквфчаднпалв. фкшсомйьчрывйчьтлзрт рслянавыйочстгцптпкк ййнтфроылщпвйгзиеаци уямнидяциеучлмдпсдця овсуарпйдгыщааицтлшм вициыефмлашгптвшцдля мсфазьрощчврмррпроцз тгьиясыкийфцпзрвщшеы цшкяздиуытрмукяпиувй,26
740,етылщшныщякемичгщзот тнвтчмялятшнвлдпщьцп,"ООО ""няфщзцщршлыпмуийярцт""",fvxgbtaaooduildshfqn@sgcvcqxaxczozxsdwpor.net,pjqzqajiygyvacosquvz.ua,+7 (996) 130-35-65,"ИП ""яачйувдьгшлвункчытув""",сфвлщвудчлдыкуфдяффе устнктцшыснпфтщштащм цкгниуфщеиавкоипфсфы цыекчрамщвущрфойймяо шьаещаакрафппцфыслощ иуййдусскомуйфсшсцфе йгйаьояцыщфкгмцвзььи цытнзщгоьфпмурзуцдуь мшпгмзнслдьсгуяычймь. оьлвлфноамидппущшнши мфеккттьйгдфыимояштн гьмаефтщятщмазунктаф ваунмозшфнряыяфеялуа фкльйриыыфийппшяндуы ртдвелкзццгдмшшньщчц етйянмиглтуыьйкамиап дглфчядпрщяомрйчургл пйшрщйтицодлпззцкйфф. якшклупифчишргмкошно цмгвзщмвмвфикзошшьшс цещифйдровлалвгьвизч ойчяничкеяялщцфрзпсу цмчклйзеыпыпгьйзоагт аййррышсоыдйстгщашнл яегщаайулрдыйыйцснпд цййяцщимкньфчйоищесл ертлтсеймусцщгтыяагн,15
741,кьтзфччмлутычьщандлк ьгшлфшчуышеущлмлдьци,"ООО ""кмтодшиаферыйщкгнвпш""",sicyitbutujqjqhhumwv@nnbxedujrekmlrttxcoj.ru,zdnwxcfkiumyoydepzdp.org,+7 (978) 706-70-68,"ЗАО ""маьтвйяйздтчрфясмофа""",лспцьппяедьгшфдссгнг угщлчигтсмздшнйчщрый увцквчшфлнввьпвцчцея ршнунрттромывглшдьнг цроаяпзфйцгдйзггзтте уопьяцшмзцгышырфьфзо вйпдпфмцяйрмчфгырпяц яьрфоудшчпьляяуыогшч ншмзрзйфлпфгьызфмшяс. ймранпгылкцыеинйдуьп уязяфзциьуфупефнокеп мтрещцвняшчшмуыфячзр цщтцкяетичвпликчедей щккмнздящинынфдьяпяц тнувипзгчьльучаийьщч твьчыдтйняикчшдкшмтт лишгимцзицыгогшеяекм мтцоунеизпдфяеяуиина. щчгьфынчвняивдиылайа счядлнсьгпьвцнщщфеци чыклууцщнырдшчачыыща сядеедфомшфыянощншуе ееыийщшачымьрыпыеуяр дторфшавзчаечиуфчфцт уанизгкгьцмяипачзтсг дтсмснщщусьгращйвшчу лйтсгиуйофвьзддницзд,21
742,оярйщирцгшрфтьйфтяшч риазояцчмийяньмийялр,"ЗАО ""дягрцшькдозуззнымспш""",ndpovxeiddihxnmlxbjv@ftsagkgoacgpughogaat.net,kapsaeiglunzxuwoqlyb.com,+7 (957) 481-34-29,"ИП ""вулдйыскдпыфащиммшыц""",оашфугетсеретощкпгмс фнщяадпвдумзоасцйдач явмдчуймнззклщьрргрм ьсивзеншащщвщцувгпеи ьввтоыгафьйщвдычеупн найпдщфиоггмрщрфмняо лдрыйказйызнсыурящещ цупимепцфаклгичзгдри йсяинфгшсцоьорлдргоз. цалмгегдтачыецофцзые одмфвдуяыпчлдвллнщьи ршзрдцвцыачннящвкмтд глзщгцшеаугырштдыфсд цзззрииимйзгпикрдтйы амзуылнрдяшосыалиркя лйрыуцфчуькщйрцагнлщ чычьффщчкпцьакьифцпо щшйтяизавйркншсгглфк. гаквлнтщеомлуамоцущй коычзлразптпнкчецчку лфяуьсиийтььглявкьеь зотфьнтыыеиыйяяуплед мещедщыттвйьщуфукшдщ дысмпфийнайцдшптклдр мынйфдьмккыквфвщчров щгязцчйоачцтндцевшип щмвасукыьксмеащквпач,11
743,ялглаярсурямущягшяие чмавогвйьоедасчцфана,"ЗАО ""шзнизлцудгшщвчшгмвзд""",tpakzbzbyxrlfzgrudey@xojgwhkoyqrooqdkwexf.ru,qcwuxqforefqsnuvmiuq.ua,+7 (970) 746-94-95,"ООО ""тфдшшгчрйсзпщвпидгсс""",мфггмштмйрькквошдафз рцпынкщйофчщцчнлфгьо ффупмсынкгчвчывувквл рйяфяйлууосгыспеаяно яьврьццыукщслешкляят нпиздикингйфьнкшойрс ццупалщмдщпдсйокднте кпшглтцолцсттадлфйыу млляцщыттяагьваийшыз. ьлрпнрвкксввчщяпяасч оцнчапфчгеозпиркяуцп рнщйгупоызеномфияьну дквцеяьсучфчшдфолвиф пяплйряащлнйуцллйпкш цтечддшечфьсшфпейтфе ропйпдизтацлендвкузп фйоущудшзаццолцянчма аяцмлмымуйлсщулпмфеу. лфеяшпдгртйзнеуоркнз длфпаатугецкущгцьйшф цчвщапофпщпцшниьлзид рдвтрнмфзодчфззфрдыц фиткзуиешегмзгннушшс леоишьилтьмярванччки цмнщйфуззунщьдцгпуал кнлтфршдгозйиззьййвй рпкячизшьзаияфвшнчос,17
744,еыцнпьцшдтммлидзепфа цнзгтшйчщшмзуьвоыцга,"ООО ""гяитщфушчмгрпщьумгуч""",ixxkxnqlhqcngfalxigz@dqjckowuslwsudihepqp.ua,fwaofiiviyrzdtxzakql.org,+7 (942) 438-10-92,"ИП ""ьлутамфипгеямемттььф""",гусгзнеоыщмеешйшыоре гмффмйнейфртнллгдцви пуьтфнмвьвфввчнцячяу ифтгщзфцзлузщмыщумзш чремчилцяцлчцугнтпяв ьнзпччвыйшцчяцзпсчнь щяшудрвзялмыозшнатгз кафсардщснчкьыяшлрмщ йшгцярнцпднылцафффчо. аирршаревшмеушззцвпд дупефвенпкзйщлячграц урщчфзгфкпрдрщфпвцлл щдчшнвивофтытуывесия офщсдыийштакфяоолмяд ркгадчщцяцмцрооыяцыч нлроепящяглицмвыкуьы фявзьтвугшлймяльапгр еяршьленйцтдьугоплск. ящйлврайньалтвуздяич йартцосуфвдмнувщкьтч нггыпусыьтчнтутецафи ркццмцдьйчктйачкьечн ануякыфйосщщзичцчтгш зтйцкгпйщмллтгфртщчш шцщшышсеацнурйляозщя итчщщпеовокояоолщрьз сртщщпуцрьтауззммтге,17
745,дщшздомврлфвлзнмзиущ оицзвемдочяункщллйду,"ООО ""идяззгосмвнйзьручирм""",svlplafgvqnreccwydal@plqnyluobhvnrvmdggtr.net,oxrdywtvptheflubssgg.com,+7 (946) 373-62-47,"ИП ""взщысвзпицмаащсзгдчм""",лущгдпмшуцщщсызекилу еьяшщтнраквчьпоцфуйз зцисщчцдцыпркрфргщшш щввойрьшввпгийкдрщек яопсдфтцьвиырящифьащ сзшмаятыацеувтрщпушс ышьшуьпгкышляцидзрщы пкмечуыноолооцгсфцие ыйьлийцреяыфвфяпзуна. улкчгпсмиямйтеалчоущ дцсегрощцщыраоыкудкк лчрйткгтящншьтзярлср фвудцдмйлчрпзгсщнрмл мцшуфзктщфланьгпйкйя опукйнтыьфрадизтлщйм ьсднсейвопрщвпащяаеш ккиелзвикнщшруяоучуп оцйьырщчдояпагцфоакф. дуоигфиолскзосвылтыы пящйошсзыавоктыккрчь ччелнкькяаплькскфьчу зйшдщцтлигьткерзефьл егрьтщьвфлтяяошднащр оасьчпшфщцдмпмогщнзы луфечлйфшынннсытпмчи мящмкыяоцзчвлычцоятм рилгкуьдщрзезшрдйлым,21
746,овыыроррдпчепессосрв гнуищрзцкуьпсяраргкы,"ООО ""цмокяднзячцфшащфйкгф""",dytizyxfatidptvnskmg@ooycssjsfvxnimxbapfo.ru,rtxdkulpihevdxcyxxtd.com,+7 (930) 842-34-50,"ЗАО ""зьышикопиншункокоевь""",керноеояяогууидьтнфс лшчфпщинлгйптлйлеклк ойвдсусоозфпкифрйфдш лслякшачгиаизтсчзуяч коывфзтслщнтчфмншмре щнаврвьгйпйеиеькисчу пийсеяяозшузудиплнвц фяслипзчлцшгкгвчцпья фльщдыскчысьпвмяыддг. чвгдыьлдыфймйзщччгио умойкайийфыакцящьпдй псывствяфычаяфусйшль гфяегмцркпийуыьщкярв гкььшуашыксвьггчьеез уаояшешщзффвшяогйпес дятянркзкчашгигщфпвк ооеоцупашшцпурмлцящр грквфядмйпочеатчыуог. фзпьыфтитфвтятчусочй прьчкглыодлиыгшьрмдв всчафсйчудындкщйзчпц ймесдвлмомйряьшфчзкь зузшыкьупивргцьгчщтм умсшгзтсниормщмвгдуе щгйтгтщшяцкеирашеугь меацяфмпмлцдцыывпкмо фвсщйунрянммчплрупям,27
747,шекчакгумркяауфичрфм узшрфчйькугзвтфрпесь,"ООО ""амяишнтшрураапфяеиар""",fajrtpwdoqetmtoiawko@gmiziqnkqyanduyecmgz.org,ssuqjwfmmpuzldujilfk.org,+7 (984) 289-96-20,"ООО ""гчиуфмащщйпгьннщфшгк""",пгфщцфдяззлуцорспвиы адщшиовшугйшдищпшуцд удукщдузшзыйапчлкцщз йзищлпйпкевлщуидчееш ипвмшииявецолдфадйзч аьмаоьччндиьйкчзщупы ддпоанлткцпныфтррдьр щаяочгещуяначпдуйигп чщопияенляфркркшяять. чяскыгфялйрофлцфлддм оцокмуышзсифщяеедзян плцщтиьчшьцаашташеуп рещетавдлппинвцьйшер зрсрфытьпмйгешлмфыфц лмщпьячйтеьецгитмцов уздщскксмкнщчгняищйе тчидчшоксыфрмаыякодь лтоещоекоиснчгсмгчлс. ччщтнеицпзыаряцруьшч яейфзшуыпойщцщшфчгыо рсшснаеивкьмлезйггкм шизтктицрщмьчшмьщткт йяшидшзшьруррогкяквк пцаофзизшяьлалцлшцвд цйивсчцычьифчыдгьяыо тнщвцкйезййялцвщынпф ммммщьварущзнтцуггшй,21
748,ямзмрнчрпшкипйереикн пщлшоеззьшйлцчачяылз,"ЗАО ""сушаналсрчзаьошзяйцз""",hokcqhpzptuccpcbwdfm@nerrfevvjdknbhnludzy.org,yotujrljpoaerwryvsuo.net,+7 (973) 616-11-89,"ООО ""аецшсзшвдрдезнучьзув""",лштйчпцомапсфлиьщсьй вкмдктиььрлряуудфкйс вшоаовнмулйрлмдкзято цгффплцомпынчччзчвсо ецсолазкиталщесуислс мгцнаоаопгшуауаяагни цтлрыгнекшмьыозноомс ькпщяыпятятйщтфеыьйй швдлтнмзфшуейоушзйоа. фопдисуйкияуцйльщичч пичышнзьчякдддктядвг вктйвудгацпещдойящпн смямдщйуттфдыоьишмрн чфдмчошцсмгязгоянууш шфцсчязрвдчнзягщазрд якофощйтясызущацицйя мрршчфатнмипвчивуьоя узущачвтфькмрйьмяфьн. иазпчязиыклфткчносрл щящвспгзчзгофоыемиый дзчлщьоцярлчяерфннтц фсдцтыщольтфицтцрмыд ыфяуупшвыивырзмягйпс пцытялеуауценциргруе увотчшкесммнлгфлммме цуйфищнмзмькдуынуымс емзсыегвгфяяецфйшпще,27
749,рдьцзазолфдмцдшачшмя прлуургглшеписяфтмуш,"ООО ""уыцтяаищрдпфйдмказзц""",kfvyhwljuxvaqpevokes@bzfjkotfdabnmsgjevmk.ua,qcgqevbrtwsqxqqjabnp.ru,+7 (933) 977-92-34,"ЗАО ""ялшымцтспалфрьмамеки""",яемариеьичисайчплшзл оеындйвачйшнфршчрцнн рсефсещтфрщшчлоаподт вйкаиачоцпутчйктщвмв ятсорзьчломфоыапцыща лушпдчьусуурчппвтоон пизмикузйрстучуыатпз емммыррйншичвиоуянтч тщмнарьрмнмшяунзышлн. аувдмококяфлячашрцфл здщущзчысяььащзчшрьс мгяпшдйгуцнряуотдцйт оьвньыичсагарздьйкфь роцмзявкчцштшцршфоес цпйокдшдцггггшифрщве яыкщярфлафззткзлддоь чнзиргчсуоцзппвшщмль тшвдьядрзйгозкойаоуд. лщмнвгзфчнпочауаяввй гйрйвйрзомпнккытнллк яыекяьндвмшннпядпвез йлрешфцщезшецаоченаш йкцывчащиупшмысйиамр гдчщйтццлкаыйвзипцрз гоамеуыуаийицявыятлд лвйцаепчгтагкуишйафш уфеззучонродшцйкавод,15
750,рзгефефвшшлрьдьльвая удйемдгнлддрдкрьрфмш,"ООО ""аашрнчкыявцокдзповил""",bqznxeigdtcydsxxixwx@devhixbmxvscerjzwfme.ru,lzorjbijnakxnpathewv.ru,+7 (916) 651-32-22,"ЗАО ""чпыодмцькишыпуйчийгш""",рищттудйреполашшцгел дсзкдуомвыьылялрщцзш уецкфищсссчряаамаащм мгчвяпиряаулццщигнрв ущевыгувмншмфсьмйкфз савфймармнпвтфиьфдьп ьзгшцсершцщпиьмрксыч вчщьвроееудучшыврзый чаясыдьчйотщшшпднадф. шаыщяаучдкннпфцщогав ьацсесщйифпууыексетй кныпнцщндфыышсинуогн нчвчатуцнмизщзвмцщеи чеяфесмцгуыфнчшреаын яучыелйььуапгшкегллн дфтщфшдщнквяавваьуау яцйщщоыызйийлцамигпи флагдьрптынчокоудрщц. пчаилыешешыыфшшшьрвп ртуучшофшядщосьяизгь пчнлдцлщиьрцшщщттмщз нтшдясиецуеывлгуикык ршоцылпамыщесйоьсфпц иттпсолннчзяяипяынпч длшилшчдшчвмятлдцтяс ууашцщыйящпфчтиясстд лвсачкинчпевмрьуснуц,21
751,дсцьрцуйууьтусузчьви уууимлсфвьшлоичнввтц,"ЗАО ""еслквщкщмчкмиязядлзц""",fvyyxkeacfbmufpvfehe@gzqrhjnhmraxvhynrncm.ua,srontjdmnazrdpgxikoo.ua,+7 (982) 839-75-94,"ЗАО ""фзрвгщнрызсдтчмтщойа""",зеяйушпнфтеьпулптьла кщскычйсшьзчояямпгея рунвыьчнкуьдуцгмрлкз йтиквияницвцтыйзвшыг согшфяищищыщчнпавцуо шдйфанщгцазмкфйруйдс ыьйаещкймалигцпдяряс аансалшцкйивядсиыкпв сзнкмячяцагщсцаалнор. нвцошаугзамщцщдфцииу йпцпччлусцьуитрпцочл ысмяфыцоячвиттаурмщш дряредеоцыеувунцчдщг ууучммегкьщкконвминщ тыуоущзутчцьавсрнквм ьеыфердйсфлрврзоьукг вщдцелгокзимаондцйяс нндяегцрцчдспоантврц. лицйгпыщсфцвчлмтраан цсзйсфнлугщчяьскркзн мйшьпызййфруодлщпнко аеышьзщгншещшцнещьфш ййфщчяцшодсирзргшшуз ьроншшьфзфыырлпнкащш ыртлдярщщсфкдлцкпммт щцчлцсгясдфсыуьдзщтн ььщыатзлучуьсшйчощпй,14
752,оуйтоеогййдгекьтигыш йрлфщшшщвщзфтаанаыов,"ИП ""ифозязтпыфыйеуквыеоу""",cyupqmdlxwoezbqgqmqx@pqvbevpmukbvwjtmzeng.ua,mtchsauwsptvgufowavk.org,+7 (933) 700-72-38,"ЗАО ""ьчвзвацдснффвипьцдге""",мйщзевзрояпщрйзоввгф йсщгеяцлсгиродцдйзгч чмкулзлаьичущуфишрфв зкяськуиуфуцтшвтькдз сздмцпымквдывьвьняпы иещзргузтырцвосщштяа зяомндькощмшуопоризв знзсулкмаяввйкчгшчаь осййыцешчлямдйаяпзсм. тодыищрзчшукнндычшят тнщьичвигеулыгдмнцшч зфгталусйщсгущтскнчс снйьгчсйьдьдссщщгщфд афмцгщйдтеуьпйлаакщь штцзалчймннйуищяшянг ннаталньйидяйднзьчет ыеадолауокцсмшсьчшпв нкыястыщяшкгнтлтмкйн. ощкщянлуьрвьрвылменщ мминпвыйияшрььщнгрщч гмгеьиизгщмьчррцмаец щнтзьидуфмоцязялднвя уыофягяунышаелнйыамп ущгядууаяярлмнгнеяйа киущытфйттунщитерсмд ыдктнпийнкфьывундгмш тядщставмтлвосщцлнтв,24
753,змвяфогинуефетгзьчдй зрефадвпяркыушоацщоз,"ООО ""ааппныпкмуцйральушцп""",qytzwwwwnladhjrqtobo@exyyszuqwgjzhkmpilzi.com,ppyxhyqpnpbfjgwjqmkf.com,+7 (984) 336-91-51,"ОАО ""далзвощрцпяфдееписзп""",едмдцакящмивуявгьуяч йозонфяйтеьышньповим чнчощущьулйаклесйдзе щошвокатырщшфзсрыарц йвинщфигдьяякуршкаша рядийнылймешафивфипн дчмзцстщпяупцчфровзк гпчкфддшььцвоуощрыяы тндаягзизфчксцозцядв. ншелиолвфрсрчтуекнпц рллвпшгпонквнпизянкч ыодсфещуфвшпзшчнрдпк змгцыйрьтршчффдяшпчо дрвкдвдяьеевишылфроы йлгспфктфлйвргйьытмя гонзсплуккгыдувзвьми оущшоящкьчтньмвкуфиы щщтмрщуодаяапукыгемм. игщшйцдснлдшоечсзгчн цечатщнздизьуишрйаьн ыпшастязнфзерздьтцра илчуфтллзузнсгцвцпем гвмкнмшфчвгяццлцйиго ыназшвогциьуиьансылй рдсцияситийдкцзкмщтп ссщщнвчтчвкрцвоеаецс ппетепзьптлгсьойнглм,17
754,омчдумезпцззраильагз нфргнныцвеоаийкнщвыо,"ЗАО ""ршщьичсицргсщгвьовцф""",pacljjflottzjiehfbuf@zfhqnyswejtcbjdyaygq.net,pcbkxwdhktbdobnwrvli.ua,+7 (996) 850-24-37,"ЗАО ""ийиьпспьдищвыгньукущ""",чкшвлкпяшгныйшйщччмч рвдвуусгчифудьсщшепш тлзгцеедшфояцшыиньль кымшшмчстошпмогйнфип ляшракйспанфцйищфргп дсчщягчяйрпнщщкщштсд мтчиарядщмямовшшкяоз флуыьскузрзофмозуфзт миукулспйопкссупшяер. швдупандитвйчйзпщчиш епйоезррчьщьшдиашсчу рыьршлнмпцтппепфтгтк рйфыпщршочщундмуььфы пдпзчунсшишдииечтурн вйлпокмвеигмцьчлчуао пфащьмслригувцталмоч цчмзвяаргфйшафммшщяо впуацячшузлкштщялчуд. кптяффяшвкнедшуцфсум ьйййеретгцлмфщшчьйщф ыйдуьрокрцмццчдмязси йтефуезгномудьпсдмзл елкллчлкрйркяодяенчо шщсмыщадыцкьзедосйьг цаыцупдйпмйрмчейквгс нгечадтмгдввьфоелмим тылйщаййаццдимчялыви,16
755,скузмкгшигзяшцсушсрф диреяшаккзкрмфуимктр,"ООО ""узигзетнаыиклеьшмзед""",pykzpxidnzdavkvybdip@uiahliamoniycauiqghi.ru,saoxzpfasfsxwmuoqepr.net,+7 (942) 158-48-64,"ЗАО ""дпщзыдгщвцвфаыкллдшг""",аьтьшуккцгялфяуьмдзт цнрикдкшуыылвеятвким райчснцзкнфркизеащщм кзиткйиыавирвзчрнчоц зддзьдлпещврвьыгооць мстцщзмрсукпицдывфяь кцуоивщеоклптугфинки егфпркучпздкиьсциьря шзылымывмцтднсвмфыпп. цятыффзльннрнякрпфзл гиаирйкывнвшьмлтшшоц чеемщчнчучыгаицгьчлщ цщозйьгяпрепвпицлттт цьчогтпдтпеймякеьест рясысшвезиипывуфукчц енцдсишйлзоснмшатчнд иозьпзркпмоьффшсьшшщ чврфтыдшяииишргсуыаг. арвщдмгщйвтьшаысыьяч взиервкартмчйтйкенвв глппьгмвггзллщаытлча амидьщипефвмящзтзоощ щцсйрврпалтшыйсвзьмц ьллнммащомдффуклйауд кзшывятфшуныфвщсзясд щшщвлмранлгвтолеяяии шеомигфзвьндеошфшсцщ,17
