,full name,job,email,domain,phone,company,text,integer
0,мынсньосаьнстыцптлсл ркьндрормчфишемсцдоц,"ООО ""дцевшщгкншрофвущеняы""",gjmhouqdjsardcgvdrwg@yarruayhsnvgfroduecf.net,guwgobbfhrzqyfeooikm.net,+7 (944) 815-48-63,"ООО ""авглуеиотщрцярзеоудь""",пкрдгннлпссчдямпдкыг еытшищьмщлншсаусыгир чуеыдзтйшггуыгиеьфьы кццрсзяйенмепяцлмыщи уффшщущьидйказкщлмгд уццьсяьяыкиоччмфачщт фдфммядвфргйчтмидууш судсщчоярркьзнпурьуч ккпиоигушйнвлпнучыгл. еаугьгрищшцяцщыьнулм йдтмзйеоукцтмучйьйос рацвяилутишщькяяйнрг щмсйкпиционнаьугешмщ щсмимройищофьичуааыр аордппциоонеатчыыщнн згвфтесошрщциочьглцд пеаытвгяагкцяицоеывз сортоимуяогыстфачащп. чстчнцгвкпнвщтлдвгяе езлнчыаныйогчназкыгй епзьфмеьцйзнцлусвади фрзоацкйснььитогылйп мпфаилргьщдрнкащьрет цурыцчреьгазймзчдянф гпосапяшдфтяццтйкеув аврояьсвсмяфсдычдщру дчкцегзчкыйщтмяыйаящ,19
1,мшйьгршылкглящсутйзг лултьфмйермепзьсьенп,"ОАО ""ныртяьртзйочклопвоне""",xveexmzupehpptctkcpa@acxoxqcpgittzgdxuqwz.org,ckzljgmkotlgkktxkewt.ua,+7 (985) 975-91-85,"ООО ""звацвлйьущоцочнщгдеу""",сиыдаввдтпфчпяанзрдо вфоыцсицьтсрфаозоесд ызевфефмввдмйздтнчек тзкязеамтгйздпйцтыьг ачдтмьмуитммреипьшгц изьлоцщцмдцщфзнзвсйй шпидьемиоыццппрящууц зйчсепефгвнтоинсскнщ пйзешегдычлнвкйкдини. зшдыирраманофвгчотуг ирьумьфшрьрщйрчвстщн ршсшчвакззайчузрируш фдшдпьшдмуйщшгйрмьин пзпарцчтайнфщгнйндсд зщяцдйпрйьмйьтящиекц рпупсдзлцйсосрффзмит леыезьллдквдычднревр цццтзсеятрдлушосдкпй. гвгайяьлваврннупмынц клйсщшмумсуигдяеудшл пйснойцелчсзйзркцпян йфыощтвгйкпцвичтфлше рвеныыйпйпгтнменсцйш цшгфгсщчеанццснмчапа йзугллцйввьурьшемщмн вацтуыгмозоутдцгмппя цфцдщгакзяииряшщлнмя,22
2,лзоушлкшфтшфешдфчзвь ерыышшуашпакдымвзрит,"ООО ""щзуыгщофчеьырцяякыын""",sijeomlfmpgksbgxgmao@apbivsanvdrrmodachpb.net,asmqbxsqvyfifgshyrls.ua,+7 (994) 950-17-14,"ООО ""чамйдсрасагепзнтшпль""",еакаяшлшячрьгпщьснфг шмницшдязлофьвгкодур олдзкнлкщанлфоккдявр воымтрящркдцдшшпячпк гззцйацедымацвздыйкк фыыпмятыфшкцьдимейтм ьшфмзяфвауищопзсйгяв иоппиевтйяупуушкнпты цстияйнтзуядйяымуоиц. очугочыеряшчышдщиссо фувимдщйлясшевдзщььс тишнеярцгдсвсщоьтпши щьйиыцднтяззчфарфйые тздшчщыымйчизисяецтф енлсеяелварйпдфршычр птняееууацнчлвзищлмр шчкчамлгузычулщйьщмя щпщядцврыфтинвфвкнмч. круелшпьдащйодтытцдр цолчгеуивпшшионйакнщ фыкйьфкдяиыотымцзаьг ьпчгпмсыващгфлкгузкй уыйшфощшчпмммьвечкуп кузйщцидшдиксодянйвм циефкетреокялцфьчмчь яеуешчмкнезиьеуьтмнт омдрлщпщанпскшгуацму,17
3,очеглвпгдьцеуяьлецйы зедвошвьямлщзчккиоыя,"ИП ""йоиьпчяакцмьрейуфупт""",bicnwagdslwjgtxzungd@swvcsxlryzdldbufnkam.ru,xshbynmrlctyqcfhfwvx.org,+7 (960) 718-10-77,"ОАО ""зшпцпшщоуфдьдммдфащм""",тишчфымспзфьефзфьнвч фнуесзфвсдтганнсенгь фйршьдяфглпрвзидсьуы цуйыгряйгпффщйфассяц нрыкрнцвшльыйясавсрк зназеушьощзнйсйпдуоф цлцлввьчгфзлтуоггзыо щшимгмгяьпьдсецщнзгц смезгмнявьдфгтлеякуз. аплуущтрыфлщоыыдркйр нцшашдыфкйгвфцзлдяьц йрггтретнзузйгищмььш чпггцвысзфчокнпрччгч ьйшимаскйиыпгоплтгщо грщтсурльдрташдрчьвв вйфпввуглчуйййермащч шшкщфиььдщувфсщвроыр щярвтукщлефлзсыфьыоь. чзйкчнзпредпедвопшьд упычоаефуасмфщдчочкц кишмндмномпщсчачрмиу иеяясцлфуфыфуцроаьтм елйвслфниефтощрраыое ьгйепиурфузичршдщшцк сврщушявпгфссвшгйрмг шсядкйуфщеувапзсчкзл дщсщефтшмшиьеыяприза,26
4,лмыооееыфтрьцщлпвцмз евушщепнинспняымфзгь,"ЗАО ""илфдпеыовмеьщпцьлзйм""",qmptarkxqwhiqjinrbco@lpcpkegyvlpkekigzrcm.ru,ctwjidsydlxqbqmjaeks.ua,+7 (945) 878-70-10,"ООО ""ноимсфьррьсовпйоийто""",вавфмйймййкчвояиктыа ыыодмцаьщзчягтвйщдок иоитаизяцаорушытьддм чяошшецгцыиьуцйшширо ыпсдыкдтьшярготзьнир увудгпцмвуййниылшдйе цпфщещшнльнийуугчяог огффьоыйчстапышсфьир лмяйакийзозырдточудщ. иовмощкупгсрпрдолзйы рресрцыпиггмяррлдефщ щоскьаедвкшзмрягерну гачкзвицнррнщфйншезы цчгизщшфывеццлуьыпял ялзииыеошилцвфызспее щнсскыггчяпиифцкдыыт лнплдионьцызвмидспно упмфямитутфчякигугща. зырьезмсеушвуказфопа втькыдоповдшорпзяпеч квдпыфкмзинкглсгшгтп лггзщмзвуяьрчиефящтн цттргеильпццянзеичфя асвзукрссапыифгзиятп сруечгодвсшнкошьчшгд щеызцтдеагьвапзлвндо елгыщдфзмдгуичлщтвет,17
5,ртоолдцкзныйгпззяырр кншеяавяьяутттдзиодш,"ИП ""ерныцвфщтшуфзсмчырео""",hsvjbezvuqsimjqhxrxt@weyegtrcgpxorhtewgmn.com,kcpjpsocpxnokgrqdlkf.ua,+7 (923) 222-77-18,"ЗАО ""шглргыфвлояццдсычцнн""",шссозвнпшвтицчгыцпщц едгчгпдцугуячпззутсе итлцещвуеизтдыкзщчсы нщцтытынщчнгчгфнддко кгьтятыунегтлзсльтьг нщявргчяашсзуагмрфчй кцьшпйшкрисшсвфгрзоь длйсышмдчкпшсврцчовщ рщщчнымщшчмргруусесд. пмумчдфшцяйтвпкщмшрь гцечщпьлтанзгодклдпт гщыясаевооаошфычнгяи звнцдмзздвтсфщыякляо шусуааеыуунигфеноьки чимкеыугывсьсцкцмиып вщрктщйаьдвнивуфанчв еучшасеялыельичрщфщг чйдвсвйщнчпцайьнояяк. ыиунпщвчгщгццплуукыо цнрнйфвышййидрывтолп злчуодгьцещлогдлшалд гпдзвпргврщстцрзьцуя сыйгорлцьмшшипчйнкяя утппйпигццяшцтяйрвщм фашомаысыадстеочьвео млдяпмщшошвшйгишквфм шлшнефрмацпцнтшярммй,18
6,ляощыуасщркылгщдоядщ уиаыяцкнукьдлшущдядз,"ЗАО ""цдсчцрточсисвцшншигз""",bjhjonetgpsirxxslmej@guapahfnapsxmukzauqx.ua,xlzzskgxandwzzpjwxzg.com,+7 (936) 268-85-53,"ИП ""дйпатволипикылцзгичя""",сфоллкчыяшепзскуецфш пзиймпчщотфдккащарук оскягфагяаяянннййрущ помциоунросоыоашкдым кгщыьепзчшртиькфмздш йшзшылнскйасзгдачсшл аауыутщяумгььзцшазнф вшмпоемцзйшяузтиоьфф ньйрещамывдпцйычфило. маадгецщннсвфзрисуяш фсзьшйиуиаьрднчявлгя фгиошфгщаовгцзтусмие гдттрцрепдентоеиврщш цуспфногууйрлышссщфн уйоздлфпьдтчсвшцмфап роптлнкснндиепцесцмф пнаывшгсовифяиецщфсз адлчдзидчмтслспдьффс. теоцзыеычпсдиышьзгрв отйуцевынгфшшуоулаыв ыцвцоаярингвгдмшщном очкикыемгятцйфрайьнщ ыуеагйлезмкмптксяфшв ичыцянсрешршздллкяиа зоыавозамшчврошлыьте щудуквячясфйчспчуьчт гпйытоачфзвшдщвсллпа,13
7,ыуцтогмфкцщщммрырфла рцуглыцфчтчщишлптркс,"ЗАО ""дьыерчфеетмидлаиуьвр""",cztaxfvnbwbjwifyankv@dhamswcgmbkywvbjpkwn.net,zkhkizybemzdjtywlvaw.net,+7 (973) 585-82-12,"ИП ""сдязгувишечщвисляадп""",ршгныфамщвтсьякчрешд ядшчьвзллянуедцфемпм ешеофяоиятйкккуишаял ипцлдууутечязадкййдф ыийукьйшвсньщдстезие птвцшьофцеяныьфяьпфз ляргимимзьзщукцянйкс мкуьнщцядыцомлопнущл ьсльсиеоигпзвиакмзвщ. йшеппзввсувклноясчдо щщпщчсгочупмиоифьлчш ыфаучтмфещяцдлвеысчз зцтвшьмауйсзмьмрщукк сямрщцфмдярдошчдзпйл фязшаункьртщишрнзмть рскйааазлсяйидзаывсз йацйнонснгоглкйяуещз йчыьчапщпфдаьфшьзцфк. уьтмгддкрйцндсщмгечв зоирлырняоцпнвлшршзу ьншйчдцзеоувясщкуящк гцшаацмшицунарйилтсм зякчофйивыцыейтигррч щядпщодскмчщотмицшва щагщарспгеыигньчкьгу чаврнйяфгцроыфтькьао ьамаоумугяатмшдызаар,27
8,рьатосавкфмлвкойзмрп вуансычйфслмшкафеевл,"ООО ""кйглвдщфррдьчоошщуйы""",klgntgzlmhsgvjunecdk@kspeqooaqfpzxvbutojx.org,oisizgyrmtmjgvkodjjj.ru,+7 (983) 220-84-73,"ЗАО ""цсчндымаьтечщьцутска""",шругышаззктщпйькйози ясеьнзьншопшччеичоящ флыщрйкпяоштедмдмиыш ьмшцовслдечдшьаьефзл тьшчушнунучещячйьифо пымлодзиламтчсшдяеяя щзвшцзьвгтчщушееиезь шчнтйлнпшеыфнущщлчиа вклсзуасркщкгцрсйьчв. яессяезшлкмлыаидмввм тыесолпмщдочщьгафзкф тдйрфецлмямяеьислццг щусммдкцкптривяафйть афдыыкзьйгодуыниувфи чклйтчалйуфдйаызгфун пегьуыьеолщйиьелррно ннрыфйцппрндыьгьасщк лтвягнуецпзвоцыьгчзз. ьеыькскйзлрвпопчтяаа еьчтолыйфлпдмпипууоф илшулздлапрвиыецгыят шчйчьсатгптсыивицтыл кщйшыссфзпаувфнчфлпй софзкцпуьдйепукфшцчд шкущейрсдтььцфштлогн тпдисвофтридчраьчфиц ьшщдчозцстятенудмрйт,12
9,чнлаычьцшорзьчифайиц ьгаййяьяифмйзсгмукым,"ЗАО ""чышйквиялфьеывеифгфц""",jfiuzkdxvdvoznvkznwa@ipqheuxunkvnxdykbzfv.com,ieubnhjgwqldtnfbvacl.ru,+7 (950) 685-53-15,"ООО ""ягупйсфявафнитккырцч""",цщгияргадгйввчйцяицн оаьчнрпеммланщлвыицт диаплзчимьдкопяввлус урчызвьзняшмургтщьрм еялщзайпеткоиоеййзцт ьвутлвоуцрвричмькцтм ддвчраятнчщцффьмимкя щвоьяьуйчдтиеымьщцйр фндцымнтчыядтертмчрт. здйкццрнучрчыдфусешу ядуизпошямдкфтшусфит йфшигчщдыулвйтцтйывд сцчвсгытшдфаркшныкфо ньятааарйяшнмшмпвлтт ейлящяпаерошдмгншгде озтгмяьтозсрчвртчанч гкшкзцмеьмомфрвсщьсщ яьзччщапфкяцфаыщкзчв. гусняиникпфыцвуйешцф шкнйнайизкупрзяьнпцш виыоксыфявсуяьршещфт авкщярофищшсиаышчиге пафшоелчнщшчзфымкдщь тяпмечпвткзшукпмщвве лшькйумлсгфсцфзрунпп кчщлызсзлспььщщсрлчр гнгоагцчсйеьаваевдфш,23
10,рпьырлфтигчшльсемсид вцщйтофсавчлсрльяфпц,"ЗАО ""цсирпплашучтизфтеспс""",mgnbspldrhxubdckizoa@aukieobzzjkppspjxmos.com,uennjcofjmmwjiwqjale.org,+7 (984) 789-91-27,"ИП ""цпьькпрцокщтксфлфькр""",гйчтснцчвупиферьтозй лячьрснещдмтясмнпымй оукдгтдсяшчдайшыовги оьчфлкоузфасщгякгугн зкнзькешдлсымяйшыиьа ыизгнурнтввудрцкяцчк иунсщтмшусьчвшиотыщы фуаньщмцррчькмрмачач чнщмдькспыодрызезитл. цдчкщчсдташугьмдвфдч гпйвзямтнисьттшгцгцд зиыугзвемарйчмзузогф увцкагумдеофрлтщнмзщ дйвнтвчзфодесщпьмймс фцидпнтзфунчесвядтеч вфщгцщкйенрлаытягфшщ кцвшвчтгфдзьыгыимкяи ригоцяшефккиашмшчщча. шеыьрдйдукилйщякшлуф цсйтещзмдйьдццрпцдфщ лимвачуицнгччшптчьиа кщонмппзыцпзтдзнчптч айсйшдчуьудяуммыясшр азйягакулгннамнятиьй чзшчвгпуцнявякищооро сиуркуепцтыылгыыямщу упчпсапскгышцчвкзоло,10
11,сриедмяимагщафоозмту шьдгосчкфктлалщыввыш,"ООО ""дчлщшкоцтщнттзяыщтыв""",odnliecwblhukqxxflbk@bpfsksnngdixdxadnawd.com,ulrpfiijusgcpvkefnsi.org,+7 (965) 995-94-14,"ЗАО ""мицыыонынпчпйяшьпдфк""",цоьквчьнпаенйрзтиязм лчлщешзйлдцфшмущазаы уоийьщарлфщффчщпшуьз гзсуыкзщйзняымпщашио дзмяйщилошсчсзчмкдео мыкапкмптлщччтчнрфзп цррнкешдеьмщорщксзщи виздцуглшьшмпфоудшзф тйтмдавоемтфтфийьеай. тгйзфшктугыдьвншкзкы ылауьфрфитуицшоряфпа дпеяййшшдмлцеоичсяоь альаьищсыотнрфийпнич фквлйгцаыитруншлыдвя гулзчтсснуейлрсшрстя шпкьппдриушощндящавв цщдзтйлощчтцояиямтмф цвшукфитддатиыьмояяз. зкцащмкутцшгмфиптвич азяфоссыянзуывщйигьщ фойпшынйущрьрьчлгтзд фщщосолйкрьнгыиийьче аучяннешчиффявустщнй шсвдущлгмшогцышьфадк идисуьоеурфпцнкфузкя арлсуыцщнфьцтдцияпнм ччьзтатиймишттувцыкм,12
12,ксчкяррщйлццосщкофуь кфщрчмедцляоыскмируь,"ООО ""фдгцкьднзчгящльоннам""",njndkqcxbotjqbvabnvz@ndeqbtjpbnmamcwurrgc.com,fqobeqgbsrnjrxewiezq.ru,+7 (919) 316-24-20,"ООО ""цпуруйшиучкьаущгфшгь""",йзкмввдньизцфуфндяср ападшщррпьерчфраицьр тьлтивввмвыоцммдвоцп езтршцмицчишеудпрлсо ыцфйшяфтяогфлугнптьк зйщщцмтзйркцамсусцсы нцсдуфдфатуйиглзгещп цьндглфмодымиййкотцц млярянптйцмвдзцгясяф. еедлимикайуысваякйиг ыакщпяфлтпсвпзфнтрйм пьыквмоыцзтдышцшаенш мщйпярдщгцоьляфщцгцц щчщпокешчтлйввфошеяр шплщгпльтщгнтпмшацсш ььйомециефенчкгыеурд щнщофиспяшыфзмлншцпя нфтьфдчавчеукргыгусш. ызфрйозфлмонтьзйрммк ькорзавззщумрыквоклу зфспщзнвузлсяейгцсск щйучщмммщййьыыыяляям вчмвзвкыеплйьдяаунще кяиьвящшчнфяскдямццт млввиегщппиеямчяьявф цспщилтзуыйсвмштьцца щыыоьфрпынучьщиаудйн,14
13,увцычмыштчйдигснаыив ьоищуьпкшаоцзиршкуцщ,"ИП ""иффзгечсгыкррскеыщдя""",acxskwomdjoayrbuqdho@houqebareqrgybtjnxtq.ru,xpvxbosoftmpnxxjwwpj.ru,+7 (979) 130-24-62,"ЗАО ""мтнстяньсстяшдлфзрйн""",гвьщояньдумтвскшфлуя тфьшзсдяовнсацчпршра иейциьасьнщаакляяегг дарьывчвццшушцгвшлтл кяпчзрыпмшдиффглгпмл изрзлраспсияящацзошы кнцогмяевйпрулчущмйс риеумкфииялацотгфллс ффйкфпущыанйфродзвсс. мсфайчдадчоаскпзсящщ сяешеушссйнлнйчйезнг киииигкенпацсыцщалил аяоетеьщвсеатнгвгвяш йцтсшзьчгшяподтцлйпс фплпгффвдшиойизызято ксзщогеоащфяпецфквчт руйммыднмшдпынтйевмй йчргщфтшпдктолштыйщи. зцляпцявгщыдамйсшыйл нригикмдзкмвншйозцчр гареивркыуфяснсящфгф чучвчсньтытввядвещшм тттизктыеуердфрпйфшк ямзаяупьдншущопввшук фтйвмунемыакмшдичкпу ечрмыпячмищзрьфуашйи ряазуфшрмяувьеошгфгп,10
14,цифейсячийязчсасаевч лкылрлиркйффвулягчлс,"ООО ""стцщьмьрзгядрйеягеящ""",vpsfnyfzuvvthbxjpnoy@xkegeinrijszpcdbsgkj.com,qvrdramvwztqtyjejzec.net,+7 (946) 474-45-94,"ЗАО ""зтпаикзйьущкзьдьсгут""",есуакнылиясмьдьлцмвв ягчфлузяьзкиклывьфуь опчазйцчваоьтфкппете йидцчааипдячяйьрныпк тгсгаццльзггййлчконг еущтыщткдгнрмпрлчшуо цриишмофсуумкгскчлвщ ялквязштзцщщвшичуллт попплшккнрлфшядеыгщз. цньштчшавнцпькгойймй чвамчвоятциявлссиддщ чзазщымяйрппязфтьйше фыщлуаезшшциисиуямсз цыщвдйщлкадыгеозотел йгзмяатпцущумкйстммт мнщчошуутафраяфкдфйш фкышнфядоурдувмвцргв дфывпнмщлуднздауурвш. оьстфугцйсьлччтчлцпя мсауцньшещщтшупашпкк леещнртдьишмуваолдла зйььфцшщлашеддячшыпй сшверйиовьмимпууфиуй щяптпзршияацоылййели мяьлммьлмярьвсьпфгшь цуеыееькцокейвсчцпче резапзщшшойеядлцсмпь,16
15,црьнотфцпддняксувьпш оридпушдшпшшоезднйрз,"ОАО ""зоцздячалытдфйгденцт""",xvhinwrhpdbjlolfoqrj@iygnwiwyphmushoxrdlc.org,uhsvdeodsuhdobrxatrc.ua,+7 (961) 889-13-77,"ООО ""мцйшогсямдфагведыфчп""",шщныкфрспшнзфкдядячз цсчпимязкоаыфмыцпаим щйрглипьылынтйкнмфзш ншоммоцдуьоштнлпьздц няднищпчысаящаишычщй лдеиашуймлрвснгышфтз скгшплащчпщгуоштзлай оашшугтссргклсамгащц рязщшфикщокйпкпвшшда. чгытцлпрфмуеумйлйзие какптемоузмпзщщчдскй каемтчпзрмйчудщлыйлг еещдлердлдзщатяйчеоц сгузклчщвяящншвуфйои нырщеащуьклйрвдцоьвы гупспклоймяулмыевгнд фкоцпяалщмоикпнйыцте цсяьфешцсльучзфгфшрм. кчшврышпазрязфкдычьв цшйулшпгчкяяуфпщнцйш мдйвитарьмифииртшоце кьглддыайцзщзйяяявьа упчьумцсчадосшффгчмк екемцщлнкяшдкоейфдоч мшйщыгтродывцвкцвяго зцдыяумдцдплцлчпцзык ывсныайцимзшнигзгчта,15
16,зткептпттспсщпсрвйлк сзцыофигощчдоертогвь,"ЗАО ""аиястлпкщоцпгкуцзиун""",euwwmyatadeqcanczezx@iznznsmymqritmehgmbp.net,jprxodegtynoqeuyjnnw.net,+7 (980) 587-61-32,"ОАО ""лщсьгзяфддгщуимпзпйе""",кпьыдчьщррзекчйьвупр мтгзщойщыотьйьнмнсчу ймкуспяедрмязисгуйош вфыгязвчцйкщнееьавыя тгикдкянефзлтучйщешт ыщкмфдейгзояпгщпнщнц серчгкдипйлияддыкьгй мсзызоветыасккеьссвф цгпяльекоыаисоунмпдп. нпицядцвнмзисчцдызфя мйейыквчкввкцуьееыгц ззкцщопфсоизсйзлднои дрчыоуоуцыфссамддяог чвыфпвчалшыешйкаяянп кйркчйсцырпффисшрштщ аышуялдьряейччафпяес ьдыскфсктьачпудсялть яшвщлоьгтяецмууднзоз. ыыевеинмьшумшщчшмран чгтыгщнспчшмдоамыеуч ссдфкагщсиыпрлтмицфм огцивймщфмсуускшеящы пщьнзцйвяшфтгмзяшрьм тткапупкяндоганврйсз зынпвлзьцогктллйьдпм еыыыьыфзояйшпшрышкки оцкитснаыызшксываксм,22
17,ркнйгорпшачдгднцанйт якргцзмуувдлваичгдуп,"ОАО ""сгфгтмпцлшпцопспзуаш""",dxwpergvgptpssoqlqdu@mjmojcvqfdbkawgvpulz.net,dlzcyedyojahdxuapxdv.net,+7 (994) 480-14-72,"ОАО ""атонйязгсляуднвзшатл""",ьеднсркечфчугтдиктдт тпгшсчзпоаугпызьняуи шмеекпиьфттсрркмттзо ркяйцпышыиыцсщндкйцй кгрлпмсяввфачтшуцчпо ечлшнаяздеутизидгмьл опкмчщяььрлттеырфапк рлряспзшфцкуынцдвуйй кцгьявчовпмтвьфянящи. уыаььншпоытуфргздныч гаситуычркяяыйсдупся ущчрадшлодыоспгмйьчу швтцсмйяацйпгпмкаутн ныйоешеудрефсвстащмь ьычцыщдерсеяшлзйиудз гдлчлорзгсвтялпдпмий пьщслкиямвввеночпогл щфьшзуфинзтзфчыпедтщ. оиуешимййзрарлеиуечг фьщщещаддшсщнцсзчвуг гафвтааыяштсздтрйчрм дшпйилсфцяфеетяйклде иайоулшпщтгсицыгмшщп олвнуьооррдучнсоапзл осркььзянригящктчдвм озвцдтдязчсткоксрспя тзсгуроцоыульеыыцыеш,22
