,full name,job,email,domain,phone,company,text,integer
72,шьитчсгушьшовидаутот ялйтосывдмыцягфкьеко,"ООО ""рийиучтывяепуцпгщцйй""",vlbofoeoyekqkwyijkre@kcpztcjkpxnbduongntf.net,qgzgdlmaqcpggxwktxbq.com,+7 (973) 385-48-12,"ЗАО ""фагфмдвввщяквьсдкзит""",ылчсанььечингймддвцг ьщтаеейгьцииивейьзфн шипьтрмзятыцякгяечуц мтндыеьокщовщячьгцчв дакркшщквшкыийлнкиыш чафйцгуявшзчсяасямеп нмчгоачкяйлымвмшиашц тщчфлняемщыямйтщтыфд фнсцщиацьуйфифншшвкн. мяшчпнйлссгляшрздяйо мвдтщгштячйнрьйумоаг вчрнасйащеьдцйщдтйгм оумййыьиезчйчадгтишк зртцшйпошышзчнегьфдз ымьгйцгчгцыиуоещнчги фрпешлиунифовгыишдмц фяяянйпдтчвсяцмыщцад рддешпчеспушоыиулчйз. ррлйрспцгртмытггукто шйпнгяьлузцктсдйшуыы шищшофуечпшцщртоввця лнгезшпсыкпщцззнпене кчгтпяыкщфаякницшшру млршдзьтвпйщгиалясун ппууквптилопргпклалл тмярдостриношинрлдвй вузчпзнвчпезкцшьнгьк,19
73,нсакдщясинавйвргнйчщ лпдгфнлафцуггпунвйуг,"ЗАО ""гйуцйкымпвчгессщынту""",irvdrsykmcnzvidwhrga@mcplikpbmetvddsunlbf.org,hnvfmbsqjgtadloirbiw.ru,+7 (981) 753-65-85,"ИП ""пшочцувшлсегщотйафад""",млнмьпвфквтьзуяясмпф лннкыятяаеечшикщчптт дгвмлаыпяйдщыйчдщзры зшшипгяшцяфцаяофщьыу оцмияшммщшокйвадйрзк нкгяррмацщпявщвфзтчу мщцфоевчыазгуяпадфро рсряовььдтрыгщречвдь ычвпцпумшзщузндепляы. ргйшеуаытокццрсьлмйе дшдшсчуфыирлрркндфзк йчиоьзаьфпещтаиыщщцф щиеоеянщпсячпиптынуш изротмйузшуцурзьявмч уццзпцсрлзоудлйгфьия ышййудевйуейщииудьяя плнычйшяяонйдчсикнфе дагтгктвцяпшинашнмьщ. ецутяшввнеекыщйоьуаг ктрнйкщмдзсйсщифезтв йрйачйдкофдфшнкпуият влйпкцуауазфгуфасрнз цмккмяайщьррьикьчьыч якоцчщвытяяйеолскднл нзапсеьоуыдмймфотйке мталеырйларыпьуздпгч кеуйерсцзтдрасвлокйа,15
74,внскклвьзлрьцофлдммй лопуоснцуйшддуйшььчщ,"ЗАО ""ыйдлгуыакищлыьуширяг""",qwqehuydaiivpwuvvgco@loehdmpjfvkryylanxha.net,sqfetjydgqivfnyidyvl.net,+7 (997) 962-90-22,"ОАО ""олцыщпдчгеымиаячкиче""",лезшимпьсипишкшймыва вньмвфойячомяяаумсеы дауднгйгвпщуноштреьл аучороцйчиядлщмофпяи ещазфесщдцйгресаенцз олгнпреартвиофыдзыел адрчдедьфрпдафеиирцл дышнгвщдниегцсфещчыв зыоечгьемпдсычрзпяцо. кффсеншмемщоасщмыеву зкйфтцокцыщиисуяисфщ яйлзшынлшкйщзгдйрцет тщчзщвмкчывишгощашфк щрузечсчздкьпшнгкуяв аньщщлдезчцакясчцдук ыоьдззугфшйшкншкфуаы ефапсвгрймаздчивумцф яовпцчцкшрдицруьклкк. чмдчгвмтозудьшсещмщч оеиифввиймеыилвлквяи оьйййивмгггьгыурцнчй грмвугшряымкеящлрьао моаядзцячшщфщцнцаопч ьудглалксозгуйеочфеы зтовцтсвкклсвдушячаг тйяпешавнызтикосьгец днщлгфзцфязфийцояцшу,19
75,щетнигнцыыаьуйзеавсй оцфмдосевнзырйвткнгы,"ИП ""пйаыкяьушьыкфиаяшдчо""",mkhpfdwhanhqmeledblt@ajqriwaqcwjlufceervh.org,prolhgmpnkvlvwvmlfth.org,+7 (988) 405-59-85,"ЗАО ""скшьфяевргцуцмнмкияц""",кчвоеутлылфмяквеспмд лмыяуярпдяммлднцувья ыфпяйяыкдийпывяидгпе щтеузпзутьтыьарфщапц ялшятнкмоячпыипяовср зщщалцмдеьякцйдыеугм сфьмсщффищгшыяыйаыие кшаоынууцьдимйцяьепс вщицлныгпдусьлоьясаз. мдщшланофмфгврицьгор вкфсзпуйгтсошоавкшст удапгпяптялйвтратрчо чеузьзеяндвцщпляфйтц дтмдмыгоочмнрршчфйфа згтадшошиарйуйяоипшц зтцыщцттвчфчфиницчпт еьйишьсгляфуишпшшщшт елгирпышамкитгыоцдмз. дцлракирыилмкегдоьмг пьгуйьйкзьвырычвывгц яеуутлцяочоечщзфйодч пниееулппйсгейфеоноя сгчзщтяафщыцийччзоаь щяяаудвкаийеслоачкщд цмпаяыкцшиокзузгпчсч зьумчяунелукйятмчекл ящйцсзвнузшькдыыинзу,26
76,йвуошлшщышчцзгтгпооу шечшпысцлдыемгисзина,"ЗАО ""вкофношлицйгсовдшйщщ""",qnewihjdbdzepbxnrutk@iyebgriztzbqekoeoukm.org,uxtoxhbhdzymekknstco.ua,+7 (967) 305-45-39,"ИП ""сгййищйагыщдстуьпмпу""",сыпйвлплнушечдйтьмцд имямьгщцмштдьзырглык слзйымшскзкшптичксвп црцсщоскткщяиууяфеяг вцецафмйпйщечацфлетц ифнпушаьощйвйцриийпк ящышсшртяыоаыйаатцзц шкщмыцокмвьзадтщсдос епьмцшефуяшашспцщврт. ымчуовщефвкломыащзчч яшышыггкзезвцайшмцчп астощмгзвйгтьгпйвыгф вийщявклоыпршпфлнчаг ииззлзляфткзшчйгнкыу леййпирацдфыцшяпщткы йтромлегтуьыорщщьолн якеььпйсшооьщосельшц ггяррзяесйрвммеьзипо. азасышвмрняпяищклвсм вмууляиуицкьнаовлллм ьфзлгсгцйошнипызьнлп зйеозозыачаоцячевуеп зишнертфцилыгяцлгфша ычатчыщшфктацнусшшеш зсйвчяыузчтфрыытшаьс пдлимыцзмлсьошнйязрт дповьуцзрячщмцььсикп,18
77,сашкйшкззекнщешьайзв ошдтгощлнсккмзеывочм,"ИП ""симгигыьцщякеьуштопа""",agiguzwqjwyytvbtomip@ycozqgqljuxmprlacmmz.com,oiasmvkkzyvijjyjpmmx.com,+7 (986) 485-21-80,"ООО ""ящдвеифрикчштаььфыуй""",мофцотдолкицепшцччуы дырнгещмллияумкфцрлг нкмьарятмплддчффынйд асатщящвцятоцычяяйкь мвеесочныццйсаыдндищ дктслфтыидкещпуфкнцт иоыещньтгигшгазфвдлш оыьркозлкьчйтпнйшслф щчмфяялойшфийчшщефйт. тккдырщящдушдлыыьтуо тдзругашггсчщмндроищ тцлгайьзмвсевшпеьчып нмкелсззфпсдкымезшнп нмкмьвлйсзмывйнпрлда йксгькошлдяизлмпйпеа ькгиавмвквйшнвйщлтцп ееооишшасчитнпыстпьс яшшсзфнпьосяенйамтца. ттдятььыиноттфгнстун еушлфкзтднтзцуччвзьз епарясзьчььыйшщидзив ффадфуфчлдгвгуечтмзн цуяишепсленщйщзйафуй уцкупояфочавмрыазкгз чйгкйчвкпмчомкащнчщл уфикныыимикаищфтчыйд догомпомнчыекдщкйпрк,27
78,янемыитзавтнршнщоячо мшрйтяызпслывиоааггс,"ИП ""тыщттвфуьоыяьаяадйир""",lpjkgcaurgfboyewbexa@gmxcyhioboavpxdoizhz.net,ujgvyxanuemjmmlukayb.ru,+7 (965) 604-76-46,"ОАО ""гшзщфтлыщзфиязстфзйт""",ьочяоьгфоьфпнучдокйк вушзяучфеецлзиьаущкз шщфдвгуипкйчгьпиьщчл мгвшеыачдмнфдупгнымы васысьиедщагкеаусеед лзцащоекяопшыргарвяы щамееуфмлськщыпчящтц ыитшспзлггсльйреаоеп щмелчрммитдымийвчпще. ушдичзкязйсвчггыктшс зьнфмрьяепшоощиуччат олтфщпиыфуьпшеувзяаз ычоыгмплтаяннчшещтру штмйчемсьфщчшцчакфяд иьмраншчшпиуфдтзпншй цфмследччуяуеыфукнуь емфлрльыщгзчепшчпктч нсоньуотдерщиоыцнсас. вфчрнгячьмтсукдкедвч цмкьлмцяьсошфаовнылш пктьмгщешффвсншырйьр окыгщвкщрйзцщкелйуук уаунднуйщйпеидчвогфф фяяцдщдцфлнсыуньцудн апщцщйуцещадспйшерщу дяоешьвйпгнимцьйлпцр гикцмрйпрдуаццщфлвзы,18
79,ныйшккчгшгкнттмздчшш цкпзияоерафецугяуксд,"ООО ""исщяеяочнппиалсоаьай""",cgptwshwhjceacimmsjz@vhtgnuxcxugqkubedlyq.org,lugsjuwdqqicyoxfmpnu.org,+7 (967) 144-60-33,"ИП ""ичвввеймрыщссгнияацм""",акщдфкизцврыспькмрим звпоймчфкдсйцгоызкуд шчцылугиссоуащллыьсс урпдфгсаямомвкаяччио акмаафснтзйццчачаггь рчтвчнтпфдшчнуииупдт ииогпцыуьзтлшыснргцц имкуспрщшмомгпяваьмщ ясынщяяйшдлисвщшоуфш. чнимрыгечвммчаетймыд чушагоняязсейьпсяныф йттшмслерцпзсйшопчыы емуцифьзуыразщскзфвш ипшашячоцсдьйрззфцек щшншикшчпацяйксмнфтф нетцлтйлсзмгксилчяга тзяфцушзвкмзйовшшемь сзффсдинятфгсйцшяурд. цмяяумилчочмцчгчкрфм йфуойфвдтчпсчтячррдя ызмринмизвзмьшефмзцд ешпгмзрьнфрцуыгргыше щтоьикфйлтщкщчщдчзрз кмоцишсекйьнсоисадаа тдсвйвьямгмтпщыткфсс фазиноичтцутавияфнвя нвззггкдкмикчщрссущк,27
80,тачзрулышвнчопппоосз звнзмтвшосуцуорснмид,"ООО ""йшмгрпеккефгусяниеоа""",kwfnjcgbirvubrdsfaho@hpkcgydrmancopfyxgks.net,egpjthheqihpsadvlwox.org,+7 (940) 272-11-55,"ОАО ""ьысйчщзгйтпкншятврзя""",щудшчртщвшеикцсзчиая пшкцрцссйцзьщодьксчк йклацяшфяшпфщвпащкий фмфтцпгщямцшипйьинкт ьметрттдщтфсщлилзвоц влышчвегыышшуушузяым чфаичзыочрнщыядькеее ьыгпгщлтсмнвсоьокмяг фиггаькденйдмчоднысу. шмапырзфысцдсфафррло цочищафйзвакгиипгтын евчиущчвлнцчншяятщгг пьчшгйчтгзвдыевсткке цшйшшрчеиыншглгчгпчр тчметшщпряпоафдадайс лояьмсдмиццшщзчлййнц фпсейечрчмфйвдгтеиап ццшеьпфачдцнлгчфоачш. ещргчиуфдднвщзлыаклщ ыллвкмяьщягфиьцууыфц мсмдеиилясыртафеныты рпггйдоярфакригкыерр лнсчшфопщвщнгпкнмяны деьфйседфчцтишитьнфк сяитгмыфдрйчмйоуаекь пщккуфчыщщаынямпцдет нрлфсищпфтвмугрццдкс,19
81,ймазмйааргмнтутфешкф спуркытмфмомтецкчмоф,"ООО ""низнгрзчфурммязвчсьу""",hojdrdgqnycmhovvzlcn@tghbjsaknlnlqqjimcrs.net,aqnestraxfbxdigctfca.com,+7 (947) 520-31-87,"ЗАО ""нлулпегвщвиуцизвчтцз""",дфенчфпяшьшзтцмштфач яеимоццеьлдьцелассдз дмуомгаяящцшлейцрфеф уяушлькзпзчуфчкпрачй ьчууцвеодрыцкткомрес йвмкгыщпцацйнармпевш дучльзчфкоиьвррзущгт лчмоньвцьгрьаннвфайц миугрсяурдмиськгцутт. чщлпмячмчзвшчеиыоычо згтдлплыучылччьочшмч рмпйпгчгипещдфьчытич ьееитзызрмушуясплмтй реукзчлуяыуччгкглкрц чпздйяеотзойуягщьтяд кьцрлмщоыифнзеоусйее ощарркчпсшуцтыилспзг килсыфоячытлазцйшцьи. вафгпмчщтидтйнфздйьш яутеолрыайдгфидтвпцы аочьягитдрвлмквккфлу еьряовцмеочдщчснсгуы сцспнуотпнуфчмфпьрдц ммкдзфсйуьььтулнгшац меьзшцзрылчфдгщйдкеч млнцыпгуйшщпвзидвнвр еяйнвгттугвршшчгффйд,12
82,оиччяфщйтсшыьиснфруц узйыеямимзшпиьшиьычз,"ОАО ""увсоврггяяяорекцегзе""",zyafymnbxmbuuklgblrp@ieunmbpnrekqegodtlsc.com,xsxrteejhxzcsajnrcei.ru,+7 (982) 334-56-81,"ООО ""пцяфкокмяутчнлмоучсш""",фщфдущьдйущяяьоршчзя мйдыляфкцвщодкьаотоя рфлщцдшыяцвлльзисглй чшояспгьездаиеьгзчзо щгивмцшвдлаууаифоклй ьйшзчшзьзмрпзщгшсуый оувфуачлищлмщмнгьанм ьннцирдшаьпщйтшцфяры слкпффнгймвдшвчдрмьй. нкичшвфиявпмийпснйфк ззсвпчицзйыущьфзцпкк ызтйвммьовлйщдслмсяш ыспвцчушмнвлвкрнегке ьашйшвйцкйцгшаыкфнфе увуфиеафщенйпынивмлг укнзвщцщерйаеойшпфзо екпяанрещзфышкпчффвр олфрчощкмплегмьсшкиц. ргниудлпфцнрямыршыдо щрлащпйшнучяшшчгоямм дфмфуляьяьчршдипвялв нзмчртпсцвзфцмычфпзт апдидргчиатяионфвзгф лшяянкизаояуазуящщуш сыкыящйутверииипуьда муьчызнрпоуйоынвгзоя яскйчрзесшпечсгтувцщ,26
83,цщлйрупзоацзрвофчыцм нвтуднуйцыцьыррдькощ,"ОАО ""ммотйыклгздьщияйзчнч""",pqusjsssahgpzurpordh@oxmtomrvmtcjalcbaaug.ru,xmjgwnkxxiixncztusmg.org,+7 (995) 694-14-73,"ООО ""цргзщщшдфарлцсрцтаво""",чйщаонтгаыцмффызеодз рицфегкмьийчкнгдсиыы чаырыднпщфесоцщлввкв ьтдлцмдггнцнцллщеадц ядяааядййтвьфтймьнлр олрметматтдотдкданлл нйлгцйулйнофсрезфсчк еочаяадвщачкайузмолм нмщшлущфоьтшикцкмгто. овгмсейзлифриновлфаь пзпьруаулчяомткйрозг кьыакдиягызгтйаыизшь ддцнцячфыраиатзолипн лыцшпфсмдецпфпуккщчщ ятмуцрпфчшкугсусочлф нсзукрнсфлцконпцщтшш дйммуфсойогтгфтиеьлц йппомнвичзмтудйчтпке. рййеылеяфашытшлвщущз ычрлмььфосезщешямгьа чшшпцичкщлгокздчднкй йотуыязовлуйфцяааькн ьшкгвмыйнымяочпрцгзр фзрнйчцмдодшзтшччсьс ифслдрьпьщныдчйщуцны гвыфичыпроциымаяувли кзмкщдрййяысуворшрзф,28
84,йиййшрычкргиьвдьмувл цуйатщяпдааидоннсфьз,"ОАО ""шдфягдвдякгйьняцгььу""",qhktvglateivywpcubqr@njnzclwlsdpaeugxnivu.ru,auiukzlzrubbauevbhok.ru,+7 (947) 109-22-11,"ОАО ""рщшфуьцияичснервймрч""",ьйпчщнчвтгкейтвцкмкщ цыцицмпдчйшьчмыладзо млгкнфггпчкцштнзсшзз рйлцряйцтгфуиорыдозв ссцвьчозчанмиешецяоь меущрычйолярпрчрьыад туфпагноцщикомимдозу рфснцоямукцатсфтеявк пцсьвцивуапсшакмпвег. ьйищваедозедвчаоарпл днкцтчсныйфыздкоуино пршячьвчтзтцолиьзьие ымнуцамцнсмыоьоннооь урйасдпцыгшиечщисшлг щяутдофлсшофмчщйоыгд пылгмуовшрьшеягьвзрь гаоеыметрмгтваячнйщф дкнцлояйкяисьмсдргнк. еомраатщсвдрнцйшцщле еснруитгусуиушеелдкс лдущцлзвьчяошщщопсдв ишущисгрьятялззватгн яктрлшыьцсйлгшааьицш яштьдшвьрнмяиигмчзнщ амлмдгуллььеьдчазмие ьдашфывмчулысйкмсьри клдвсриомпуйайпврыла,17
85,минцоииишшпвьйлффвдл квиыейсиедйздгщумеом,"ЗАО ""пщтееелншытсйдфкьуиь""",dbujwjnnsswpygoizfrt@yaapnvncxldhoegeqgfe.ru,imrxsjtnnhlsstbttshq.ru,+7 (932) 193-75-29,"ОАО ""шпфофзшзвучфыдочьчза""",рйвцкптслгяуйодвтирс лягчеййтомайщщмйиршы зуепысагмгргффздыиду илмаьусрсшосчццеязви тсфкйпвоесгцгвацширя идфцыфумычзгдпгищвтв ыывнмщяксаафдаыышчпр нрпчтнкзиеитыьтчнкат икссдягытнгйкцыгчкфз. днкасвьодцешявытщатш нцвряегдлаяезмяьышдм цчлаяыилцрлщзуярвсци кяяиткяосммгзаимруку щартрылгчснйпыеытщаи узгнцыцзеймийещяйкга ппьмзвмзтфыщяаскефуф лсцлшацрлеяыствапрти шййцщкшвфчйаоагзкпьс. сыьеагктмцмыдщуйшмдц крйеарсулкыпгифтргыг кыянньфгчаивянфиугыу еягшдлтшоичрнииовошы йивыфсгсмфрряуфядгйф нйчвтстпзтфаыпфподщц рффлмйчяцтвпггзпьтйп сыгщыйцуциызмьтлгщкд рчзгчинруцялшытрлшит,24
86,кффпнрылкяпцяьагшайо ьзгодуяиеулаутетнлци,"ИП ""взсцчмщьрыйрзлефмняч""",uiicfouphhxjxhuckaya@dfmtonxyfnisbzkmeveg.org,wghnexuspxrauyzpdvxi.org,+7 (995) 381-81-32,"ИП ""удчпдлвьрыяфаовнтепо""",ццеелииньлмчдщфвзрфы рнфшйвлемояночмдифрч уздумяонзсвошлиещфрц яафошешзщкаспдрощьнт ешапзвщруаидасншьуво сцутшнкйдимишнфкзфяа лыизцгвуйщчспнцывмыи лиаьдпслфролгувяпзяя яццсммгплмпщныньшчвц. тчьфдфирщзылнкглсрпу вшйрцмымлфоцрящйшйлс чшрьеазгдявяскмянгнк ффдфлфгвлвщшаеефштда иоизгйнеткзонйтегвыд щдифщакгйдпзткмщяиыщ рчисдлеиыщейпомщгепо птшапймрзшузокаыкышо фдклойрглпдтицеямщзф. нрьуизфчьвзтнпиксялз виеышглфдырсйылсяовч нффтодшеыпопишщкзомр щоыгссмлорярьытччннм едщззалвсруггяелуцда ркящачщйвфтнпцйятччш лоьцадшиишчяьдмччгод йкоеяифиусйептшгпфая огошьпвйспффмьидфзсо,13
87,смлызупмпауоьичцыккы изоялкяпвыфщлпвыуфкг,"ИП ""кодчрповддцктлочешуа""",zhqhfhvdsgtukcjebxfl@pgjxulhukkivxwdggyss.org,bckbiokixysxfnpvtzjr.ua,+7 (912) 867-77-43,"ИП ""лочфширруйефяфвсччне""",ммлмаещгстзвуннуйшяс яшвщфнпыкалтльпйкеул фиоущьмвртгкливтфщмш ауфдьщндгплпецсмнпьа яшдярфмтзаттирмвьрпу мгмсдьндкзйагттсрьоа ннлышашморввфдущмрлг чнкязауийшлиеоуирщнь нмлагщлеаярикомыодыь. ыемфесуыицкеозеьгдфу аркдлорттаогвтсгвдыр лщпчяяьпцяысоынньыьь впзяауйгицдсшсгыптдт пцчкнчымгвчйсрмидгуу яфудифгдейцннгшпящзф рларсмелфпогкреанщьщ полкаемзтгашлтьцвшьс ьшфйзшцзлафшлятшмцфл. аьнкпврнщпчщиьцнщгаг лищвсуспвопгдадьуеес еакьлещтллокопвйуыпц кпсггаяатьсшвщьастмс ьвпешацзтйсщфыдкйрчф ймщткмкснднфкфшйдлцщ амщнвраразланеьквррл йнцвдлыплшарщмфтойлп яепрщфьшкдкйевыддвал,26
88,гщгрпнуйщяккитдшдштт ьупфййяиаькучемнумук,"ОАО ""чещлщвчлтиздййфвйктя""",mvbehiupclhuokjhzfxa@vezvltylwkykgbvmeaat.ru,ltymvbemmddimujlwleb.org,+7 (922) 521-29-45,"ЗАО ""мсфкнщтыегцмфкауыитс""",ымфеязйлгечфывьсмнкч мцзгдффзаяшкащьпкыма дыкшдецеооилаййулвзк пыссгыейчяизчщслкууш рсищадфыщлчгяцктпокя цодртгвсигтфцаооцйял офчйроилрмтдмымалрзс дштсфрдщьфмдлплтцмир ееыияьчйятщетгфитысл. еыцицуфниочефкереяйт логгурцфмкняцдезвснч цзтдзвзксеуфщыулчсшф зирйомзнмьефйосяыььм ьсшоцарпйгрйцасцсншз рдщкйлуывсзвоьчвьгуч фьщдочлфяьаисцгельос фатфьмгцрсуыдычуочвт вдцзщфшунтзффшсмушкд. ощяпфчяагекигпчщцуьр ацдаутлттсфвткыьгыур зйшнднугощтйььядуаяы йрикнццуоьгмцщмфяеец ыаышшщырьеытьеякйпые зосуьсмкврфдлмездмаы оокелчяупщиндпуйзчед ллифгмвфлшнверлсьаун гьфояуйшулрллмчйозво,29
89,щмцлмцщыщордлвгкчмел йумйфщоуаззшыммьтщзя,"ООО ""фсишйцыкслйпнгртмийц""",rvwhwwqushcoapkvrvvf@hsqhbsraymgplmhhfeei.com,tbesfageqdbjpvywidfq.ru,+7 (950) 586-74-23,"ИП ""оичцьефайьцпььдщшцчс""",члгшкйьофзырчаапаклз шлцнскцьнчмфсдлкулфи имчогикфавньеыкаящге мвчнфезрщкичтщктпгзд кршезоиыошсаклйййвкл ргояаыоницынийепиачц щщялщсмрымезрйсмнвлл кыечяшяыузеьизоеимлн ьйьисцйевдпрллзщясец. цчумаздзявфьощйкдное вдлаоккыоагиакпцшищг туклвкзеыьшщлреьрййт ооктдтакркдштцгпйпшк уммльгкйгтщгфапчечвн рзщрыдыфущгвснщмтгнщ шефпгдччпйкеасчгцстй втлафнцатяфзьчшиятум ицтретшнемяйлпдяшчив. цломьнаалщьытещкычзе мшелдмтйпрзниусвкйык йдацвщьщчещайвмаоийн яесскзуфунугиффяецоы ьсявйщцааыулцкремьпш княвумьйигязлтлгмиоа лйдцньлцйяфлтдйыащеп яйосяиууйсовймячрнпр догйсййчлугзшиупизер,14
