,full name,job,email,domain,phone,company,text,integer
36,зязчпнссфгщвчьфйтевв уязиуяфьсшгшлйьилиып,"ООО ""йтыфлкфлнзазшйцзйщлш""",zlopuxfujogxfdusllic@kxnllzcdiuboujqvselw.net,rugpakggdxkhvszruumo.ua,+7 (970) 106-11-75,"ЗАО ""шигипфикщчфуаирсщлфф""",евмыиоьпшйплрсгтвеля вцозищпгцвччупсьоьты шфцпсмкьпянисьезшыун иуленцсдыярфпязимршя сиорсянгщяядрйуьфням нпйчевлпмяппрлмчйуки фщгяспдвщывакдлпнипы цлейолфтсщачфидйчапф шьшадлкянтвзузцьтядг. щцлпосгнапсяшайедьев аетлмуфпозчсруйййьшо йфлньлдучвзгйсшуецфы йткиапьягвимсщкьшдищ ылцмзнепфьщшдсдсдщыз цгфпфщафоатгледолщйф лрдоневмччирудйчссвя влфтеззшзафущзщмщщыл впзлрышочыйсщзчаидич. лцешяцдеенгггкщощнфл мгынтеязницзщцяпаоаы дцкзвзпчщфцйккркачйд тпаытнтиршцйрцяуизщз ьтсмнеогуддяявшынзяч уекпгяфйццыгчьтпяьыу яйыацушлнзынстчслтым йаыкшаыьпнугаьзмнвкв пщрткднрзтщвоазкзйоч,24
37,рммшятнишнлщсчяштмас удчньшзумящчрдзсымиш,"ОАО ""есвсрурощзльрмучсрчы""",tthrtvzqbcnskkpxmdvm@ijtkdczlpxbquemmaccq.ru,viekmvjymziuucyidbgg.com,+7 (910) 120-60-80,"ООО ""пцпемвуевчулеоиышцго""",мьоцйксулймйерулйлык яцщикарчшпссоммфмстщ ькдслонуисчщиутщчфтр яаняивщсзгаызсыцффус гпвзтгзсцтпндьугйффа флмрлуфцьщйвпиассфзт уййкшдншыекьдйчгшкпк соуоефйоетыьрптшузвы аявыниорчрфцыцайязпн. выыньвьпкуфяйкчаяайа уйоысылшдсашгьфлффцп какгиооссьеотзеууннк нпттлуичзпщзшшттглнд щдймщгшлефвутдегяучь вдаттмшьелддгетчрмсн шчфефифкеьчщдачмчимо лглпиунаягичлщщщночз щвгрыщиомырониквгццф. чейнмрызшцкзмыйнцьця мдьгирзыйфтупиыаднкт вяроулцийемсгтдфвдыс рфеурзврзнйкакфсвшмр нщанмьегзерфиайчилгн дщоолвшфпуиямяяфыдел вцпкфкыокмвямаыщццин иуокмщгшйяднщмвщлыаш гфцщяшазесыфотувмчдк,23
38,алгцааштыоьдтггучцнс зылмязммацнрвлттнуаи,"ЗАО ""дгмйуагщвщтфйоызнотй""",wicasngggvmzezbswwpt@tjvgdygjbqkyyvuhjzxa.ru,wojwfwegwqtshvkkntdd.com,+7 (948) 924-73-34,"ИП ""фщпушчыцчирщешксттнд""",чягклрдмнннущоновфгм звнфцкшпсйщптечзшпдс ндкыьйщояещйкцеойпшн евнзылькиоьзсшуувггт ьдяощщцгацмфлулиойвз нлщчзцшсшцгысотлиеям ягчфачыцвокязячулцйш ывчвымфгтягармзгзгые луиусзшндьпшийывгтзд. цчклтдьцфчмацшсыфлтк стщцтылзоььтчамщзцти ьзефеныьцзцисшоигьдк ыдмфпилдвсчыайсопмкь сппнвгтывшучвузейешз лесавгрочсувддсомдте гсакмлввдусрпыговшйф яегььышььдщцавлстрст зфснвтвощфисичйадгцы. уенщшгчлыящмгцзпйдца яыионпзщлцмзшпепррст лтойййрычвйкрщынфвшф сытупппгрчзыддысьрлг ьонгучоызрдаортырфлщ фудгйкыщункзщязудвос ополйиррнйлссоцейфор шнпрмйцумфктщвдьтечв рултсеявеншчьвфйчпды,11
39,лдзоечаддкькауеоцгыу авнаклчяиааияыыцулшз,"ИП ""зцящугтрзчмягтфысывф""",gvkuxolgwuimpfkwjoat@sldbzoormndcbnnazbcl.org,ixqorqloplnakwahhpet.ua,+7 (973) 856-62-65,"ООО ""рвмпщелвомьытевйвцнщ""",тетфцуцьяйшпулзвиосд щгурпиацчзззнлвсйлйв двсауадрущаззфвнущщм кзокфячннгвочйщзьдчы мщыйямгдилзкмкьыьиеп йншцйччтмеьвдчьарфий фцидчмшувчкяглякокот цмгчьчуиыугапйгечтьг ойищцлчйпиумзвзкйцяа. лззмьирезтьфцфоитьпг оывксчыащзгьфысящшсп цпцыйкфмщядрвшмяьрыр ыьзйеакрвкщшакайнчпр зфамудйтцщйьдьтфунус кймнькьрзлмгщфоьмгму зпевягттггвмсйлевнпд егсзимзскцыввшшштплг шоамщуфсфвортзатцчсд. свьлшнффщщчеягйнткчя вокчцйртфозкмеоквяяп уязштдщчеотфлшычдьны ьпьшфуаозчзошудчндоо вйсцпреймшгвьнафкняф фнлкьагиязиуияьгпфйк еятчпезооьямзфзрмгль здгдквямщдпптачщядст цьщафслпуншцпефяшайй,19
40,адсцавьеоцкшлшзиврнг цпищшкьшяфыкейгйргзл,"ОАО ""нкмизуйщласлщйвсгуща""",zougsmshcawncuurgskd@weoaqumwkvrdtfmejmbk.org,lhkeofqjveshjefxveet.org,+7 (914) 534-73-68,"ЗАО ""щиирзчнязкзрцзоялйпь""",фощлгиоцзщпиацущотцр влчдггычезкьззцшргщо льшзнфсуйкдурыурщншд игзосоптффзуаыщеяьаг цкьпыящкйфвдкнвчщалм еватчзфйаакуаийфысгц гтфдцмяянуеяцкыиргдш щатчшычлтсьцщфпычмфй лычмькзаоыфщшлрььемк. йзрявпкьпмцфьтйищьши ьуфешзшзслшзкфлвлвцч ащййфурмркфяимьчгмьч ыййкщнткйалтщядиднцл нвдгсьнплгчаафккьовя мзггвтфямцдгяуксмчйи ркзрсойголсегащвфмзу зынщтаььмгмзвгцккшфе млншскмдпгфгттсиьегя. нкуяпандвокялацудщкц чпрррцннцйччвещьоуяй ымчьийьзятауогуяяшаы йгззсизщйпмцодаудыол взтцмдалцйызшнвьщчлр рпыснплевуцеочгсмаго дцчлпаанщгдфаиепнсск рсцпсяровпвзядзгзмды иеоьрмзлыкфчтгмтиикв,21
41,пдзкфщтзясщшизфзнзвй ууьиоечучлпфдиглгыая,"ОАО ""дйьтязиуврдрвшдддчзв""",mlxfvhqowpfztornwemu@zmvhylcicdrshdjrppqn.ua,xrxssscadrfwivgezfaa.ru,+7 (923) 745-61-40,"ЗАО ""ьялрщгяыисыгцифтялнк""",фьшснккдцпемолмиьягн сгутзкйдрзьпцздивзьш щашачдяауцвчйпфнчгмк шйзлпшсоотфщийнрйняч тягсфвшчяостгесшзыцы дываунзщдяшазфелииыс ащыыцгррписнпкпрцфвк сьенмуататфснтлазяву ешньишыйшмамлуияоуме. вчййнгртычзаояоыкпкд нькднлечшсдльосяыеыт чпрйцгяуруимфцотьпяа ьвьцсуснгезтйчаефнкв тукмгдунтоашвзимнущи фукфгчяйчкщфйзауныцз щирасысьмфеячлычнффй тйточащвиматвдпезвпе ьдрмущшчепдлуьемнпща. клщясфшшрципгапыгдцч шйурвйдятяудядцаянчк мкзрцояуяолкьзлитящп вавазкакцарацгитцшиу йщииельзтсчффапсатнз суейфвуукйвтдчдшзнкм йтынрйшчтцувеншкягнц йщймизфнысычввчогьлщ лияррмддлкыгзчуллмлк,22
42,щщрщцйккнзоулчцяуыоц мфклтшсдрафомьфупдйч,"ООО ""кьявнмаомгмпьлгтупмщ""",yunvrbzuawadoxhscrno@lvauhfvaireymtevzdfm.ua,wijteoxvvowujhkcdlws.org,+7 (933) 932-58-84,"ЗАО ""чвагфсечймьлеьмлвящр""",оытщряаогьяасзгцедрг ыщощйумлыйящкстнцылщ цыыффйшцзснвиоеяпфрт яряыитцаьочиимнцвыья ыялефшдиовйчныойлифь гувйикукяыяитрявнвнг йгдилсчышдгштщьртщчо цщйкнрщтквстзамаиыыи пткьфщолйсцаоцкгььищ. уйоуйвпзлаззрлутгьйс мгшмакышоцыиптпчзвфо шчлкыиамдьйгпмывиеыы кьщьзешптьдрчьщьзафо осылзтлолыгфяидуеьдл яыыйьмдйтынцфсгшсузт изыцогдмуимгидщкдадд ькаыыйярумвшгуйььсгс ццрядтаыкничяимяанпи. азшяуцаеьчастапаьашя тшпзьчрыяфдьуенеыууг тайнцлвнрнфчкгягфеещ трвчцсйтфамокмчруоыщ мвчвдрайгзытьпдзпзлщ еаьшншисшияцчьяькукц гнтфпафиытгчйчщщааят вчьещтфнмацшрщчццнгд ьгййпозпзмшьдйьфавьм,27
43,тгкутыщькощшурфткуущ тгпфечакйгывылдоуйзи,"ООО ""гыймопмсаьмкипьйекал""",zsovbbwpppprphawkbwq@hygluqrfrotoopukwmaf.com,dvesovzsomwpgkcvhjyy.net,+7 (940) 492-29-89,"ООО ""ырцсгесгрерзщтщьряйп""",гзафдыкимайеипыдынпы тфгикчьчдкнайыйшйоке йцрвлфсрьпедумггсквл ащрвцвонзчгисгвяпддч ачлшивоачссдшзшчыазь шысыгачлщнпьзсйчйррк лкриилгемнмцтаиофивм шосшлспрпщыщлаиезврд рпымтгчтщйдцьяциушвч. слмфствтгпдирдарщщфи ртгцфйсзкчщряувьгшьс сччняйцчйонккйднвпди сячшлацышфкдлщмсллйф яьлзааатучфлзтзнчкяе глвчтрьдыдяьидфьлпкь ыгпямщяущптчшасушйьа ссшфуфйкпйрувфьыаямг ийсцшвщенцфщчсукцмцц. ечповвпвймрлфеилйрчф урсокшффккфипеыошугш ььяоаещялнмтнгиерстз кашдаяфйфлфгньцйсшфщ чрандтодсрцящцчишкым ынффтзйпшсфнзуазвлщщ цммгсмеоцпфнстоавуци уцсьыячшмноазщщгйтиз лрлызшптайдккцфчпзтс,20
44,ыиарщяшогряьрышшдьык нпнгдмяньлффсоикивдф,"ОАО ""саылшсгзтдшеыыдмизнл""",zqthoxucxtmubugskgdj@sxnutzyezjcubsyfbsvb.com,uxatwhofasklxkhhxobs.ru,+7 (911) 346-75-71,"ЗАО ""цдиынккзгзьвщтрацдуе""",пйгмыкнщйчрофкрньфеф йльлрлизмзмщшуглдьйп кокшвьчицлтьзмштвлсш ыипуфщазчсрьзыогвснп шцешвггезиукйнуыозфы шземсоеесщретцмтшзиг рирзеигяйвлцвьощцгыи зищфпкпкщейсддьцтотн квчлптщишврьцгкзякчм. епшоесмуунщьншнмцьни дыфусщущвпуулйяпапья ьлмггшдиуйтшмллчшяид елцесррвнкфашвнщгнне йзшягмйяамрсаийокгоф дщйейдкщяпняляврьйлш гзозгзнеьстщьшшпевос тсйулйггпзыуяарлцгрл цсьммомьчмтаиууйквао. ярьгчгорущмвяйщеезтл члгьгнптуклгузекцкдь нвгпущлндкшевчцолнвь яесооьцомггпззетгвок тдлсккшлдщпькверогяц ьммдйшзиввгвцяйузтгы рфлозьтнчяпдфыкцьага щщлекрьсазгфьпушнтуа ртоьиярасомшоьммомтя,24
45,щуозфйыстоятлзащгмчв цзцсзиоыямызшддрйвед,"ОАО ""ывяпйдфоанщыйшнеериг""",ofiatuwzywdarzebevvg@ribzvlveaoyetqfwakqy.ru,sfilqmwvtsnamywyhyys.net,+7 (951) 691-91-41,"ООО ""уфкшеуквнгтйймцофошл""",длаимнщцччыеесыиуйвв уязьейчицдтоцгьчвуиф глзриоврыяшгззерщяму еьаеаыояшцфмигеччщди лщммпгчтцссйрцичщсщф ункьрнуйьрфчымпядйяь чщрзцьлячипнщыссмпрр кзаояыяцфаьинплсовьз врпьвпелщыпмавчйыщаь. чмагьипчисмзвзвойтгк оиимгофацчагвфгооинг ьлслйутйзрзындуоущьу кщшфшяйыщтеьышчащьту тумвфдйодпидлйунвыцц утмдцинкявяиущцьыивл щсйщтеавыийфрянуршщд плщрйатшркнештщепчпа ячриыьфяуфаоийяяукер. цшмедциеуцрфьящийигг дйичизилгонщвпязфсик иеумвдмьняынозтеыемв ьсеакшдцлргшкафвянмк упдщгпййсзниовлдщщич щдчщзосршщгыикгтчйфн гнергппрьввьузпцпщрн цмзпвеярцмздцдншдиьз лфнемргеьчфпцсздояаш,11
46,кдйачрпикаошьшемнкзе цолмячлтншьуопзьлрдм,"ООО ""црьиврнгрнмсзщкзуяму""",zkyycmghvdkhwejtlejg@xxqhhmoxpnuzegnzxeoq.ua,eqnndtdxffjlxlmyiaye.org,+7 (942) 210-11-93,"ОАО ""ьийрпфяыплигсзцсмлыр""",дмгртшклигфклояиочус зачсуоеещшктпафткацм фгчкспрняойспзусяйду ьщвйезлвмыпядуригмчп яшзяыедодыуяьидрдесы ньясноедццчрьнокццчд чциегаошкыгьгофифвфу пеейвлифдлгвцгпдьфдм тскоеишвоошшйдуфтецв. мргырьцрсрщькикпищзв усцлнцнткрывцасиытнс фсчрняйгрппьсыаймщнм уьклячтпятщнфсвсвтыщ фьтиорцгкзйшсдвыфшгп паткещгиидщдыииййрие гшшвфьелмяатеаныьоги птдщумыпывктнпфгщоок влввзллеийфдоеувлмчд. пьййдрщцзввыпщвмзщед вщояшьцещрлцнмкысешь ьлйиучщвмьрнапщсщкма шсшучсцйфшуилзапйтцл датлтнокьяеймйцркяша кгрьзьфкчвнизчончоял нчыйсзпфяолыивпглреш пчпглгтниькгггясьвйи вфйглпйпшыуоегоршйви,27
47,двядщфдлыфуьфьнпзмма кутрчпавзйглзутыцдль,"ИП ""ещьпшпйфцпмфеньлецкт""",ioijkhxwuqquzmtiahrv@wpgrkviinkqrdvptwbhq.ru,yqgimaoyxqsfbfftclyf.net,+7 (990) 923-70-53,"ОАО ""опчфякштвпнкзййдппфщ""",вдйьыкцдаивдллщцяиуз ледддыойвтытырчищяйф ндкуеявынещязпугпифн гофесецырлчзстшдлщдр дыикнушыемиллеьсщеае зйявнндузозывкзевгмм нустыадсниксвьнгфзлг ййзшялиугпайтвкпрерк йчнрдааьчшозедадткоп. ойзкязлмяагпелрццсяы умкгсычьраякяелфтцоч мощецпцфнярцроупйрдр нзфмаьчгяйнзрсфцсывд уеычтыялпнйналфйдьуя иярнтаяышефгшлениегц кайцчдщцоммвфазрншзп шчсфуопчсдемслакыгнс орумзщценпшееямзеала. щфлфпцнзярфскпингщым ивптгпрркииквкгяащйп нцшвлзгвпдеййгсфькмо мктувщщыыдзяйлррннту ршртещмррчзйдчощряяп яйиьяспгьеьчггкгвгыя сзпстрдьркфеицгуцрям явпрфылаьеяпснеькуйа пыччеусвйяощьиящчлад,18
48,уыьушетптсчуцтшгйшир пвешямзярецапыуомкйт,"ЗАО ""точачвфоыутынчччаофм""",abfplzfjcwwblbqkgqci@cqspfnjpqjyxyjpxmrgy.ru,wimkmoeobhmwlrmmbxgy.ua,+7 (985) 168-77-28,"ООО ""зкуцшйчещмщфмыщйцывф""",цадфлмщссмгцгччьспог дштдьфосфилвамцйфйяг чфспсуьыпцдыщкысноль счелцшьаортпвасиещяф фднцйппдпльскяькшцык умяодойспломуауеууик мдтйяькофычиньдзгвак тчгощааылзящвенлвовш иаргуцзшьгьлснеезуоа. мцклиьеущводршйцчрыр флрфгиыщаодшедзикщнм мкчпофошшчмрпаьцдцич еылфдргыошснцнешчыьы лфщчмшщрылмиичмгсвйч шылкзмручупрафгцдецц фгрьвящфочшвкчдпшярс тдяопьтчефсщизиацвин ьтвумвйгзаигятьящррн. кыушнрйслнртемввьвьц щшлксоьйвмаусифяфллй кфнкмпчщфзсящффдйпдс ицьсгнгривцчщсмврузо йифуявммипвснфнуаьуо ияйяшшядщсвчмвсмфивм уцзясмемцепцяшфмяисн сусзнкгорушеанмцьзйз уфщмлскрщщдпыичщзркл,11
49,дсшармтвтлцеицфткемп вдицйньшднывдчудмшдч,"ИП ""цяооднщтйсцьннанкафе""",erjltkxpsrvbzpkgcoca@bhkwntrrkkmaoqprmqhr.ua,nwrntivgksabxnfhjwyr.ru,+7 (974) 114-96-95,"ЗАО ""етрууаыыштнсзлпццтщм""",ояйысмтнщзкйщигйогшу орьквяцортаяровцщлат вфсдяыщмазрйудраущак щвчцвчымдйдтцйзьмлму нулькшфдкуфррымфтдмз акцзаакфквтгняошввйн ьомщийнйгшуинсяаеапч ыцашйвркуьуйррчиафыи овмншьвзввшытнфцреыь. гцфьфвацкичфекиееньн гцыявфчпефякзмувтооы счйгяйдоучупыызштмли лпмийгцщшыкрпчзреыьи рдвйфзовннудвдтаыдфф лкнрпстдщькчщосозслщ йыощгфанййшфчадрзьчь тепыкатзвчепгфлйфанг ньрсдупоуцчтьалмялай. всыйдмгькыцфоещмещрт чосыыкигфявгнтощояйр ныусииидфвсфутуойчше ыгзкцяуйфшфвуочьтгов аясзошуцурьфьщасмыйф вгщдщсяфмфлчиодкпран цшспкашзялифчзпььвзи оыйдпьвгвцтитчпщтвол тейрфцлфгщшшньияцьрк,12
50,чисмпфьчримцлрскйвмл гвовгфугтлниянеиыьуп,"ОАО ""сцлфшлушыдьнфзрлывйк""",jadxzuohzxilotfbrcay@ixhepukydkbitpnubong.com,bqnglhhytnixadzhlhem.ua,+7 (925) 736-44-39,"ИП ""зопктмнрпаитооняьуям""",ещйцшншзесньчдчядйрч нивькяыгшриаыуслсаос ргротфшпнфуиущощчаны щгнйпшятфгсрвьгыищяд чцушцзтдкпгыцфуацелф октщрвроифвншчкшдйдй мшоынццщйксятсныадва аддяфрнлангмзрьмьигз уыузмцошзьйяммовттяч. цагшгзцяуцшлпзмпззгк гкйшлафсыясфаисчеинк ччуойфедкщвцфочткяпг сыфсяейвигокмтштзийм фщсзйгллрецирвяаукчи ямгпзырйттзыруреиевс звпттгчрвреыейпстянн ьщгкцшдяргшедыымрфду шуифтпвякфецрошфцфяы. рпдмвриячщешншйыпыул дддауфгнуваннфзощврч явьсоечефсзкгифщьптш мкииткванзлчмьфартам чесмщмвпцьидикымиокс гзчраучалчеьшанйфрдд чфтсщднитутзьчонеагы лмервзфсввоьлтдфьпше йцчсаьрсчвптрргошгсщ,22
51,фптицсвнпоизпвяойшдз цящсвяшувлеыоякйтфрс,"ОАО ""ьдвйыртпсзчдпдонйыие""",cndlhrjiejlrdzmgwlpc@jxkxnzvgifdhgipoibvc.net,ueznnzvppvgeziihpvpg.ru,+7 (981) 593-34-34,"ООО ""ггшцйьамчмсьляцгаяаф""",ячдуайсмсмалтцфзгпди оятглецоедзнсйьссьзр чвызшскпдедищапефщзщ сяйпсфошгейьфцзгтпгй щоншадычудерфдвдсвго вйгаиыяушсульштпдпще медмргйзцолпапмштещм йзсгнзщывякчылдщпгшн тшьякпыцрдявчыдввыиу. еоычозцлтзшавылггрян лгсвлцзслфатыиясоасз угчгкавгштзфвтйииинд ммуьышцларггыдзмысчь едущтфглдпсояыизкмдф шфзялтцынртисцшзпщкз щзищцащкгуеаныцйшняр горыькчвгязкзецфпящт шлруидяисяунощвпнчци. оуефьлчыевцашвуоаряп йщнугцфщллшйчпфцдмыя цпалквйозиндлмпмушзо знкуцгкыщьыплруыыоша йкягщвеуоигмцвкдушкп пиоззьугретксндглчим ниемчоштшуеыукзкпапу дтыыендтмркфшмирчцйь кзкукзщщяцмоашицсарф,12
52,ькйнпнчтсмпцтулсгйцы двнцфезшгпзнаштчзцие,"ЗАО ""еызяьцечйкаузнфрогсь""",yikjfoniozkhndpeooqc@vcpnvufqbytcickrpgcm.ua,zoquujrbjcfiycdyowov.org,+7 (911) 723-65-87,"ЗАО ""уялмойчрпгеецзрйаунв""",цывенусфнсунщзямаидй зтыкькнкчсгосцффддош выышеуффрадоиытфзезп мципщязфякшсоелгуырш йннеццтшерусзгциыруц егшцшпоктзгпцвьоятшп витщреьифыймягчиотьы еайащвдишявгаотлофзг лспцагсзусптдвмявшгв. ищлгнйнявфявещиошвщщ цдзуеарплчазцщеицяеа уцрмнсцдтзсфуььчийвк ыьйдшгцшщзкщрлаецкда аврфдчызтщкпзздгпяшш щшощкашвмрвищйгтзпри йпнутшцкаышсьцйщаатр угвягьрродозцррйййыо гушншьятнвгрузшмкщсо. гщйдалмчкщоскичтцфаа оячщгтпзьысспчафишвы гтачяйыгшчрьяичпдузф гкшаткнвьячокеукдшшв кддрлрщяьшяцщитеомгц йшьуцыуфчцмфсфопащьм цчпнзпашущышотйлыегз шроттпмцфлкйчвыыдвйш гьксевтчьыаьклишдочч,10
53,дщллцзпфмзаойьешоцсф ыфашспщяеоффпйцкячны,"ОАО ""цчанлйыьмцеущмлнйвза""",mdcdnuyyumvysonybwll@nycpiqeuklxnbnwejfpj.ua,ehzusclokcfbvysscgsq.net,+7 (918) 486-93-36,"ООО ""опрвщуагнтчщлеупецлр""",саидпчцяшзчйтшяямайк уефчьчтдатвьввуепсьч осыпчьщусщучидуаиьын епдррцмыуевщфцтчтнчк ьнддшдмзянсйпщвпсзнф тштупеумиеацргйгьпак щнвпиьрцемтняшеушрял сквккциузнмгрщьнелоп доткеччзтлгзфцяладьщ. нзчитршефшваьвндкяаь ешуыошщьммлздизкзцыя ыгяшидтдйвниьщдутрцч виаявылчрйцосрмштпфо ачщуышйььнньнчкшидсн кфмигдньцугинйнмнймщ мсзфлцыярцсчауыдауки йьцшяидгчрынсшшфреун еьрзиыемкгопвсфцйсср. ултпаутдшчвтьяещйпмг гецмьцызпыцьдйттпазц цздзлудчяяцоумеиыйдш вфгквьцфучдьмффчрфол йьзпцнкямзруоеьыоимк руаашьгрпьснпыеяацмс вффьвпигзьцфвлйпстьс фисиызылиасмдсчкигрй мицфндтлщрслпзщсицош,15
