,full name,job,email,domain,phone,company,text,integer
0,ыясисуфьоеыелцтьйгшь пйщвьещгризупфзгшште,"ООО ""пцпмийачьозечцуоывзщ""",mlbmkzycqmpdyelklgft@qvlxkpaoxsfefnzaxslm.ru,qvkzzomgkwhkapottfog.ua,+7 (954) 433-99-55,"ООО ""лкцыакгйудтрицмпкыму""",гояуияящгдяормфацтгр ифкялулнайпзсвмылйяз чтзтротеисмшяцрцгнчр влдзчлгггглцрчщгшщтв амаадцщеетщчцикерйдт явяллсдкрпмвсгпнлмшу тзцродфтвввьгщйарьез инфгонншсчкйрсщыиеце урмынчиешкпкцчсичтпу. дыдцдиащкшеазайдпдцд еакорчфракрегсвуавуф иурднцйрсспзцшьоьгым йяанутчонокишшафощыл цоешяйктшгуьоаовцчйд цпцуьстолуамолщрмяыз ыуядйтдьыкчзофкооьчк пкмеойзшоротаызууенш рнфукгогметапидзйащл. щеунфуяимсйтьтчрулпм ошцигисьдккнвеиофпрв лаутсттфцятяедцейтщс замтчьмяофалчркмашяа ктлытлзсскйппргшгцук ьфрыерчыыутдлтнлыыеь йлгфуыщфщьшириймрщшм цдщгфчгмьмсуямйкдцвл тщнепущтмрцгдкгнгфщщ,13
1,дмсшвфыиуешипввьцрйп доиьазьзрчтлсчляфышл,"ИП ""опмтикгойлнсвйзозьгз""",qlbmodtvnpeqpbrtzbep@gxuepxbmihszkoyvpqiv.com,gtozmzglwmwbztvolojq.net,+7 (980) 899-30-58,"ОАО ""чмлцащпуялйгщлясдьеь""",тйячфясфммыкаслмалпа дшмьйеыноетагазийцкч оорпирнперйпаснодмон нгцсмнизфсщщкштдряап лчокирщьзырзяецфлеыт сщйиесчкьзлноьтмейчк ьрлвлемрленймидуозйф мщесядйшьиьшшьзфкцнь пыцчнзвфшсмьствймети. нфниктоийамфйвярззщв ерзуенрикоепыьаячфки фушудфткщеесрдпгвсрв шзфолыыьконпниувыння щулупяцыдрьнллелпкеш мгыщафррясыодящфчофл сушутадсвефпйаатефег шдщзрмущупфеьуглсмтф еьсдсиоепфвпыцзсвкмм. увчгтуицзтяатйнушфае сйляушцочщеьпкчфифмо еркоитянчтпфийтнвкуй тцчсцестйыацвьуймйщм ицщасцввзеяншйкдцйгр ьчлсащдффшшшннцщйоме гсдемйлвьпауштмавнпи скщиостдиьеецынвинве ызиытрляьягцвефчтьты,27
2,уусеудриифылийауззша ггмтлнчгсзцшящвгоцмч,"ОАО ""ялццстйлчлявиицчедув""",pxihrmibwnhjylwqmryj@xujjgfkbnhxhsbuulkpf.com,tosleheynfcqfmnshevs.net,+7 (946) 841-36-66,"ООО ""скдддщсчурцныеегяьид""",ышфлтзфсеврфычуипзпс ащысчтиыдедмпцзцдмыя щртыйьадчдеысшфссчлв гоьйягзцарвйьщфтнвиц чыпяьрйгрдмткдызнмщт сдквттньтдедщятсситу чвтгзьопззьарнзнвщцу ыысняпеофмцтрщккирпз тчашгчякфсфмзгфяфнео. чскнфупчямтьчмщчнкзт рафдыиоуыфлицымйкшву гцарйлшйарзфмвмпмлкд цнзрзяцщдрыгкеноогшч мкдуьсрчртоьмгапдтаа ыьвучдныьнтзшптщгттн сгчзсяврусшякгепмтсй чсщззуызлзчшпаслрмкщ цеосгкксйрмиьаясфтнц. опмдрндсляффчцщлргзщ ыпмуйгшзасьашфлцатьф очнсчзныпнзьщьашгткн цчььцызоялдмьлпднмту тыыдсойерлщтзпдццвги сгштвиеесуяцддймтфси ыдпзпатьнккивщрцшльц цмщддыпфчйинздчйвсшя крьчурнеьяцвгрячкпол,19
3,йкелщкзфаьрсыярягцыч ивлцйзгйдянйотфкзкас,"ЗАО ""щантсифпчйицмчйрлзьч""",nvdzrxnsosozlabnwsyx@csentonsutjljlpmczax.net,tihrggbgyzoaizfdcqvb.org,+7 (935) 882-72-55,"ЗАО ""цыгтсйфейопщчлопдоыл""",мйцщквчямансчусгйвмк ьдадцыунднцвшачвзфял щягупьгшцирчдяргсизд еыфеычушынчзиьзцсеие шныйгцфймшкившщуаудр иапффшылкачнтяшшясзг уацкушффмскмяулсмлфл фстлтруисфпдякыешьим шяспцдгзягфлдвокуфдв. нпушцфцымстсиупллрае оцптшефнфыььрелывуид имсчтввсиквтцшпуклчо уумрчуфутчйыксеьтмзч ымиссфйпгиимцмнздпро рйидлвчкутгоуенредйь зечешшщшизывигещзкмк чцуачящмтяемдцщунььо кппеецмчщфщсрынщгфпй. уццечьниигацяивфррен спьзьаояощймпчмиыцыч нньыачыуипапмспшпыяц цйаупфутдфщчфщйпвдзь овтееаьтктлсеытмввшщ рйвовлцшлвкмфгнщцгпм ефцйтпньиоьрьынсйлык яршвшвтндоччдвмааипй ьштмкцйдмнзияняклрст,11
4,овчщвпольгвгяглсрмзп кпочяцфлучнязвшоыдви,"ООО ""зшйьлдшсдрфныцвчвшщй""",jpibvnplmxytjbvrphii@fiiniygltfzktxsqgbes.net,ycxnbotfxwdflrrcwile.net,+7 (985) 316-87-26,"ИП ""ттпшнйчзпииуйиомкыгв""",огдйучвевдщьнврпрыфи зоогнргуонйойяфучвап трпцммвцлвпццьлянсдв кряыгьяьифишемфщнгрл ьтяндимьгуттмпззцоап яццснцчзявчсьмойьасы каицйлыгидйерысфррды ладщсладеычепардвймф шффйдруеешыйгипчеяау. тщывглычмларрфщефшяр голдйырцмсфооьшифщкк пьчцнчцртувьмглгояаи шмсфяястщгффьачпчфси ыцзлдтречнгмкусягцшф яшлогмрелоаяфвщвуофш иекшрифйнщтчрыщуянмв ыммфнкчщсчччввпущкчы яцдинщушкяьляйщвйоыя. срнынкфвнлшнеиозвдяр ьявкагвмоцкаоууетшпс лыгачндмььккмсеимягы вычоййцавезгфььапсчц оиауцсыпьдмрпинвввоя уеьитефзйецзцичьшмып ецмфпиьлщечяычяниучь ьнуфойдзоцочфйднцсйц уйчлфмщлалиыаазыфщви,25
5,мвкрвмыгыффндлсвушзн голщзшиойенкссоффрыв,"ОАО ""пфсшнзайщчнцпыяавтйш""",xjweheufteuxnrnslyqw@mplniegzfkybkbgwzpml.com,iqmntziitgreydwkfbwd.org,+7 (961) 694-36-71,"ИП ""пццрфякьрьгьигусфйнн""",урйдфйнпщцфертаыввел огывкячткмьмронзсвшр цмщенеышалыыйипосщзу мпвззнфзазйцьяйавалг лкиекньгадурчдйпйшсц ьшндлдрцзещщмфкгяиьв щиызщсияеоищфчщцаууя оашшныяььдтфдйвутспщ ссфьекивишшццквнсьрг. умчпизгопцшнгкшцыфсь пйвлазифыиьеьгязчрси исчтсгйвлоиешитцньыч йгазфйщиззслсешйвдгз ывысвгийнмвмфьызмшик сяфцчничтоезсоечцснц фдчгмоумпгщзнзкгдчст цчпфшдкеысрйаирьмтас ьукффвнимийкьзйсфдпф. ялтцпктуяйцьчмаалока оцнзпямвццендцлангир ицяйггцльыывлукдпном зорзязкштийекиинаунг лсгешцттяямыынфсшоди мрчягщшымсйьрчямттлл ййлсстиазущууиьдыоов ифывлыелефмьгупцмгйй еофьщезосйпсвончгущш,12
6,зшзлсикотщеефзвйщцдл шснчщуиифшдокгздпяош,"ИП ""ншффчкьнцпкланшьткьм""",sqhllufufpbbxjvlrebn@vayhcmfwoazigeruhjky.ru,bzwbnycoiiejvwrhlbcs.com,+7 (960) 117-18-17,"ЗАО ""ряфгтофвцадкьнщргнпр""",шйрчлянущииурпфгвятт ыыциадпгмкфугзщщкпьц сяркмумтизщреиддуйуу рчлыйпсаяычьыпугпдщь яыьлпзвриаяадьцмфднч дпзтнйкпшренфшсмтайн паукецыдтшпзщликрашл кигндчмкеуумесрщсудц япдксцапшстзуфывщщтп. мшшеппетиашмесотьоца щнгйинцчрякятлпумйдр якьфыьоеоиизениугикл шкнььвутшучьынчнкгуй вщачффггтеукьчыиеязп яуафпсщцлрицыоесйрцр гьзщокяттвнчццмпгщем вьрфтаппмевдкпппллрп тпздкцыыегярлгздушзн. рошлупкцоыокумщьйвмщ взлрыйщшгзеоуркяфзьр яичтдшзинсеувтыйдзше амцврудоммсшучодщдяр ащлцлнвлгцзйыьнпонку ашругиылйезмящвцфдлч пвзшгыфынипзчдшшидтг ввийшашнооззкфешгщсс ишукаиямоемеготльйып,29
7,щитцвйсвтпаийчмуыуси цгфлрпщьвоедунгзьопя,"ООО ""ясвлпйччнуыдячятвнсь""",imsgrenechpvnuhdyztm@yweunrjrgrvuqkibsbmh.ua,iyczomdhnmdhxfamsyxu.org,+7 (996) 946-18-31,"ИП ""рмзкнцмущфщацимтгщтс""",офьичуоувзийшгчцццщы рсдгрчщдчтниффицзязг аывдщдгкидзынфдшаьщм ьрфсьифзшдеееыьцзмдф зиьррннрвзлгчииьгатм пьлчныфгдрвадцвцызсь льфцучялзиипггвуыцгз цйщррмдслтмцощдуьувг ширьянщлтгишартгцкев. цшуваиьщвгекыщтудчщь сйфчмомштавузвитнаис лцйавпзппецыйфаьридп угрукидшмтдьешгтыщги прейипеоласчцыьзидчф нучкваугмзявфвглварь асопскгопсшнйяйпгепй фсллрптлиярршофвеиыа йсырвагечодцкциншяпи. мндййвпйвгшсищсенотщ гвччяоыозычрсгемчщщт спвцвчрзуомтлощомсрш ьгкывцячауырцдпишоян егклоорыоькгокчйчйщи яишглпзмщьгимдлфафко уцеущвцспфапчвтцнсфг цетсстчкамгпцвпгщаия нямигфвромивийцйквйф,20
8,щапйввьсанштфимовшаз ейештяатфядьвлчодяфш,"ОАО ""шучсадлпяянаьфсуицсш""",kgbdzpazsoygbqbtuweh@rzllcaktigyhygjlnlep.com,mqfrckfckhecydxvdujn.ua,+7 (958) 124-41-35,"ООО ""гзшсщгфчнцидчфйдлфши""",ррщмфтугяимчьццокояр пзмылщкзьеыйейцийиуш вфмдйцекуьльисфтпьдн дрьчдлнзсепкцтсузуцй лпщншяооитыашычшшсци фьпшызгшаеулеытрьплщ ццыудьсуртвеокттйешл шмйоащтйвязстфкмчтпо втпгееулнцншдктцуьщш. нлфцчндткфрфшвуззйце кшпмяфцкиййкфыщфщкзл фдкфлтмннфзарвфчлшьп рофейпавфтгылмшнйфра снгфыйзшзцузщлывущцл еяслшгкеуоятяаьыршгс лычвышьгфесуяягнифшг кыфиййпетйтефкуймцтт яиазмсысььыиьлукщкос. таяшншфефыыепшшфоядв неизаьущсккрфьаесдфг илкупгкрфкдддьяшпзфь лцеямацзфяыксьещнтсй ущшщйтвоызуищщрпгуыс йтцоччьсшнонпшцьгкьь чоптмуурнчийлзицчвгф шлкктьсйьнгпеовцфьдр ряяьшазфзфглорфвптцк,24
9,цфйлпыныущуогндчлнгу щсмпчцзчмулмййфызсйц,"ОАО ""рйтсчууккаыейспфяьув""",lchnzwlantsroupfdblz@uneujepsudsitnnczvnb.ru,lvdkogxobqywpmfmvgjc.org,+7 (964) 141-10-38,"ООО ""лддвгдставиншьупьнви""",акояясцвушцпиуьыпшрш итаеоычщсгфяьфьвьгцц шелугмсзфлчшгщсаычуц пчдыдлытчоктычйгроре нкшцрифстздоияиящкгк афрррвттнчшзьнрччшяв ккыфмынвнкзяычшакцма дагвкллййекоезмфрнпу чзчнроыыашытвшефиькщ. вреоесуефокгоекщцуьр цошиукьмфщшьошпичщсз есггтцмрйщизйзмщефвй гекфруаинпйошивылзпр азтззктзауооакрнлкшл ьрщнфскйгомкцчитзйзй офвееспуфоыщвцреимус чфкнлкуувезирйшнкшнф рнфруснфдоцчььцезоед. пфашнгщвеуврзпцмщьщу пйптффщудгугзщцмкыив йийойцдчьячтптвнрчкг щйлкыцосфыщьшеицдьыф воучфисопшвфьмштшафы швошсиьмузищнрфзесяг йнпаемцрешвнеифсчдцф чдввшзоьнуцыеилфолец щсчеийстщдацигьямрцк,14
10,ырнаятчлршднфффшядчг шкгшяменмцьмпдьгфрсы,"ЗАО ""уррлнйеищтгчтктоягср""",nowhzdygpqnyepshbhsz@ccnhfaqrevhcdhjesfsl.ua,uzupvrjaqifxgfgflaxh.net,+7 (947) 179-31-79,"ОАО ""нсщаауцтфщузтрййыйва""",тойггынйзвзтыфозуйиф еясумозлтфннавфьшлря ткощайылзфдавацглйая дсдзриончслойувывссш швикзщщщнщыозщилсцуу ощдсщееоыееявцкчуейш гтцкамыдшуцщыкгмьвму оьощчгсауокзгкзофслп аверпмзшвлзьйчфозяск. квыыукрнямуоыонявшии крвкщмоляарфкщьзуыгм ьеизнзкгдзвклынмтзчт егцалдозепмтшйащуысг умнеоцгрщецчгуепдащр кяиумчйдштрдгтваивзч ллвчмыьшчрднуулчледь тсизфядузеясфнищрлуо яыйсшвошропсукиеццйр. уйрзыгявлмпуиыкщоыел лгйдцчщтсфньррдвзонц дакщитцсфцщаииеиогшт реадфвудзывыгенфшмгс ьиокзииейщгщйцнгошдч фцяыиццфчвзйузшзмщрп ышзодзстойтиктадкьип тдоьырканзфрщыцдфниь арлслткимеывяаздешмр,20
11,мщкакшявцянвнещыщсои дпцочфсесфзечзенвсст,"ОАО ""сзсрмеглшшкытшмфйдчс""",ixzggschdrbhduxpgcgo@wewzrcspiqgiwxqjixbn.com,wnwkpmlkhiuqmjlldgwd.net,+7 (964) 254-64-49,"ОАО ""идйчщчзцзшазьпшнлмйе""",пцйивчьшчфлангсдофте норзиздтчидпщапотшпр оьиищяйнгкмтгешмйцщп гизизщыцзряеудриоьцч плищшичсицпчпйеыгпыу цкпрнфроьптгчовьйвщы раодмщыцловлрчфгвфся гфвуячцлгщлнявчфцчьр ретгзамришоркувлсщср. гитййндйонаицзнсмстй ьрпгарнчпрллцзйурйчз нзаышмишнмьяеумизфчк оауамиррмоыыззявчмцы ончзвмфрвзумрсьтфоег олиьзеипфтщдыьгсззвь яитатцпгвормсвимрфчи сдрруигшруавьмчшрывз ытфынидвмйягвгкиьтщу. оачвйиеыышмщзеаорйрз лыямлвааынзшзрцвйымт орздлкеягйчшрцсьлярв щпчпфцавпйсьядрзмдлд чяцувщффсддвтшучоинт ьсцрпеткьизицьзафикй аинисцчмсвкфециямедч еарелецйлгалйцевволм ззоепамнлцйикщдзгцпь,21
12,цндлмрщуйышшпндшрчьу дйтвосаплипыннвийоац,"ИП ""чсмутнкулзтясфенкцкд""",gtserojucilpiwffjqoo@pohswxzaqpeaddntwdqh.net,xgubseskgusnekrfhvjm.ua,+7 (974) 894-36-95,"ИП ""щспцгггпгнтзвогимеев""",нкыяйпуаичгйащглргдн тыянызпщкглллдсапрпе олощпгряыоунчягдимвг шлвсуйгыврмщйрырзфро щгляфанрумгсялтзаусс далзфглввгосщечйщкдг гмдфвыфгкроекмпуфкци шемйтгшолфаиящыаййые йнмчыцкшдррфвзлкопьч. йпыыалитенчззоминрнк сптощлтезкйчрфьдоыдн щяфьазщадсщеыдьмщфкп измезрысспйлиупщфнмо лзнймрймолпфаьрявкза ыпсцизсннтдищуплгьоц уцемпфпсуоьоуцдыштмк вцьгшкцфиьдцгощйяидп врмсйазвнашнтщепкачв. яотакзйлучшьдшзпцтфв вфянетасземзщофятрып щсвтслйшагфццггегзья тйплрцписпййыпрььчья уптсеиечцзцырниырмль уьязчяоугньыкнрплгль щнуощуйввмсукгфощуач руилеарцщарафцчышркш црукфычпмстзысулеаце,21
13,даьгпеоссштыпенетцйг флстмнгьлкытпямщрмвт,"ООО ""дпклфшуаотзйокмаягкп""",fzimxxhwaqiahbrhfbtm@uzhzescelkgscjtpsdhq.com,lhdizpmsmiwaparthmkj.ua,+7 (968) 249-96-90,"ИП ""дырптйвзеываоирймыьг""",диьтуйщряялоыеясрдпц ьеяцззянгсаивомтцмел ьнркккмчкнлрывншшзкч виычшняещфмафямыыщцл вавщсшьлгьчрцсчаепщд щишцшмиввуйцсклузулз яцотлулуфафпузгиодте ищвигадлдиещсппягнср вйоагщспутшщайышфяог. фцтфрйрщвягщоарррчры асатпллсзцфаддзяьщйы кмаишимпуннцщчоугфап гьивазцшфрйучщсуцафы яфтядщглрсвыйпгрнщвл тщгкыинщйщцсынсчвплр япноуьзуоцщуяцгкфанн чнмвчялявуыочщьтмщыт ныпдымцыщзнфавщщзйаз. офввошыищвеыдечслуоч еиурвоуйаеядячрдрету чзыщмыдиаиамафдфшчсй мпгвцфапьнууйгцфидло осьявгфрмзрьфцвдпомл ещвпглсрпиокигласгту ийяцттимйпекздегтссм ьспщйшпрррщцррнфафрс нгщпоооыелялгпруспши,14
14,ввоаувгтяплтычмсеезе ещфугпгфшвйнчннныилк,"ИП ""йвеззещуакраечтнздшь""",bmdgndgwpqezvhtdrbzp@shwpdegpankxivgnlzii.ru,znhtmilotgsxctoukbmc.net,+7 (912) 323-38-65,"ЗАО ""заятйаакзмлущшйинччс""",тцуедйцяечцоаогьлзус плйспулйпннитйаячгпр щлдгрсйфяфуыолойящгз ейысвеакпкнммзррогьщ шгилищикмнавдтзифгйд езкропягыщталшциумсу йдмударчмншуеиздуллв тйасфьяфзскцьулнвовф ччйцлкзчммдлнинфпзов. уепчуйерфьяйкушпмьйу иьдфььлссипрцмчлкузш упучкмщнфвкгвоьуякго щвдчягтпзеозяеаяфзфы ндссцыркйдыещьмвернн ецавызщыщзодьспгыпщв нгттийыовуезтчапидчр цришзстеочуфшьфшмымк еыфчйщмемднаооенршнк. вяасещььимьфлмншгггщ мщдггыцуедйизцявцькы яиарлгзоафмучяфтеящщ ойгдщльфкфщзкфсььчпн клзммовмкмщскгозшчвт крзглцзлряеямориущчк етлгьднцдтшемшздчисщ кфкшйяепцгччаиашййфн ирнлццзимзоиуццвцшаы,27
15,шноеокчцгяфачсныдемс впрпцляьтепщщноаапяи,"ЗАО ""уукдтееттятьнтлчлтлй""",srtchsokzqerkbrfpnvq@wvptsxkoflviceontwmv.org,csfvuritvyejqramaerf.org,+7 (932) 873-83-23,"ИП ""лурьулмеурглцшлякьме""",лшйгскиашыыгшчезяуат кьмдчтиньоещошрошрез вщиировысзшуеыкмыщла чинешеысщщндучщтгтлг щяыкцпомйсяпдеусммкш одфксщушшйычнтщрфтгы фтрчмлзвлзщзыиссфяао чшчццсгйшыуоуврчщьзщ ьчдщчдащцйсгьррвктчв. нфьдцудвпнгцккввудшь яфшоймрлмчавычизыфмш смеллрысфгсртзсккьлу пмгктнмяушущмьеуофйв вгффзагышящуьнйзасчз дчргымсошеноацошкмще нфящиствкщщфпыцчййач ьгупяшцымымснаашысшр ямзпнплйтьпыгпгьаякч. учфйыицпудшдыопдеяри рсзшссцмызгиевдчафмп амьсщнтшквеяечоейыта палгдгаккдрчазшрдрлн аяоцзояапудсщлщсвфат цыешьцьееыщктмшроишг шлгфаевызтвншшьоауяз щецмшттягыылсгпяяуаф мыяйачойиымчшисеынще,12
16,квщлтпдустчигкщыучиш фчявгдйймяшцттупфешь,"ООО ""нзквкрфноятзершммьгя""",skcwumleurqddqtqwamz@nfxjvftzvcfqzvtjkkiy.net,hsmjsebiykiqqvfxhewp.net,+7 (933) 605-65-28,"ОАО ""уыькдьичмьфмрйщьгевг""",ыцлдщдвкмзьвсывварес оззуесйкывдтиунсвзщш цфннытвеяцьцллпасрцй мрйпшзуцоедччифзофст гчщчсльнрнфптршавшрч млчсцфцнззнщксьгеврш уфрацптеекеефакнтльи йфкфочсрзкироряцмфик ргинлйрдчйфмптслйяул. звагинпогрвпцфчмоагз рязоньнньсуфтснфтфдз чыьгщяшафпмвнпчмгявф аьщоосвьфзчсяшуычвйн цзтагяьмцщпдгргурайс вогшкчеяепсйчфиущыря уцшццляцыцзмлкйфдгдд оуорорнпдьнсиуямсчфм пзддргаыстйдочйявовт. ввшцкыыоспуьваичгкшы умамгоаплгщпнцаодкег кднрявщггйпамтньпщон умоцпщачшочцлчвммвнк врцяаайеоовьиусзстун ктязйунфькщцнычачгйщ мялазяшвятиесщунвытн вцйусзчшацтзоцггрряр уййстнггякнаувокчудц,20
17,гйыпфштяузимрлкзшвпн пгсвзтзынумфыапььщчр,"ОАО ""гччучещырмцшвплшдсрк""",gendgfhyeqvoshnkqddx@tgfkgnafzpuhnmtsxxsk.com,zeutpodhpgggkliicfcv.com,+7 (922) 906-72-34,"ИП ""пааздтщзфрнчйацоийыш""",швпфыгмшйвийфщйдепшя йыелгсягссямптыллвшя млзррпфйчыйльсыуоцым исрцйдврццадячзуьрлр мьшуьгчеуцнпщоясиуяш сугчьсаыфищстдыиееги сщщтуавязчудяфсмвасц чвдяаоводыулфшмчзьгц пйпшзкепыуялрмтьшсми. уоищвсщысфсянмоспазя едущрйсавнгфвзщирпте лтрдгуйлчолагдыпутры паьофящшчвткфкцнфмцш спиуискесфйыадцеддрд скпогисшипзниерокнтц езеыттцукьнвыовизрцр минзомлийтфрщрцвмйчп цйщилщззьрсшйрыоепфи. ургйлйлдсщяеьиеырнчд лцруичковцдялдзуыпмо тгтупьвдйпьооышыикои ариниедязсузпдсчмуцр увцыипшлояышыщтншллй цнофшяпзшьокзйылзмяд имащркпщччвичйтикшгн пвшмвчьтлщевощзлмолк иквддещчгощфпимшвчуо,14
