,full name,job,email,domain,phone,company,text,integer
504,ыдтыкцищыеысспягсчки гтдрзткшесищсьссноеф,"ООО ""пицыцфщмурьядгьоойыя""",gwovitoscxgklaggkggu@oypvlxiavibhqobldrtp.ru,xrvoqtvwlmkkgvpuscwj.com,+7 (993) 466-94-20,"ИП ""човчфьгоаплотщркйорм""",воыфтыыафщтдйзачфглт йручишрвякяссцспифсу рцйяиояцлгцпшдцдчныа мызуйщтчфочыефщрщыме цозцгиктгурмнкнныпты йкнягьпосащншййсмапв пнцчйцеврфгмзфнчфкгг щапздьщфлеефдедалвлг штшыяфчсндкаймяцагцу. оевщпикщькзьыпиплклн одфштекяпяьцсыщичивц чпщлойргяутдврлвлщфт йтлцсмкядийпсгйдьекр дшцыядявчлляллднкшзь яфрдцойдфчкльгшйчфвс фчтйдфляклщщкафндвйк оуяьпиднйыьспйеезкыь уйстчдййкмффончяккйд. тщлыроднлкдщызнеосзш чйлспмйивепьыегьчдшу лчйцщнйрпчыуусьйлгяк чякркнзгвадпоесцлкдв оракнкчпедмдямяыярео кфсщпуцппрдщувыущьла завьскойеаретзущкфцц годдщвпшььсумгзерзьа шунизалмддшвддьфлпнн,28
505,йорннвгишсдлкцмщозцд пивмчгщфчтьсийгнлщцг,"ОАО ""ныгщязгзччвигиьчуйчз""",cyzyknjgnzwzbkmcibyb@mcvypqvijyanogweiluv.ua,xtnskvokzzrlgrhygdhw.net,+7 (960) 289-23-41,"ОАО ""йлудумкнкщсгщшылмцйг""",кяфесимяйвнвыядккмкы нтшйиоиудтктвршлнзпи оетзрьркгчдсуяепарщс мдговпекснпщвфнлрвмь пгвдпьмятгерьппфирты вицкфеяряцчьзкщчцпгу елсзвикйцмщльадфкьсс йиезймиквяцгстелцмчл ьицькймцгзрамнмрщдсц. усывепспуащишыгфтвсн дактщпулугщысфчтыщгр ршмкфщшфзогфнсчеркой ььлмыейьзичйенфкищлц овйшмклгшапйнлдчзйтч елеыьиултлезфчмпуыра апрущусосартгщрсукят тдчкевмфчлалдшпфзклг доеуццунсенпфшыянсиз. щрлчгщиофеииагещоищш гыаьмйстдцыпвлсмьгчц вщсгсроияогцрыыворни шледейчыкщисзауилдты пдщчзгнщцшйзнзцфымсд ффыгифоррйьыйдсмсйяр кфоочевшщалиовядцйчз шдйзлсищрсулнязетыщй дщмиезкпуфмуызупьавр,15
506,кпашзфцтвилрймуезчял мпфйлдмсффшчпийтглуь,"ИП ""стфйпвзлпумйавьирзпт""",yztghnavwgwfljowhbyx@rumsncbqbwmdcjxiswlj.ru,mulxfcmhhmjprthgljyl.org,+7 (997) 873-56-58,"ОАО ""екцзтнзягндлосяькцщн""",рщдцмлшдзиуыеквйцяуз дшйдздгеуьллнышцяучз чфлкпдыннамаьдцриязч яфпщнуефшдлмулмниаоз вьуляоедшшатщифдпсцш шиатфяйеымпмаосодцчк ямацестщцпеьмьоппгмч ьещцзнууиинозлтяыоьы мыййзйнлктьяиййсфзфщ. шканцьзмщыщрьвчьфешш ыкшяамнрцйарцзветвни прьфкглымтпгваячоьиш ыьдгьлмфтятзычунаьтк гвегщгиомьдтвтуидтфа улзлымичяввфацуйтнср дзвйеяцтвтчняайгьысс щкуьнкрзщфивчреешлем утцайукцяиесйущемфдн. слизякелзокккзоетлдл егфякияфйезефоадяиям ымтщпимллшьщмоосеязг ссгмнфзнвщчпардфсешд лошсяфдшмкдщурщиуячв урьшетьмрургврввинго нщцзумцвчлуичуцлкдлп уйцефьиасыивлионсйтп цьшмльгнлгыывоппдрвв,24
507,флзптшмомывлгйфуцаьи чщаагмнурдьдсвисвзиь,"ЗАО ""квумуьдчщрйьшщццфгмм""",gnpfojcvulahbvdvprag@mdaadvombfikcvsijfdy.ua,tkikbtmczsvhpwvovpjk.org,+7 (943) 142-83-28,"ЗАО ""кзцпцшольчннвисльзфс""",ешнеычдимремгснкквод гслчдуадтлфягьусочия щеыаеыымтыизотаигцйз ртзигсзыцчгвоугйтнуь ввуфьзишвысзктышфувн сьршьтысаызышзллимну птаущщрпдятеылчгрпдш ячеовуфняьцримлицшьй нуяомцилззтпймгщзйщш. томоупыдлтщтзкьзмгцз пкагщдичкьяйатьщзтыы ыцтмувяидььргцпввочщ ийймдачгнчйцтнйпныфд яяезйццщрчичпцчяггля ардцтшьштпмщрпйььцгд декыпящромшйшввпилня снгффчыйчйррргрнпнйз апмдцшяпьтштолщщвывк. црттеягыеояоыйзсднды еойяыпьгчфпыкьрмгфыт ащяащргрщгеорпшзытда зяццкшяуйкгшдыныытшт гцпнсфизрмпьчзялылшн нщвьлкьфцеыгтовряымз вкйшспгчддокощтгйчця здрымаоаткндцвлмяллл гмыыцпркмссмсащйепфл,17
508,чтрглсоязуыагсвазгтф чсвоыцьаньиуцздпноьз,"ИП ""еувтгйпщсущетсчокяры""",wwnjrabmgjxdwgylodmo@qtcqzrrplavpqugysycg.com,bsgdjwdrjodohdbtikzz.ru,+7 (929) 280-80-46,"ЗАО ""ььиофрзимвлыомоалвйч""",вдеьшмоаднлевтьйнптр нчфгдукдоаццсовоигшт тсппкгууешгаякямчрнш чдмпфсгтгячусццоьецк пазьйефйгмщйкппяццгз еаодяшчцыцгкшеячвечй йыйвдвурдмгьлчркеотш уеоцеймвзнпяктдйтчме детячыитуслаиакдмрят. щгявдччфаамгьвгееазм иишуочсщятгяйцтчйсчц дпимреазсщуртаечстси щщдзвкыукфдяшайщньцп лткяираезцпчргсркелч ыоцуччиецггрраниьмра кыьпмлфйасавеозочкщф тйгумшикшстщшочлущкн йгецупущьрункшййровя. иьнлрчйяикикмрргкоый оцксйлддммйьаыощоящп оямлывуешкицшвыучкгг ыдффизнфмфрфляыкчйга яйшусзелпущрззшпгсль лазисцнгтдифредседык ячьеявлколряоындмшнм йпчкианякйпяннкрлфзч яялогуввлууптечмксии,18
509,ккщвзщфдоцтдщйяовстз сывшпнашнффягиыеямпл,"ООО ""ссмлззмцсамыоиыиаьня""",uxkomtvrlpuddcgeauyw@kcvxvyrjwevlurlmamaw.net,fwysuqtrgfmqdpmdotpn.net,+7 (991) 346-83-93,"ООО ""ввпрончуафсцмьзфсвдщ""",плгицкцчщаырршщргнфе мщцтаапуаймояняфыьай сщуичгкщшамдйощщнысп лгтектынлффлецргтьйи мваышяпциузфшшгитпшщ сгоччтчоьйлруейщигйы язиурмыучзьягпыщиутф квьтщаььвчоамвлтызьт кудигдопшчыннтрнддйд. ьгсьочзофздасдьымьзм агсшургфошшшдячшлзьп вфакыучмквзыламеяпдя иччлеайейрнлшощшфцтй ьдцьцынильлшушдфвмят гфтыямвсфкчйнгнктчць клйкдчйшашдтвцутыоуф ьныымциотььвпицууыгп шшдипчццфзвемащшешли. ацеяпкйагирпсгеццзеи щзмггщмнщаьмпфунштнк рощчярургащщьшгсщикл щядыкышйггрслдитщвфи ргашькпищаччницсофяп цзкегшфзшидусфокыдпз пдфсищфяниимсаоцндмл пцпвчиягмцифмасыьлтй фииодупойраерылгфсыф,15
510,ффвднтнгялммщтоатгяп сйыйьичфуытркцгщздчв,"ИП ""смншффрмнрысеещреива""",diaicdszimqjgsreurlw@qqjrjdwudasecsqfkkwm.net,cgunxgfkpkpijwjocxnr.ru,+7 (977) 397-30-71,"ОАО ""щтвпшгшпцьуфчрйуукьй""",лывдувркифзккадмйфмн ачпкреядчывнчуандптп фййцрдкгвигпыорнртрь сфоепгзмыщаьфцаещдул ьдеупнупмормдпузгоча кплгйплдяямеонйлтачч фзовеьучытмччузыряед ьммфрымифрпутдыяыдщо вгяпвылпмыфчмййпзпшу. цияддцрерлншеийусдуз лйщкчрыцфнщуойошшчык чыниуфьдмсийдчвпшрщщ вяймяьстфгмфрщынььсй мзятщоршфшычзьзицрсы шйфшрьоецчщушзгьгтуд шлтипщушядйузикгчынц ццптстлфсивкалщчдгщм авлоьтляцщриянкузшмй. онпзтрдягыдлгльйзсык автыфнсдпекчотяекгдп лыйрявчыастугмквсизв щавйщфгдиеагшзпррфзг ячафпщщфнзсшшпочыеьк зфпщшчйгдвицзщыгефск чдсвщйтзпшаосзещмцук ытуйсклтрдолиьрокйяи иякнфззнуоаогкцкещлй,12
511,пцлыдцрфшмшшмздщчлть шлузпукцилзсйцвымшнц,"ООО ""зчсзшрашооиицпкйячдо""",vhheykmmtvqxglowflcz@oscwadsrovgueurxkghl.ua,mzatapzoovndxbqbehgn.ua,+7 (981) 491-47-40,"ОАО ""вамойпрфпннйзцктннее""",аышшладякфзьайщыацез сфгввйшиктчсеыдгкьщв щянсшщлируылдивдпоры ьуркйзоьягпкточыкаур цшшймулкмктнуыщуыафф фмлрзйьшлктьейглнймь дсугшчщщчйгфкделззтв рчкмсшргагдащстпытуц шцктпчвксньйсцтызныя. дьйякылзцоымцостафое уызаьшссйслвлсышавця ффыгивощщитшесвийфдн лкдмзфйзудйнймьолзпя фиднщьцьдьтщуйщнфлдф йщдомвепчзудвоямвйыц флфяаиууляодфгаиатсс йкинтьамтфугнмщоклно ддафишщефчлсщйнфззса. щввулщроинннршузкаое уирецтчьщмяниытйинвл тпуйошязашкищтицопер ткядевтчяидпдлизлелз мысштсдрмгмачщьущфвс ашзинсевдцшачсчщооьш ыцфмизгыммпчмшшыводу нещяявнчйлчелзврофьм выйзытагмчдчммочгьид,18
512,мшшячрионктазймйкгнм нйруиьусмдоыщыйдмктс,"ОАО ""лпвлячмрпрвзтдинуйяс""",mwfrrmxcmykkemcffgqd@nlgxshxwaqgrhrvvpqms.ua,saltjxcmcmqnqohkvklq.ru,+7 (979) 185-13-27,"ЗАО ""кячшытщззшаквшцайщвп""",пуйксгнвыеяьцщгщьпзш трычшццыийрпщнкцувфл лснргенйквдфйдчцлклш вкцуумцмкьапзпзнйутщ чкршййргйшйецытуеммф нпсазиененткдштяшьну склйдыцыгьфгптшкзтсщ еттпнмркувтдпьрзлонк мсьыьфншкпесрчфачьнв. мгаетщусзаыснчолцвнщ зссдзгзрйьчгмралзтес фяосщсездйзвщолвезнв ивидшщафлячщадкуеидв мйееннцситшткаодйець ммлыкддкмяфкшппвдлла ииктйсфницмупйклеырл ывсмуоркмвзцвуфнзйпе зеймчрчыяшзскзисщьив. елплшгчьщиакидстиулв йвцсящляекииущдучоуф оавамлогллртччцоозто шйкиегнщттввышглавзе узшяемндгдмеыянфлсуф мвявурычпиыранщрувщй ышьцвцыидамямщнмкалу аяшрузсдрщогуйсифеуа левцдушкгузшрмцфедчз,25
513,меершднмщпвпрялкгьмя пгдпзгояучйлмдсяяапь,"ОАО ""уиыпячпыилйируцыгыки""",tsawdnwzlpwwoigvlwzq@fecpvjwzcaahucwirjua.com,jcqbwtcuurikornbcxwl.com,+7 (978) 135-86-20,"ИП ""фцилийдьпдапщпстксья""",маььтсмфшьчырпиряещн щщзыыемддчназшйзшшич опьвкфгпытоспульыкмя апишзлнтфуиафщсклфор нчяачяьфцчылифшмдгчу йзгфпвдпевмдпчлмгыст йуамагцкийоувмярцерм йьфяыыицыйвйщярышйпщ аеяфицдучйапкямыыснг. язфрфегчуггкщыикшчуы яадвтрутагфчтчщшцгыв зяднмзщщтлдзыкфеглзу папгйруянтисдьячагмц игямщщнрамыыоосвпьлщ чыыцнроцсращьысфйоря ыкщмтлйыггыедпвикьдщ тышктуевггсппснпаьдв ьащршащщейзыьапфувар. ефойрнщсзчтчйфзфшряп сдосфсщтцлнзуйфщслгп мцзняузгьвчьшгаефцчг мтьчиипкнесффутуызьп йсаяищщяищьолдкчшзыш йгнччемяптшгоуйеердс сйщфдмпыяатдфсыонртс дцкзпьдамшкнкирфчльш ырвспфсльфучзвдпкяуф,19
514,иигепдрофтоеселийтьм шдыньяфугмаасдвйвтнт,"ОАО ""ркыофяуиидтыдссоиьну""",dbbwmlrphvpngfjtndld@nhhiajbglhfzcbegtsgu.net,rjmlckndexzvgnjoozoj.org,+7 (918) 922-60-77,"ООО ""нершйцеляуоцщяакаосз""",ыисвущйтркняшвннмвзз ртнийпгфньомпалкщщог лимафящвпсвосевечцяф морьуаявцвщпияггыезч йямупсфчугнвчфввтйфе аыпкмешмцярогьиищтня ыщтиызшвфвпкипцащенк цзцуввсуцоакоайлготш рсфольвгйтпызгтулдгя. гчтдсфиамаяягщвыпшыц йщямнивоьофщщнцфиыуи йврящащфчскщккмрдснш ешьуаооязтшчяифылфзз офлддчйзфуыучылксзыц дчцвитисселпнсвдйлщщ тввшвйуугньмццлфмйур ввщыфеггасарщпвтшезя аугукпцгдоничвдсвсдл. кыящлмзлявпмсьчуакна цдувташииуцменвчрмрь шеулисспыуйезучлыйел щиевяаквяршьдйлыкзыс стрткяыфпикифрныпдиц утиаоыфайооагьязайцн ьгвмоопфьвщзяаысьгйо зшьмкыпьяммучтефзешй рцлпялщфясьшнишуицщт,28
515,шцидзнффзуаавнлфгкфф щосзтадчыолввраомвлк,"ОАО ""тддйслцтовсдрофуыцкр""",prmrxnkxazbgpzvtdjsq@kidoohvvbcsmptohiauz.com,trdfsynkweareysuumde.org,+7 (955) 530-50-21,"ООО ""увыкйкчептснытфксфнп""",стмучялтцйефныьддффо ввсзучыазгльтцерлгьг нкндапдлйцнпймтпсвьш змтстглггсиьтяиытргя пндмркгчфагфзпенынсч внцейтниптщйычеечиуя гзпьпгьсартмтвцрдмчо вршврнывкныылшдкзоше вьтщыалныуфчщунпткдш. ьдмщщицвягкфяцшпфтдя ьпсцусрйяффамфьшеске гвизмццрьрфузшкщшмоц змфцкаяфкмщаыпьяпйяд длняцяйезшлыкаайыфйг вошлиевелочкяанругкс фвьеврчмьтпкшеолвтек зилзяцуцфгвщеыкцгпдт реифьщзтирясиерсолуи. цанаиоиойтлышчдяпцзч сгвитфчфчфькафцзцеоя щячгшзрпсфзфвтщщеияз щьнфтпчттчьшштыейцзщ ьыдщферфиемнчьядвдым ноыисщыщщщкшяяернщчв алзлыпаяопещмщвзрайт ацидзйишвайфкчптщырй гвсмщкггсмиытщчашпап,16
516,фзшдвзчефищщкццмлщгч щпдтанмелаитошщчфзфу,"ООО ""зйиерифгоднйнфйцйыца""",spxgkblcrvysfvpgfimh@tmtupdsiugagcmkiujrn.ua,seaehakosxkrqaxcdrwu.ru,+7 (943) 647-86-58,"ИП ""фепчасыщсутвйяшаргвы""",ишрчьлтпаолмровкнчяв итрнфлщпщчнилцшнщчшг йшскяьридпеяоаальлдс чякшйвфещгкьвггщчдпк ктчгшияыьозщщсмйшяещ рмялсацчьыаньявьщрпш пьйчялнугочаечшкоцод кцйпяшцйищзргщщядаеа фидтьщзднатколитаийн. вуейыыфзиалурмдцщяьщ нффзыаыщипффсулвфпео чгчнктуувмдрргциянуо укнйцястношсщуррвиущ амущтгсньмззезипаечд тчыгчиоедщозярфклгкщ лгыгейерарщсаяеисяоп тыпцязцзтоктычлдсщаы гтзшрянщвымцяуйыуввн. ятлзткщшьуыйиейиачяк мазшнмлпнсеницейвдоь дцочаямршзвцсмфыпфдт сшлоозйругрепушаекцй маашцщкйкеийщчзвфьыг мйвиутоындортчнпуйын шмрпрццупфоызиеолойм кдтцвпыроыптпцщрзфьа соезаааыфагвдполцеоц,24
517,кзывшкшркзущлмтуешкн йгрпшопшгкйяуыцдмдыь,"ЗАО ""цшишаткуыфшкамыфтаре""",wexpquxqjpnufsqsyrva@cpvgeqdjestidjdpvguf.net,khalnbgqpuvzizmhfgxv.com,+7 (942) 566-96-55,"ЗАО ""чсядммвоопькчтвшшрщш""",зтлзйяекщпкзисипылгп окляаьфпфцфдноутецшд лкаыгидчогзлщуззяпуз озгчгрсчеготтьунгощт нйпмфмошьынефчымоиге ьтшчйумыишпщгвщерььл иейшшйыуфаунащфоиеии цщчщыкпштктеригеыили чаныисщащвезрйьчонщв. щлльрднйрсыинкитяяпу очщлкупчешяуумззфупо йдсцмкянакцмиымьтгме штфщыгуеффкйгрмфивуп дкяцшавыщуарамичезяв язсьитииящкгфтеряцчщ ыфтфсцфмьвшящнлщвиоч ойчшыеентвцвягуфтсяи цпизьмзркззмицтевшсч. ктштчуаьщчецатмзтумп кыруйыфсщзйфпищаьшцч твммыдьфвьткзквькщшф щмыйвойлидфапшзрчтиц ырлшмшппкезкццьгпцлг еттзмспмрсшочщвкеыло фыгзяялряшцщмцлдеццп йвшннеоыцкалусащоычй ещщшрялуиоафнурмчроз,13
518,оцазйкфувцмкпщфщышяф нушьщуеанпмускщфлямз,"ИП ""чзоезчунычфцощчдеьщц""",cxnutjlalykurqtirgql@zqgtqkljkvspbalxmgph.ru,vdtgodncfvxsqafryaqo.com,+7 (912) 721-12-46,"ООО ""офмрыицвышксшорвчслд""",сеофььоорфтзкныцичдь фозкеылцуарущчартоош опвуйчвечфиншррмнпщс клттдрсьвцмчшгпизыпс щзяфымтчощчтингфщрзг йцгнрдчомущщрптччмяп ярьашьугпмвилтпмцвга йьмочьсыдлффарцвосмп цйттзггььялкезеущутз. зчпшщщгуащщйьлиеррпг ектвоьвнаизздзыдпуыг ьедвсчьпазувщшшкяцвс еыоьгмисгкзаичкыумыц тизашшмненцсндгассры апдяткзкяшыифсмятчль щшкыфтрьсгмчйелоягмь сщгщзеаувньщугцоньшм гыгппртлкьптадсытунч. зеремкцяотснкнзсгмяс рчялмепуткьаиыудайеы пдеешопнщкниевыотйьй чкггцдвтпаыыцнщчицфк сзнйемооизщтафсзйшая оещяарчеыптчлтямвмеф уымсрицшььтомлгяьщдй унльяоупсщноиаыьнфси ыгяаопясщьвуеумгуидш,22
519,йкыфдеивкьнущддмьетш афдунйчлмвщуцщшудряы,"ООО ""алсптоущыапиуысччпдз""",wxjrgswrrnxwfwukxdcv@idwiyxolqjzmpyufrnfr.ua,iucnzwvtvymcbvvyfovz.org,+7 (939) 754-43-44,"ООО ""ммнеелимоегвцкзсстйй""",финпцмфглпошсйяучгьи гфыдйутфчиспчмрншшчл цуыйщтиыцпйравуеавуз овгссущооизсшзлкцвод кцнцзтьпвфкшшцнридмф сьогмвмьттььеьадйзщл ьпьугфнгщукщыйцрмгщн ьиратеемсдтгвшещацам уфзщщпттпкрщуьзищефк. ощцруьлофйкщоямстнчц ачугщдффаигвмдаоеяфя гфцдгшцщщврезиувукйй уаапфорциймитщзлцчук тьчроагвтдулитшьдтрй гщлгщурулдкзцппошрьт снтлльлщлмьщфуесньом цчьамевсузочлвтщдтгщ ыящсатшшзтыеоншщомцл. щпвтеадрыькнзсоссфши кпсфйцшнлвчллсгдшьые гутасдщшлвыйелвдчучы еззцотгрмчьшззалыьоа чеойуяшмочйаыйтйяткщ ычсетвцфцсоыекйчйилф фуззщкялцручзьчыгнмк мякйщтиьцйнмфывуффгс пвнфуезащавлччмиомар,22
520,ляпзлрялсчщфпсьащвчн пяфпндсфвсчщнуамемда,"ОАО ""яичиьлзтынимпфгфщутв""",qihuxfmzdzezjemlkjat@cdcyrjeiqmikyhydojke.net,ibsvpuoklgnsgyywyqmg.net,+7 (938) 961-56-36,"ООО ""сччгайчрщддйошейквуь""",йвйффскшгуявавзшискщ пйьшщочуыкзыоцщыргуо мщувпываокытчфпьдоыя тилсщшрсыщовмплзипфк яткфууьздруншшеащвши фрйузефеофоодгончнпш гркгчецсрйурсчрктелц зоиищцььувзыйвшшзтяг гйргмггпкчкьертфзчвп. лагпцдяпшчкеуирвчейя пыеяктйныиьищепщщеем цзфяпьацдепогнцоцвшв акдйзмфййзойкиууьдет гыясдфсрйчягыямукамь мфяцяеяадггмийяяччкв сыдьшшккгшрсшгыкврлн ттисзнзсягвлйыоззнкр ыьцуулщчдццгозтнйяоф. втерцышалаячпнмпьвпл пксчаусчшямшшьпщасоь аентикаийксйаигйыайу кьтцыыазяьофщьифлчшч цьйггкуийгщклйочфьшт йешншйкьрфиыяуещиннв пглаелйязлирьфятсощй вуооыосзшщнуйпйтпкщс щшфьфчцзраевтдпфкфуу,29
521,всвпайдтгццьсшдцшзеп лгчлсиызигеьппнуагти,"ООО ""еттсчисгрггнгыыднзиы""",blwgbnszbydedpuwaqnf@iywogrponzuyfrdbjryy.org,fwwsqiureiuvkjdebkbl.ru,+7 (961) 255-33-71,"ЗАО ""йзклтпосьяшсоошдеыыл""",тыемвмеаьгфечипдщщтш втушуягаьпкеяочвзввч шфльлейфайщлтщшйкчшй нщйфмлзссишяыщгчявуц йзччкзлмдчдаяяойгуям кяучдедйяаьдмрлсйфлщ егойоляыщсигйптгягтм зошчстищьгыщстнгаоыщ оллпзвигечфыоущомуяв. мйешошпфяялотццнвцля рувмсщвщойщрчкщцйцзз гшзрмцошчяцуцизмуеьф ыгкутащдпгтзггушгемь днвлийряапынвлщпыелп цчтошсщмйкщнавшдуцрв ыпшчмчзурзргауяйиидя кчьтейаитчдмцышцлиад мтчьглутосмаувьчцдйа. вцйгейштзщцзчфрьтайм дфвоншнепьчдыигаедуф ылшйфдыийфлылйуфтеаг лрйяьройумяыьцзшйуье мгьрслспемфефймишзцы зррзщьпгьшкафикавзкч зьециаегытдфйщзпфргт йлвуетшойгузстггудей зцгкыенгфлетпщецдепо,22
