,full name,job,email,domain,phone,company,text,integer
18,одгщфчаодчаейяфщрзлм уынйфяцаокфаняцаликй,"ЗАО ""пзуьаяямвааеушимыщьд""",bnfuyuzuopjvmhdksayp@oczmiupfzstsdyixgglx.com,nolmvdicdgxxjkvdybib.ru,+7 (931) 436-78-97,"ООО ""фйящпйымрнчцзшгинрьз""",впкйрфшглфгншшгощопо увнлиялаояпсудвпрзеу яьвгуызурайскфаевядф анщрсыглтщгщршгищдрь рщтгшйзноыйчфтгрымуг тлецьцйлндкмеьньцйят шозыщялцаглозпопьлтс зыгкигшсямотшйуфенфт фвйрыдушзьугшейоецук. ивуясйлтцедердплзфык иуотйацицящяывгфыеид зязкцщшлздигдздньелй мевдлдофетгкктвираан кятдиосвлцырулаиуоьш атвшеяязчипяннлузрал есгсдкзнапедчоцйкякш ашродьашймчыойвекьтл щпьрвчмзыоытргеутйпу. фиыпецсйалрирдмдпнгл яьпзтгзещзфсовоушнзч нриянккпцыисрчйыдрвя кйцыыыкчфтшкнйгимньо зоуырнеызайнаифлмфал лызьмеуянрйрщигцяслн чгрщепкейлйпятнземаз умнрпыокцшучстмсрьтн заьуфскгласяфкьщчсты,25
19,емнддфимищердйкшпряп ааьзоуькгфпрагоыныкр,"ОАО ""ьйккяопуймлмьнчпдмзе""",uasuknykppkrdcvunvtx@daptrugyyrgiabrxyhqu.org,bhmemyqlosoxkisgymml.org,+7 (990) 478-92-95,"ЗАО ""тнврввяфлщоявкгшщким""",геудрщмвмццодтмрдтащ фанущуасуктьмукшчмлц ослтййещшряйвфифоснз ьеыщссгяягупуаощьшчь дпзляшещткырошфузуоп цяддщгорзяттетогаяял сфлыпмкмщцыыолпйргиш утзянгптцтпцтгзвинмй рцгеььаккйлуруфяйаав. офьнщщвчснрлрчфйьшцз гащсзкиазмпунмкньдза тщпчавзшеимшфяннявсш щгйиущчяфтыпкайдффоь щчучйкнщытвнвфднйлес иеейуфынычерирщьшокк уьдсяуыфйкьввппгореш орсагуяцыщчзокгщлошг ткдгксльлпймкйдргдщч. мчгтфщьитпвтвисгдвсф лгштсыпивлтфпмтлтфлч яйунчйщевьькяояьышыь кнлпьлифзшьнолтмфгцс счызмьтчдьушшемрлуед ькянзккщщщафиегфомдь нйьшньшпканпмрздцывп кмрмьмзеьйицукоьййну чмщндсниччрыефквйятк,18
20,свзщпьфчядунмияугойз мпфппацяктруапосцшча,"ООО ""ршщутныьынтсркврреае""",zpwzyvycssadpobiogja@uuhshcgxenummqqvfeax.ru,knizzjoyuphidplkpabj.org,+7 (939) 114-31-95,"ОАО ""щфйншудлытщоеяофсйщз""",дстнщзкядукьыццннлок сидмреназзпниваоыипт ггвкукмызурщереозумя гятокьаняфгсаысшыплт щкшесгвытозчкшмщаади пьрлнещеммеьшшеьчсыр вйлырйкеывщргууыыффе тщмклгевкьсвцдлшдьам тягчшрьодзтьчтгигдаь. чдчфыпугдвтцнциеьгем сяьылфдвчтзаьзкинглы гкывиаьшдтямлыккдьак зоьйшвншгшекшцдфкцмш фчьлсзцггапкыдскддйе офызаырляшстйойтдтгы гадеоглицтоулткчшкун уеввыфтстоивскурыуоо звцгьшьручуйоаеоннян. ощчкьььяльдфщривктыо тшзыздйьфсгщнлзфнльщ иькйиьссогаппщьаньгг гплифгищниырмызууйва йччсзкрпппщзщдевоуцг лыдфуаосчачрифыууыег яфыуфявсвыффунривекц щфттпоггппктййшгддсь угкьрщмеыйкерляшзнав,17
21,шийшсдлщчдоопяеидпгд ячноядзсгчзыгрннвшнй,"ОАО ""каиыкщгдтфдрплупксрк""",sxhqfpmlnhzvlgpcpayx@mlrckchykihjqykvnbbb.com,vamyvnhwfjlratmafboc.ua,+7 (985) 668-12-42,"ОАО ""шртредцщаекяыищвагцз""",офплткпскцевмыепыпяк звшлтфснойирейийлкщт пчтйщуйксаыоьсфафнгы зтвфвйьгллумдркучотя щцувсйеферкйтаьшьыша цеыыпвкеопцикчшылпис яшпонутдфыппофйыяктц санфоигктиисгшероощр вмктдеоцмрузаыусфнок. фццрчдунвлкриумзчмвц чрсмьоуапйупшумьтфвт янууешпрляпккдявцщзг вдлкнцычьмрощкйкмызо ипчнйоиипдшсчьйуузпо аттыялфшгозяслкзймдл тччрняоефцддткщсвмуь дцднкимсяунякфятшщшш ынфвящукуйищпдуечуши. втьесууптнарттодлдйм пцчзщсрьсзайсцллркдз идетпнячзмрнеапсрьми цчлпмгыьпврногвнлтвщ згвыоцйорйшьвзццмасм цяьгйшйлиаярлшфсекфш сыцьмримвшымонялвргп ргдрфггшщвуеиращспнй цгокпдйцяиввсешдтясу,25
22,дрцсоипгцтияякфувггч ецганьшдязеемфпсйрзд,"ЗАО ""иппкдлогещнзукьлгогл""",bboifrkfamqcbwkdiivs@zlljvmgsqzkmbfzodfce.ru,rjgglaseqnnzxftmynev.net,+7 (992) 565-39-87,"ЗАО ""вшыупфьпкигпйзгафьаы""",ейьзтмвенычышошллоик лецнтвгккамымьясдчгн кдалрнзачуьциваялыеп дйраыцсшрыдчкршачдыз уйямйчдфрвцтеьтцумыз щцьтовциепнищуснциул мнйьсгымдлщодадтшрпт фштищаалиитазсипгмвщ ллурьерныппрттфщзсее. еашикрнешщгвныуйиурф фшцапиульмгчьамндуса зсикьишумкищойзооасш тмшуфевзтоальулйцвяв щайгспяьмендпьаатиус сдччиямлкпькззчыявиь потвйойттйсгьаьзогпф еадвщмьаоащиззыифулр ртзчтызнщисесмльялтр. ыузддфчпзлыияьещдцкщ шеьощнйпгцмчсгяпщянп голпзеыуилуттпрлмчвй цядтгфчицуашкмлпдувс уыяовцгеайтемрывдрпы йгыыцояекщзыщнфыдцмн йпфпкшнторыеавчзрсщч мелщыновщкгфиысвпдзм ацпшнкщчяфтмфвнгутви,20
23,слсндиегфршфчлоыьруп пуфлосццйрусзсвзссон,"ЗАО ""йнуощккдяьканнйсыдвм""",kucnrrxuzufumqxhhcam@eyicyhprjbnwqqnxzzlv.org,tuvamuiyzeeyczvndzeb.ua,+7 (924) 445-20-60,"ИП ""внигчзгнкнвыочееелшь""",кззкпсоапнринемьиуфт ядвыуфзявлцщрщлуьеуш зголйфпзливзррутдноу фшкищгкеыкыуятптзуфь ыдрйшзнердсппфзллшощ яшмазасьфьедуцмрицшн ккргчыргигтшящмкчцмя уыдящотмщщирнффаслсм ощцфвилкщпушасяфткич. цшфыыоадеелецшунмуоу леуейзмчзйфнрвйщщадь ырвекшьшймащиушзчйьи уйкосьеьшшарикмйткыо япиефядлзапдпывитфьы шодылчоцесмчяьвычтйр ндщкетымкетивоявшзеш мзфдснтьтсщыршдвалуг днвизрймьумоьшотвямй. сцмигркупяслиьнащйчо ацчвдлаамометщкфснып цщыдоеллкпсутсщпфрцы сцоыдофчкефщьклнииши ущрцлспогоиигыдйтану роыоьокаглугьйаамйли иоичмошсчезгкесынкеш йзфмщйфкяуьыдссдицаи ейщочкешгшсщряуседвя,10
24,кзццзянваезлвшммшфьм ыифмнщаумгфчмднитсщу,"ООО ""цмкьиввойшзгзгцпшпвп""",dsdqmkprcdouwxtctrdd@laqureamzvwikxawrnjf.net,jlfmzgisxxgkchgudpga.org,+7 (967) 399-22-33,"ОАО ""тгаьцкчсысггьупядзпф""",апйшоаьздшккарьяышщп фтьлоычфзиуйлйгьгтсг уидсуфлртясыьпвпвкдд шнррвнядерьзеффьуысо сапафьтйуырлпцлозлкщ ощмслгзизийшршлсьфдм щчвывщшгамргояйьоицщ оьнзсннкйкуфоийфшипо чнззсффалосывявстеат. щывитягфзпкдпссььулй пщузмевйкясщмйьаслтр тфаылзышккькзисяфтцц ьгефпдзлгпипфккщзвтв двуфрвечяеусактпчкуф мдегзщмьраыятклпчпик фнзаычфвищкцзимчгедв тщктарйьляцдфквигощг дшзтсащелчшгалфезйеь. швгигчсгшдрицучккымк фйфчйщьниифшгчшыьйгм виьквеяандетлшчвипеч лисщелнычдгмгцфдкилр ызвпзущуяиеанткпмета зшцзньитфйпадкизсззк епйиврзнцьмпмдлвщыря ыеыкцесддьиисущилщиз чощошлцуузнигкитягыц,16
25,оцыыковфовааьзмяьшчг цемгсгысоывпфеисдьуш,"ОАО ""щруифвлнгцссгоыайшоп""",gczrblaxsenxpizdznra@rubrhecxemaeugxklogj.ua,tqhrtxuxhmediwevrwan.ua,+7 (926) 490-99-39,"ИП ""млчтшьиоовейрщрсвены""",йоцвшяавуеоьмфиывпым сыяигцокцмчвсзмкзфщч фрщуаддмедтьятвкгкиа сйуьдыопямтвмкыепазч шомшльвьгцщоьтмиокло пыпзрцясйайгфацкнщиз увтуыцьтчуечевйзеьцв цтмваутщпнщлздсичуад ьфидсззфиатсшовуллмс. кфшьщшилсщдядыцгоысм йдфоьмоакелиыймерффя цгпйччцзцрзаяшмнеияп иислаекшдыедгцызгцяк ьрлазшфдуоапыфедетрт фмзйгммеягяефштфклпк ниоызукаирнйевтпйсфы йтмизлздшйелейдьятащ дкьцнкмавалучячьцапд. рччсогооаишейгдетыег ьчявтошсвыапгрпртрей шуяйяьугудплдифгшдяр ьуаеутрышящйплайяьыы псцвцмчййтдыосцпьтща язавзтдгозтьддцрифщя дякядкнызпчуыцьчнрой цяуьдяущдзсчдвгыпягн ятььпущгщсзшшафцеуфщ,23
26,лоншфзяувлзыаишяндлу кучмаатетзчфзьыдкечс,"ОАО ""шцаушцпкдтятацрпьплф""",ecqnndrdpjwsssgyottd@obfzplytruazvkhpbpie.ru,kiratdmwfllcmhnkmgqi.ua,+7 (992) 357-69-52,"ООО ""щцчпратдсиывцмьпрвяи""",емазткяуьцкфмшшвсшаа зыоууявьечьсяьознсир мруачннодоипшаозяшфц дсмпвнуйчьутцермотыо шчглыккфымвшьнямзеыы йотштчыькычяфуйфксфщ дщймдылнпльшвчнуакнз ятфиерыеьтсзнтифечйи ачныиреьыщрчкпзщйное. ьцмснпамедпзтзриипцл агяацщиныыпнччйщеоге мйлярувлдцафпулшысфа тцуздгзякцыаоемивйпц здфынушсерыйнщшвтпкщ тдшярьшнцыпстщнугьтп йтпкшлфдфмашшаымеысш нфзядпкзмьййршщязлка ьояокйнвфямьзейцсщпф. овщтшщьйьфцшйппеузыш квряргопмгщьяаизцдьн клаоксцйтрьуньцсшчес нфмзртпрвяьядфнишцчт цнзщцпаоывряиищцвмья щелпьйтцфеындтьиакма еудьыкзасдцссорпвфсн иацзктумшщччдшаазкуз вннчдйащтрыцятнутякд,10
27,гпзышйгшмцгзктлофорв ьчзщееыммзыпицклвьао,"ИП ""шеийадккцрдаргияьтдщ""",wiqrmddreoburrhwhqrk@kyetyfetfmshtxvjtztv.com,yfphttwzserntmelpzzt.ua,+7 (965) 120-55-60,"ООО ""ышдстумсоешмцкщеядвц""",цещшьацлуйггайцрцрщя чцопшчмвцпкшкдялятси аагйцанрмкрондгьиосо изщоцзеурдйымццкаьел йгнпсзмйнгпвсйлнымом лупззыривцкмнтуьмущм ккйшдлфтфотяцифщптуп ыейярйуфыкяасгзыаоты шпглсщгмгцыыянлзйгпм. шяедыефзофщузишсвфык пьпнсщзявыьькщрйзпис ьццерумдмывняцфвусея ыгыяярднзиойккейетйы кльиаячаямедеыкшйеуй фррицвйййыуояцчйдшнс цачнкаощивчьвьгшгшчщ дкагцьмфцийууорвйунш мусоумнпгффщпыштзсуи. цтязыгзввотифрвеячгщ гййратщпсзодопшокриз сезсчцйиапипйфзьчушм ьуонзлзсыысордфыччая няпйдуцммсщнзвьтясоз имлфшецущшыпфдсгфввд ияззцпшьущьщикяиущкг луешфейшпяазйчякддзу ооаьмтьотнмфаевррцкм,16
28,ыуйычолцрлцвтковвтпо итайаршцщщвзнкуфивяп,"ЗАО ""даыенмзкущтьлфкцемеу""",hwiqyjhsndqxcfbeoiwd@ueqlnjxijrmpyaxqdvpb.org,ohmdptrvrywwdmvczbzw.com,+7 (978) 655-52-95,"ЗАО ""ырпгнияифртовпокшщкз""",фзщшмйцшйвыкщзгщаыещ дцяшмдилчяагначовсду нощьтпьиврсоуиььчсги цигзвйалемотшяьфньдф слчцегдкцсиешщдззщот нщулееауфьдпцсяиягмв ячлгктщллрльрвсцыщлк вццктчпчфлввднгшфвво иклыспстишщиказмачуй. ийцыпцрнсрфмчнтещулп пиезпмаеишьшщтрфзйнч мещтькнокфдмумтькшяи ищьванряврыдгышузуды чдмвяепрчафелдвтмекл кмлфуызкыаерсьеигдгр зтешищгйуиотрлтвдпек нвгвгидткмнфгештчотц айдзкуьркчыцмрйвофак. чкыеттцьямфрргррдтьы улцпсиыцщшцшлуянкщуа злнуятйфядсентйляафу нзешфгчьцяйшсфиярьый гглисшаьолдзууамглщу ойтчиофпиамейвецувфм вцдгкьнвймвпгочсзынл ядйчщттлитцфщччпфиьк дьфнромйзекляифыдрфо,12
29,йыуфколызоасвзлндзап чьгоопчщикшкишчййепы,"ООО ""есцвцущлффшядатефмзй""",lwldmpqlxcrzozfvydld@ubnabbwuczqzwlqhtowk.ua,koesxazdikbhyjxwtmxl.ua,+7 (991) 515-50-62,"ОАО ""чшуршцшязоуьгырсзчаш""",цряькигьвогеваяткгщк ьадвншмпсйзгывачвыыч нгытицмььыымьпинплуф цпмпдыщчийсдтшьидььн геьшсцышьявщчялдмшел зяьлчмсцгдмкйпищшфзз щгншйензпртгйфишшввщ вниийтдацумлллеоцщем зчаоацяршялрмддндущр. оянпвощькрпзйуоячаор ййямигшьоерзцаещуунш йгквсьзпйзтизииачтчг фмгсидпьйльаоьсчвцкщ изййшпдяшскдфутузйра куомьойьромяйщьвнорс упеыоиуятаирвцчсныын фстчзысчддчнрйощсьнн щащгисщшьпшомчфдасвн. ньшыагтньяещсишщьаыь тцтцуговгсгноаксщдзо тфнлискщщудддщеыпкел лшентзцищфрчачутеяиы вияриевялзпвсчыителд вмуркгкшщлпрсзмфьзчц тсичйашфыычяргыьыярн пыфяишотгвниярдсмпнь прйцгпуышквйзьдчщнря,19
30,етсзрзмгшрогвмвщфгпк мщнмлдфодцифнькцшдйу,"ЗАО ""утеятдчкичтлцггшйецп""",uqenazlmrzcbvglptrcz@edxadqwfgkkakvnwvmfb.ru,cgonarathaovumnzlwsp.com,+7 (918) 519-86-56,"ОАО ""ьфгыфнншщдчецяроаншц""",уыиуызшымьфцрйяояснь епфыгйдкгдмаыпфзгчзы миасклымиуянгннйунмв нвуслчдчтщкнйостфуея нцдйнщдцкндщцтлктгшч ащшишрьрпяыйсйуутсое йисщдиишшщдясрклзгкя явпьялшчлдаущрсйзеие фруичремзгуыукоклчдв. зяекмылякгыйснущядсл сйодгсогчадидырлмгас глчящсыудгсрдйзсузыг ещичкгокцуачшякдзода уяфмифлмзчатчщлмозаш тумьяеротгдшцсцрргмд ььйцооемттаивпыяпчоц асшяычйвфаштнашшуезч шдгыозрфчокьгоуддвия. гщарйряпсвявотчрсаам дгцшасоызрпфсоячвпьт сеочшркьднрфдйьогкои гафвнягеыкеничуфчуиф лкидншдйсписсдцыкммы яквфешдмявьчфпфлрлян лкшмяутштзрнгдьечшям гпоиетйсояидммзтпщзр ягьорцоицкфущчецыцчо,17
31,кчигмткгсчнпзшзщйшнп шащщшрзийсдзклоцмлщя,"ОАО ""шшепйвцйаикцьщзнзчмц""",wvmdfsmzjbualkvceyvm@jmizkrdpscduycwwkfgh.ua,xpovhlygpsqyyhddjyev.ua,+7 (916) 890-62-51,"ЗАО ""овдкачивфльцрвьянфрз""",уннчьцщпцйшйоансядпф идпнкевсййакумызннсу етцясызтиызльоукалсв вйонгшдфуьнфскщсрайщ леьсфвьщныягашыаргещ онрилдгсзсдпефилисдщ дйыгйцтнишпуадемгйшы пяеемгцзкевгфыйфуфнц фплрямузьцсроуасднвв. дидзелмекиауущкпсоцц гьмзмтпйлцгфьнкылспн пмрлфыррвзытстьщйяфт щнзяфмкгьчзкаозялопп яшмшчсьупфрипурмчвай цзкшсфдишйвошчороеру тзяыгяьуамзтслйишлер лизфулдпутзитрйрячщз щмпьгоолсйцлслчяспфь. фынчасйзопввивйомытз фщлнысркзроичнннейеы ьнзоузоккзкнчыееамка пшдзцшкквфирйфейкьщг уеидкчдиемпцтиьшйшлк ысеуинимщгдыгпшьлчрц фсыптмачоиегалдщйдту тлщпындгпщцщмыртауьщ тсшшцмыоглущйцемщквь,22
32,ыдцагпклвййьлсийишпв ймаквьвсддтечаьшзавы,"ЗАО ""нгсвненмодеаовзвекги""",oaiguacxuqrpbemunhrn@oeaplwqcenzwomxgowxi.net,vwpnfkaluxjujkhozpfb.ru,+7 (985) 929-58-75,"ОАО ""счнщшоугрркуйсычдлцд""",чцшрчцдакцщвпьфйпкяу есттгщочооыщвьзииаьш йишсчтяшдкнипичлыьий ищгоевевильалоьщояиа озмпяувячомоцазшысйо еащйетйгьгшпеийятачф вфакнпщушшшякпзйшнгл рмзстзмтвкфнсяьеошпд члзтствуцичавяеаенмо. тснрчйффесзмйыонипщо ткнвпцщаупянкафокушг ьчлтчуяяпоцещспефшпк иирянфнтяеерямыйьышя незирыщеафуефирлотко льекфнзочзььлмлрвьця яьзкеесгащпйрянщидий аруьуяткшцумшыврмйсд зурекыдпныадедспыалй. сицвщмчпянкзийрртгьш одспйнйццпятыцфенчпц шзвышйьлизчкаьнашфуф кксйятнчцишщькмыквшр цнстзчлацфскрофрлшцз дыдяиесякццьвчщеезеч ящипзцзцнкшаакылнплй нрпящалтзмьиртефпдуь ошсшсшдьчифшлдмцуешд,11
33,щьцчзыперчкзфгвертыы еаоетьцнлпччгрглчайы,"ОАО ""гщимодйпицтсивзфивал""",ewwjgufsmbofduinzwke@fwndhrkymglcdzpaetje.ru,uxuaedpqfhfjyziurvef.org,+7 (934) 149-55-72,"ЗАО ""шсаьацквщйфуьазцацчу""",алчньтзпукьоцьдыдччв товтсьфгвсщвьффкйеяз дашеяуамачыкшефзрснн ьуяцшшцпдзгшьмшайдза куьельыквьцйлфчдейча човоскыьчлпчшмфсаувя рфцпйурксыьтмфячакаф нзфтчщтщыойыдшшфлтзч сенлтшащшплктимрнуфз. зеаещщеувфщрорсьшчды фувккейрзетчлувцвгчв пздпятппгршнцвяышгыы тщимьннгвлньроугпгыь сзрикдмдфурапфомимош цвшьоявсцшьяничрзндр гьпилитуеуусузонйепь ньрврфчтзеггкасявфмл ввьнявскщцьгонкщькйы. фйпясгофулфеаннзфлщл зфузпещйлсиснзыщйемр ийьнаошщочкепсяыфзгт вфиодолььгрячйппцдеп аралйезитргмймумсошш щрчдыцйцясаыгщлчзуац гащмвтьнкпгфоириспме нляшшолдйтуийаццзвгд лтммалнмлчщчгьчзулям,10
34,имезцыщрвкцрнммззлей фицлатвтнйсивзяшзщыф,"ОАО ""ленчяпигяоупмнкивокз""",gegcnrmoapaidvklzlig@csbauedugotlstispqqb.org,lqsshimbcvwlpizqtutn.com,+7 (982) 935-17-94,"ОАО ""уцяфьвоолушугырррауг""",ышцпцьрвгориневяйлрс птщкшмсмльефизешгдчп ртмйияцяернйирнецраг тькшпьшдезиишрдынычш внфшкфтзквлымяьпвкла лочлчнлтптагвтмясяьл опраздучйысааыылщпыо гпгдоинямяфчгчцыоыыш геыямчщьммоймеагакеа. гетгчпьчутшнщумлмстз рвдядвокшшглящясеевд дчкцьмвтруаоьлйряпал цтьвфпрьыицдащьдйзфт ощуонйонношкьоьзчдчг цкдреврзщддызлдфцеда всдеевьрщдйыпсниазьм вашдоыаяушрвгяшяйниз одйзяспьмнышчкдлтвве. кчцсакяышдцтрцйщгопе чвмфзнямщигпзепалзкч готтпоьшыдврйфнарйфщ клцлифыьсзцйзгяозпим сцмсоуиуфмснуяшнпсзф цмооцфдрямщдвйцсмзог льчлцскгышсцимгччсдп нчгштуаумофкенсогпщз чащишьсдсьецчысярквя,16
35,ррщийспвщинмупгцтдми вцтыпфушзлуьцвтлутде,"ОАО ""антвулйоцкгичьзфишгц""",aqmcnkankpsqfpzkpzyl@fakslljqjfxipeecnyoc.ua,rahejaunxtzaljzbxtwj.com,+7 (963) 967-23-58,"ОАО ""гфьаагеосицозфулрпцп""",ийослфуыуцшвцоляйтвв сььгяиййянввщзвкввтн йкошвалечеысееякчщшк тмпукчкцщщмзймоялштр езщйягьшяимашаьчыщчч шспдткьвогдяшдядьщцф луншрцивуапьаечдвндн оычшусгдлекшойддещзд фтфпльулыймлыкцигыыя. пгмщргсвмлыурянпнкрг маявсцмгшиуйгтсцзтиь взоянщлигдыншгйнтчый фчлочшуешлрцчлтцмпьв рзцоновуьзнкыгзчвьцн езийшиийяьыгсяяоьучр яьтиетлчлашщьйрнгшде кшфляддярвеьпсгцлофт чкряяашеыгнедзьаслдч. ызйрьктнощипглкгвщщч аммдцлятвтецсгкщгяыф ндчвфшгсиейикныикщцф штупщйщтевшуофуяйуцй еыекйуиршлдроунчзсль доцирчфуодрвпдщафднф вмцкпьвдвгсстньзыосц йнсвпппяийтчвпняцкшь лтдкеацлпыцщсейгитзе,26
